,ASIN,product,brand,name,date,score,title,comment
0,豆柴犬,2021年6月1日,4.0,まだ紅茶のカフェインレスは発展途上の割りに頑張ってる。,コーヒーのカフェインレスと違ってまだ紅茶のカフェインレスは発展途上ですね。その中でもこの商品はかなり味も香りも満足です。発展途上だけあって香りが少し足りないので星４つ。でも現在のカフェインレス紅茶の中では頑張ってる割りにお値段もまあまあです。わたしは紅茶はアールグレイしか飲まないので香り付け頑張ってる方だと思います。良い商品に出会えました。約２か月後リピのレビュー箱が潰れて届きました。梱包がただの袋で来たせいです。箱に袋を立て掛けるように出来てるのに使えません。味はいいのに残念です。今回発送の梱包については☆付けたくないです。,,,
1,ちー,2016年9月13日,5.0,妊娠授乳期の癒しでした,いい香りで癒されました。デカフェの紅茶があって良かったです。カフェインのことが気になる時期に安心して飲めました。あまり気にしなくていいのかもしれないカフェインですが、なーんとなく気になって落ち着かなかったのでデカフェで探して見つけました。,,,
2,the・bamboo・eater,2015年2月6日,5.0,ちゃんとおいしい！,トワイニングとジャンナッツを普段は愛飲。妊娠したのでアーマッドにもトライしましたが、デカフェありの味。試しにこのティーブティックを買ったら、ものすごく美味しくて気に入りました。,,,
3,林,2018年3月22日,5.0,美味しい！,色々ほかの商品のレビューを見て、こちらを選びました。美味しいし香りもあります。カフェイン入りのと比べるとやや味は薄めですが気になりません。,,,
4,ぷー,2015年6月23日,5.0,手頃な値段でおいしい,職場でも自宅でも、妊娠中は手放せませんでした。しっかり紅茶の味。よくミルクティーにして飲んでいました。また妊娠したときは絶対買います！,,,
5,milk,2017年4月15日,5.0,デカフェ紅茶,妊娠中のため、ノンカフェインやデカフェの紅茶を探していました。この紅茶は香りもよく美味しいので、ストックしておきたかったので6パックのセットはありがたいです。他のフレーバーもあるので、色んな味のセットもあれば嬉しいですね。,,,
6,ゆうこりん,2017年11月9日,5.0,安心品質,デカフェでもこちらの商品は安心できるし 何よりアールグレイの香りがとても良いです,,,
7,あい,2017年6月7日,5.0,妊娠中に購入,味も香りもなかなか良くて満足できました！ティーパックなのでお手軽だし、オススメです。,,,
8,ayayui,2014年2月1日,5.0,ノンカフェインとは思えません,妊娠中のため、ノンカフェインのものを探していました。妹にプレゼントされたところ、きちんとした紅茶の味がしておいしく、リピートです。,,,
