,ASIN,product,brand,name,date,score,title,comment
91,B00FQZRSUY,明治ほほえみ らくらくキューブ 27g×16袋入り,明治ほほえみ,azu,2020年9月14日,3.0,誰でもできる,割高ですが、外出時や夜中の授乳にとても便利です。夜中は寝ぼけてよく粉ミルクをこぼしてしまい、眠い中よく床掃除をしていましたが、こちらにしてからは床にこぼさなくなりました！使いかけの時もクリップで止めやすいパッケージです。
92,B00FQZRSUY,明治ほほえみ らくらくキューブ 27g×16袋入り,明治ほほえみ,ヴクァンドゥク,2021年3月30日,2.0,良い商品です。,リピート購入しました。以前はおまけが「ほほえみらくらくミルク」試供品１箱でしたので、今回も期待していましたが今回は、試供品はもらえず除菌シート1つだけでした。
93,B00FQZRSUY,明治ほほえみ らくらくキューブ 27g×16袋入り,明治ほほえみ,abab,2020年8月21日,5.0,割高ですがとても楽です。,味はわからないですが、グビグビ飲んでくれてます。キューブなので持ち歩きにも便利です。お湯ですぐに溶けます。お値段がもう少し安ければ嬉しいところです。あと数ヶ月ぐらいですがお世話になります。
94,B00FQZRSUY,明治ほほえみ らくらくキューブ 27g×16袋入り,明治ほほえみ,ccd,2019年2月17日,5.0,おまけは除菌シートでした,１ヶ月に大体１回は頼むペース。完ミなのでたくさんはいってるのがとても助かるし、ペースが１ヶ月に１度程なので忘れずに続けられる
95,B00FQZRSUY,明治ほほえみ らくらくキューブ 27g×16袋入り,明治ほほえみ,ちくわ,2019年7月1日,5.0,お出掛けの時便利！,お湯をサーモスに入れて持ち歩いて、出先でキューブを溶かすとミルクが作れます。粉で持ち歩くより、とにかく簡単で楽です。
96,B00FQZRSUY,明治ほほえみ らくらくキューブ 27g×16袋入り,明治ほほえみ,sakura,2020年5月10日,5.0,ごくごくのんでます,大容量の缶よりも個包装されているこちらの方が使いやすいです多少お湯がぬるくても溶け残りなく解けて使いやすかったです
97,B00FQZRSUY,明治ほほえみ らくらくキューブ 27g×16袋入り,明治ほほえみ,Hashiro Maeda,2019年11月6日,4.0,ok,計量が簡単、こぼれないし、よく飲んでくれるのでうちでは問題ありません。ただ、箱の中には箱があってゴミが多いです。アマゾンのダンボール箱もあるのに・・。わざわざ別の箱にしなくても、区切り用の紙を挟む等で十分だと思います。少しでもゴミが減ってほしいと思います。マイナス１ですが、今後の期待をこめて・・☆
98,B00FQZRSUY,明治ほほえみ らくらくキューブ 27g×16袋入り,明治ほほえみ,よっしー,2018年6月8日,4.0,缶よりも使いやすい,キューブで計量要らず。よく溶けてくれる。粉が飛び散らない。携帯しやすい。ピッチリ密封なので衛生的。取り出しやすかったらもっといい。ミルクに触る必要のないはずが、ピッチリ袋から引っ張り出さないといけなく、結局は手で触らざるを得ないという...ここだけ何とか改良していただければ。
99,B00FQZRSUY,明治ほほえみ らくらくキューブ 27g×16袋入り,明治ほほえみ,にゃらら,2018年11月16日,5.0,箱が多い以外は満足,粉ミルクだと開封してから1ヶ月で捨ててくださいと栄養士さんから言われました。うちの子は1日一回飲むか飲まないかなのでキューブを購入。計量要らずで簡単なとけるし便利です！何より外出の際の持ち運びには最適です！！！
100,B00FQZRSUY,明治ほほえみ らくらくキューブ 27g×16袋入り,明治ほほえみ,Amazon カスタマー,2017年10月20日,5.0,産院のときからコレ。,粉が散らかるのが嫌で、らくらくキューブのみを使用中で、お値引きに合わせ、まとめて購入しています。
101,B00FQZRSUY,明治ほほえみ らくらくキューブ 27g×16袋入り,明治ほほえみ,みけ,2017年2月1日,5.0,便利,キューブタイプは便利でいいです☆産院でも使用していたので安心感もありましたし…生まれて間もない頃は飲みきれる量が少量だったので、20mlずつ、量の調節ができて無駄なく作れるのが良かったです。
102,B00FQZRSUY,明治ほほえみ らくらくキューブ 27g×16袋入り,明治ほほえみ,poyopoyo,2018年2月7日,5.0,ストック必須！,買いに行くと同じくらいの金額なので、Amazonで買ったほうが手間が省けます。粉より割高ですが、急ぎの時にはかなり重宝します。
103,B00FQZRSUY,明治ほほえみ らくらくキューブ 27g×16袋入り,明治ほほえみ,rosegarden,2015年3月14日,3.0,とにかく便利！,本当はダメなのでしょうが、冷ます時間が惜しくて、クリクラのサーバーから6割くらいお湯を入れてのこりは水を入れてます。粉だとそれで問題無く溶けるのですが、キューブはなかなか溶けません。あと袋が出しにくくてイライラします。が、外出用はやはりこれですね…。
104,B00FQZRSUY,明治ほほえみ らくらくキューブ 27g×16袋入り,明治ほほえみ,みーちゃん,2014年6月4日,5.0,孫に,景品つきでお得に購入、配送料も無料で助かってます。ほほえみは母乳に近い成分とのことで産院でもこちらを使ってましたしどこのドラッグストアでもそう大きくは値引きしてないでのでアマゾンでリピートしてます。缶は自宅用、こちらのキューブは旅行やお出かけ用で使いやすく重宝してます。
105,B00FQZRSUY,明治ほほえみ らくらくキューブ 27g×16袋入り,明治ほほえみ,Amazon カスタマー,2020年3月6日,5.0,簡単に作れます！,粉ミルク界で最強ではないでしょうか。
106,B00FQZRSUY,明治ほほえみ らくらくキューブ 27g×16袋入り,明治ほほえみ,まっさん,2020年8月30日,4.0,お得,缶より割高ではあるが使いやすさが断然勝る。ささっと作れるので本当によい。でもAmazonの定期便で安かったはずが、値上げされていていました…。
107,B00FQZRSUY,明治ほほえみ らくらくキューブ 27g×16袋入り,明治ほほえみ,Aquate,2016年6月26日,5.0,とても便利,とても使いやすいので、不慣れなお父さんでもできると思います。粉より多少割高で、１０cc単位の調整は難しいことくらいがマイナスポイントかな。景品付きの大容量パッケージなので、買ってよかったです。
108,B00FQZRSUY,明治ほほえみ らくらくキューブ 27g×16袋入り,明治ほほえみ,ABCD,2019年9月11日,4.0,定期便が…,My daughter loves this milk. It very convenient to use. I don't have to worry about the powder being spilled when we go out.
109,B00FQZRSUY,明治ほほえみ らくらくキューブ 27g×16袋入り,明治ほほえみ,Amazon カスタマー,2018年11月12日,5.0,使いやすいのは間違いない,この容量はすぐになくならなく、ミルクの買い忘れなどには困りません！店頭で買うよりお得ですね！リピートしています(^^)
110,B00FQZRSUY,明治ほほえみ らくらくキューブ 27g×16袋入り,明治ほほえみ,mhadz,2021年5月2日,5.0,Convenient for going out,測らなくて良いし、こぼさないし、夜眠くても袋をあけてパッと入れるだけ。少しでも楽してイライラ解消して子供に笑顔向けてた方が家庭円満です
111,B00FQZRSUY,明治ほほえみ らくらくキューブ 27g×16袋入り,明治ほほえみ,Amazon カスタマー,2018年1月24日,5.0,とにかく助かる,哺乳瓶拒否を防ぐために１日一回ミルクをあげています。溶けやすいし分かりやすくて良い。値段も近くの薬局より安いです
112,B00FQZRSUY,明治ほほえみ らくらくキューブ 27g×16袋入り,明治ほほえみ,Nguyen Hoan,2014年9月6日,5.0,子供が気になった物です。,粉ミルクで育てていますが、持ち歩きはこちらを愛用。とにかく便利です。ただ140ｍを作りたい時は少々不便でした。半分に割れないので。現在は160ｍなので一本使えばよくて、しかもお湯に溶けやすいです。すごくいい商品だなと思います。考えた人すごい！！
113,B00FQZRSUY,明治ほほえみ らくらくキューブ 27g×16袋入り,明治ほほえみ,sarasara,2019年7月24日,5.0,も～！楽！,很好，以前从不去评价，不知道浪费了多少积分，现在知道积分可以换钱，就要好好评价了，后来我就把这段话复制走了，既能赚积分，还省事，走到哪复制到哪，最重要的是，不用认真的评论了，不用想还差多少字，直接发出就可以了，推荐给大家推荐
114,B00FQZRSUY,明治ほほえみ らくらくキューブ 27g×16袋入り,明治ほほえみ,うにょ,2018年8月19日,3.0,お出かけ用にしています。,溶けやすいし、持ち運びやすいのでいいですが、袋から一粒づつ出しにくい。あとは価格がちょっと高いです。
115,B00FQZRSUY,明治ほほえみ らくらくキューブ 27g×16袋入り,明治ほほえみ,欧扬,2019年4月27日,4.0,便携，出门带一条很方便,キューブ1個が40cc分で、割れ目で２つに割れば20ccのミルクがつくれる。ミルクの量を簡単に調整出来るので気に入っている。袋から取り出しにくいので、☆−1。
116,B00FQZRSUY,明治ほほえみ らくらくキューブ 27g×16袋入り,明治ほほえみ,ひにゃのママ,2019年5月17日,5.0,価格が高いのと出しづらい。,4ヵ月から粉ミルクデビュー。何でもよく飲む息子なので、扱いやすいこちらをリピートしています。最初は開けづらいと思いましたが、袋をごしごしこすって空気をまわすと簡単に手で開けて簡単に出てきます。
117,B00FQZRSUY,明治ほほえみ らくらくキューブ 27g×16袋入り,明治ほほえみ,R.K.,2018年7月12日,5.0,袋から取り出しにくいのが残念！,母乳がメインなのでこちらに！離乳食始めてから母乳が減った気がしたのでこちらを買いました。これだと本当に時短ですぐ作れます(^^)
118,B00FQZRSUY,明治ほほえみ らくらくキューブ 27g×16袋入り,明治ほほえみ,messiah,2020年1月11日,5.0,扱いやすい,外出するときなど重宝しています。
119,B00FQZRSUY,明治ほほえみ らくらくキューブ 27g×16袋入り,明治ほほえみ,amazonカスタマー,2017年12月18日,5.0,母乳が9割！,ほとんど母乳で、たまに足りない場合ミルクをあげる。こちらの便利なバックで、もたないしないように使えるので、良いと思うんです
120,B00FQZRSUY,明治ほほえみ らくらくキューブ 27g×16袋入り,明治ほほえみ,活嬉,2019年1月22日,5.0,キューブ形状は便利です,作りやすくお湯にもすぐ溶けます。小分けに袋で分かれてるので保存も良くて便利です。
121,B00FQZRSUY,明治ほほえみ らくらくキューブ 27g×16袋入り,明治ほほえみ,Amazon カスタマー,2019年9月15日,5.0,楽チン,産院でこちらを使用しており、混合なので継続して使っています。買いに行くと重いのでアマゾンで購入しています。聞いていた通り、若干袋から出しにくいですが、許容範囲だと思います。
122,B00FQZRSUY,明治ほほえみ らくらくキューブ 27g×16袋入り,明治ほほえみ,ひろひろす,2018年11月29日,5.0,小分け袋が保存に,色々なサイトや店を見比べて、オマケが充実しているコイツを購入しました。すぐに届けてくれるし、楽です。
123,B00FQZRSUY,明治ほほえみ らくらくキューブ 27g×16袋入り,明治ほほえみ,Amazon カスタマー,2017年10月2日,5.0,楽です,ありがとうございました、娘も喜んでました。なかなか、手伝いに行くことが出来なく、何か力になりたくて、こちらの商品を送ることに決めたので凄く助かりました。次回も利用させてもらいます、
124,B00FQZRSUY,明治ほほえみ らくらくキューブ 27g×16袋入り,明治ほほえみ,くま,2019年9月12日,4.0,オマケが充実,手軽で孫用に買い置きしています。気に入ってます
125,B00FQZRSUY,明治ほほえみ らくらくキューブ 27g×16袋入り,明治ほほえみ,oyulidon,2020年11月2日,5.0,孫に,とりあえず安かった！
126,B00FQZRSUY,明治ほほえみ らくらくキューブ 27g×16袋入り,明治ほほえみ,さくら,2018年3月14日,5.0,手軽で便利です,量が簡単に変えられて粉がこぼれることもない。　半年までのお出かけする時は必須です。　それ以降は量が必要で割高感かな。
127,B00FQZRSUY,明治ほほえみ らくらくキューブ 27g×16袋入り,明治ほほえみ,aaa,2019年7月23日,5.0,安かった,キューブだと分量を計る必要がなくて楽！味も甘くておいしい☆ごくごく飲む！
128,B00FQZRSUY,明治ほほえみ らくらくキューブ 27g×16袋入り,明治ほほえみ,CCレモン,2017年2月9日,4.0,愛用しています,完母の8ヶ月の息子の離乳食用に購入しました。上の子のときも使用していましたが、ミルク缶で買ってしまうと使い切れないため、こちらは大変便利です。
129,B00FQZRSUY,明治ほほえみ らくらくキューブ 27g×16袋入り,明治ほほえみ,ナオコ,2019年9月16日,5.0,画期的！,孫に買っていますが使い勝手が良くて大変重宝しています！
130,B00FQZRSUY,明治ほほえみ らくらくキューブ 27g×16袋入り,明治ほほえみ,tomato,2019年11月7日,5.0,離乳食用に,飲みやすい、すごくいいです。
131,B00FQZRSUY,明治ほほえみ らくらくキューブ 27g×16袋入り,明治ほほえみ,さいとうさん,2020年1月10日,5.0,使いやすくて便利！便利！,哺乳瓶に入れる際、袋からキューブが出にくいです。もっと余裕のある袋にしてほしい。
132,B00FQZRSUY,明治ほほえみ らくらくキューブ 27g×16袋入り,明治ほほえみ,Amazon カスタマー,2020年9月18日,3.0,飲みやすい、すごくいいです。,定期便でお得用を1年頼んでいて今回初めて景品がミルクでなくおしりふき二個でした。高くはないけどお得ではなくなったので残念です。
133,B00FQZRSUY,明治ほほえみ らくらくキューブ 27g×16袋入り,明治ほほえみ,Amazon カスタマー,2021年6月1日,5.0,１つだけ不満が…,娘が生まれてから3回目でほほえみにしました！飲んでくれるようになったので、ずっと使っています♪
134,B00FQZRSUY,明治ほほえみ らくらくキューブ 27g×16袋入り,明治ほほえみ,Amazon カスタマー,2018年1月14日,5.0,今回お得用の景品がおしりふきでした,外出にも便利だし、粉ミルクだと夜中の調乳でボーっとしてたら何杯入れたのかわからなくなってたけど…キューブなら目で見て確認できるので良いですよ。主人でも簡単に調乳できてます。
135,B00FQZRSUY,明治ほほえみ らくらくキューブ 27g×16袋入り,明治ほほえみ,mai,2019年12月8日,4.0,いいです,使い勝手が楽で 早く溶けます
136,B00FQZRSUY,明治ほほえみ らくらくキューブ 27g×16袋入り,明治ほほえみ,アササ,2018年5月6日,5.0,外出用に購入,安くて最高でした！お出かけにかならず持って行っています！ありがとうございました！
137,B00FQZRSUY,明治ほほえみ らくらくキューブ 27g×16袋入り,明治ほほえみ,Amazonさん,2018年4月24日,4.0,賞味期限1年未満,生後5ヶ月混合で、1ヶ月もちます。赤ちゃんによって個人差あると思うので2ヶ月毎の定期便でもいいかもしれません。すでにお安いとおもいますが、もう少し安くなると更に嬉しいです！
138,B00FQZRSUY,明治ほほえみ らくらくキューブ 27g×16袋入り,明治ほほえみ,あげは,2018年3月5日,4.0,ありがとうございます！,定期便だととても安く購入できます。特典で届いた手口ふきもコンパクトサイズで外出時に活用しています。
139,B00FQZRSUY,明治ほほえみ らくらくキューブ 27g×16袋入り,明治ほほえみ,Amazon カスタマー,2018年3月29日,4.0,助かってます。,子供が１歳になるまでお世話になりましたが定期購入の価格じゃないと地元のドラッグストアの方が安くなってしまう。製品に関しては粉ミルクと違ってキューブになってるので分量の測りやすさは無知な私にとっても助かりました。また子供が生まれたらお世話になりたいです。
140,B00FQZRSUY,明治ほほえみ らくらくキューブ 27g×16袋入り,明治ほほえみ,ゆ,2017年8月12日,3.0,安い,粉末タイプより溶け残りが多くなりやすいです。外出時に適量作れるので便利
141,B00FQZRSUY,明治ほほえみ らくらくキューブ 27g×16袋入り,明治ほほえみ,KD,2018年12月31日,4.0,定期購入がオススメ、それ以外は薬局より割高？,粉ミルクと違ってキューブタイプなので測りいらずで手軽です。すぐに溶けるので使いやすいです。
142,B00FQZRSUY,明治ほほえみ らくらくキューブ 27g×16袋入り,明治ほほえみ,横浜市のAmazn カスタマー,2017年6月10日,4.0,溶け残りが気になる,外で作りやすく、コンパクトです。ブロックを手で割りにくいので、個々になっていた方がいいかもしれません。
143,B00FQZRSUY,明治ほほえみ らくらくキューブ 27g×16袋入り,明治ほほえみ,nat,2018年8月8日,5.0,よかった,一袋で200mlまで作れると言うところがすてきです。こなが飛び散ることもないし、最高です。
144,B00FQZRSUY,明治ほほえみ らくらくキューブ 27g×16袋入り,明治ほほえみ,もや,2021年1月31日,5.0,便利です,リピしています！産院でこちらを使用していたので、安心して与えることができます！
145,B00FQZRSUY,明治ほほえみ らくらくキューブ 27g×16袋入り,明治ほほえみ,しろねこ,2019年5月16日,5.0,使いやすい,母乳が足りず、産院の看護師さんからオススメいただき、生後ずっと使っています。溶けやすい1個40m l時間短縮(赤ちゃんが泣いてる時大切)夜中でも手間がかからないので、母親の重宝です。これからも使う予定です。
146,B00FQZRSUY,明治ほほえみ らくらくキューブ 27g×16袋入り,明治ほほえみ,Amazon カスタマー,2019年6月15日,4.0,何度も,ほぼ母乳でいけてしまったのでかなり余ったが、料理やパン作りに溶けやすかったので扱いやすくて良かった。
147,B00FQZRSUY,明治ほほえみ らくらくキューブ 27g×16袋入り,明治ほほえみ,やんやん,2018年6月24日,5.0,ずっとお世話になっています。,持ち歩きにとにかく便利！軽量いらないのもストレスフリーです。もうスプーンで測るのには戻れなさそうです。いつもおまけでいただける手口拭きも、持ち歩き用に重宝しています。
148,B00FQZRSUY,明治ほほえみ らくらくキューブ 27g×16袋入り,明治ほほえみ,プチ,2019年2月17日,4.0,扱いやすい,外出のとき便利です！もう少しお安くなると更に良い
149,B00FQZRSUY,明治ほほえみ らくらくキューブ 27g×16袋入り,明治ほほえみ,優綺,2018年5月19日,5.0,とても助かっています。,満足です、　次回まだ利用します。宜しく、お願いします。ありがとうございました。
150,B00FQZRSUY,明治ほほえみ らくらくキューブ 27g×16袋入り,明治ほほえみ,けいこ,2019年2月10日,5.0,便利！,一人目出産の時に使っていたので二人目も同じものを購入しました(^^)これしか使ったことがないですが使いやすいです(^^ゞ
151,B00FQZRSUY,明治ほほえみ らくらくキューブ 27g×16袋入り,明治ほほえみ,ジュラ紀船長,2019年1月28日,3.0,満足です、　次回まだ利用します。宜しく、お願いします。ありがとうございました。,外出時に便利なので使っています。いろんなミルクを飲ませていますが、どれも嫌がることなく飲みますし、うんちの変化なども特にありません。袋から少々出しづらいので☆3にしました。
152,B00FQZRSUY,明治ほほえみ らくらくキューブ 27g×16袋入り,明治ほほえみ,Amazon カスタマー,2018年10月9日,4.0,景品はどこ？,量がちょうど良いです。固形の粉ミルクであるため、分量が調整しやすいです。
153,B00FQZRSUY,明治ほほえみ らくらくキューブ 27g×16袋入り,明治ほほえみ,ころろ,2016年12月22日,5.0,便利！,旅行のためにキューブタイプミルクを購入しました。低めの温度でも溶けやすく、計量もしやすい、旅行先の授乳室などで調乳するのも使いやすかったです。
154,B00FQZRSUY,明治ほほえみ らくらくキューブ 27g×16袋入り,明治ほほえみ,ひよこまる,2018年5月19日,4.0,ミルクを適量つくるのに最適,簡単で重宝します。産院がこちらを使っていましたので購入しました。
155,B00FQZRSUY,明治ほほえみ らくらくキューブ 27g×16袋入り,明治ほほえみ,Amazon カスタマー,2019年8月20日,5.0,使いやすく便利,初めてキューブを使ったけど、計る手間がいらなくて感激！！ミルク作りが一気に楽になりました(^^)
156,B00FQZRSUY,明治ほほえみ らくらくキューブ 27g×16袋入り,明治ほほえみ,キー,2018年5月14日,5.0,簡単,測る手間なく便利です。おまけにおしりふきが付いていました。また買いたいです。
157,B00FQZRSUY,明治ほほえみ らくらくキューブ 27g×16袋入り,明治ほほえみ,ちんとも,2018年4月25日,5.0,ミルク作りが楽に,便利！何度も買ってる！むしろ、かなの方を使ったことありません（笑）
158,B00FQZRSUY,明治ほほえみ らくらくキューブ 27g×16袋入り,明治ほほえみ,ぽにょ☆,2019年6月14日,5.0,やっぱりキューブが使いやすい,キューブなので少量からミルクを作ることができて便利です。お出かけのとき、外出先でも主人も簡単にミルクを適量作ることができました。
159,B00FQZRSUY,明治ほほえみ らくらくキューブ 27g×16袋入り,明治ほほえみ,パンダさん,2018年11月14日,4.0,おすすめ！,計らずに必要な分だけちぎって使えるし、すぐに溶けるので、便利だと思います。
160,B00FQZRSUY,明治ほほえみ らくらくキューブ 27g×16袋入り,明治ほほえみ,白兎,2019年3月8日,4.0,完母のお守り,産院で使用していたので、そのままこちらを購入しています！粉式は使ったことがありませんが、キューブで使いやすいし、持ち運びも便利です★
161,B00FQZRSUY,明治ほほえみ らくらくキューブ 27g×16袋入り,明治ほほえみ,岡林美香,2017年11月30日,3.0,移動時の持ち運びがすごく便利,粉ミルクよりも衛生的で持ち運びにも便利だと思いますが、若干袋から出しにくいのが難点です。
162,B00FQZRSUY,明治ほほえみ らくらくキューブ 27g×16袋入り,明治ほほえみ,Amazon カスタマー,2014年10月4日,5.0,持ち運び便利！使い勝手も良い,1人目の時はサンプルは貰ったものの使わず。最近二人目を出産したのですが、色々試してみようと思い、買ってみました。キュービックなのでパパにも作りやすいですね。携帯にも便利なので使い続けようと思います。定期便を利用しようと思います。
163,B00FQZRSUY,明治ほほえみ らくらくキューブ 27g×16袋入り,明治ほほえみ,poteharu,2020年1月21日,5.0,軽量が楽,持ち歩きにキューブタイプはこぼれることも無くとても助かってます！！
164,B00FQZRSUY,明治ほほえみ らくらくキューブ 27g×16袋入り,明治ほほえみ,さとやよ,2017年9月2日,5.0,使いやすいです,すぐ溶けて外出先では非常に便利です。大容量パックよりもこちらの方が1パック辺りの値段が安いので、必ずこちらを購入しています。
165,B00FQZRSUY,明治ほほえみ らくらくキューブ 27g×16袋入り,明治ほほえみ,MAO*mama✿,2020年11月28日,5.0,持ち歩きにも計らず使えて便利！！,産院で使用しており、キューブなら測り間違えることもないため便利です！
