,ASIN,product,brand,name,date,score,title,comment
304,B00FQZRSUY,明治ほほえみ らくらくキューブ 27g×16袋入り,明治ほほえみ,そのへんの主婦,2017年9月29日,4.0,簡単、便利。でも味はあまり…,突如断乳になり購入。今までほぼミルクを使ったことのない自分にはとても使いやすいです。スプーンでいちいち計る必要がないし、キューブを触らずにそのまま袋から押し出せる仕組みも衛生的で有難いです。外出時も持ち運び便利です。景品付とありましたが、手足拭きシートが入っていました。期待してませんでしたが嬉しいです！ありがとうございます。
305,B00FQZRSUY,明治ほほえみ らくらくキューブ 27g×16袋入り,明治ほほえみ,ぽんた2525,2014年12月1日,4.0,良いです,いつもAmazonで購入しております。キューブ型は高めですが小分けなのは便利です。湿気ったり心配ないのでお勧めです。景品付きとありますがあまりお得感はありませんね。４８個の時のほうがお得な時もありました。
306,B00FQZRSUY,明治ほほえみ らくらくキューブ 27g×16袋入り,明治ほほえみ,Amazonカスタマー,2015年9月1日,5.0,便利！,ほぼ母乳ですが、たまーに必要な時用に購入。パパでもおばあちゃんでもわかりやすく調乳できて助かってます。パパはキューブタイプのこれじゃないとミルク作れないんじゃないかな(^^;)お出かけ先でもミルクをこぼすことなく作れるのは本当に便利です。
307,B00FQZRSUY,明治ほほえみ らくらくキューブ 27g×16袋入り,明治ほほえみ,レビュアー,2018年2月15日,3.0,いつも愛用しております,一袋単価が安いから買ってみましたが、こちらは一袋に入ってるキューブは4個なので割高です。通常一袋キューブ5個入りです。生後間も無い間はポーッとしてたし…調乳2〜3キューブだったし…で、気付きませんでした。ある時、ストック箱に補充してたら袋の高さが違うって気付いて。お試しや、お出かけ用なら良いかも！
308,B00FQZRSUY,明治ほほえみ らくらくキューブ 27g×16袋入り,明治ほほえみ,きじとら,2015年11月19日,5.0,便利です,他社の粉末スティックタイプ愛用してますが、キューブが思ったより早く溶けたのに驚き。ミルカーなどを持ってないので哺乳瓶に直接粉ミルクだけ入れて持ち歩くことが多く、少しでも哺乳瓶内が濡れてる場合粉が固まってだまになり、後で溶かす時の億劫でしたが、その苛々は解消されます。200mlぶんくらい欲しいけど
309,B00FQZRSUY,明治ほほえみ らくらくキューブ 27g×16袋入り,明治ほほえみ,monro,2016年7月11日,5.0,キューブ4個で一袋！,他にもスティックタイプのミルクはありますが、スティック１本で作るミルクの量が決まってしまうのに対し、キューブタイプだと赤ちゃんの飲む量に合わせて作れるのが便利です。ただ開封してしまうと保存がきかないのですぐに使わないときはもったいないですが。
310,B00FQZRSUY,明治ほほえみ らくらくキューブ 27g×16袋入り,明治ほほえみ,Amazon カスタマー,2015年10月27日,4.0,便利,(2016年4月にもともと別だった新旧の景品なしと景品ありのレビューが統合されたようです。）他の方も書かれているように、Amazonは価格が安定しないですね。今までの感じだと安い時は3700円ぐらい、定期便で3500円ぐらいです。その他、プライムファミリーでたまにクーポンが出て、その時にAmazonが提供する商品が品薄になり、結果として高くなる（他社で価格が高く設定してあるものが表示される）ことが多いようですので、クーポンが出た時は要注意です。前は旧バージョンのベビーフードのついていない方  明治 ほほえみ らくらくキューブ 27g×48袋入り  を定期便で購入していたのですが、2015年10月に「販売元で発売中止」（本当？）になったとのことで、  明治 ほほえみ らくらくキューブ 27g×48袋入り (ベビーフード付き)  に変更になるという通知を受け取りました。当時価格は3
311,B00FQZRSUY,明治ほほえみ らくらくキューブ 27g×16袋入り,明治ほほえみ,がおぉぉぉ,2017年3月23日,5.0,おでかけに便利,これでミルクを作って与えると、凄い勢いでゴクゴク飲んでいきます。計量する手間がないので、夜中でも簡単にミルクが作れます。ただ、コストは高く感じます。１週間で、１箱のうち半分使いました。
312,B00FQZRSUY,明治ほほえみ らくらくキューブ 27g×16袋入り,明治ほほえみ,Amazon カスタマー,2013年6月27日,5.0,使いやすい,スティックタイプよりコンパクト。ミルクの粉末が飛び散らない。量の調節がしやすい。旅行やお出かけの時は便利です。
313,B00FQZRSUY,明治ほほえみ らくらくキューブ 27g×16袋入り,明治ほほえみ,ＰＥＳ,2014年10月7日,4.0,割高ですが便利です,混合栄養で、粉ミルクを一缶買ってしまうと保存期間が心配だったのでキューブを選びました。ちょっとした量を足したかったり、多めに作りたかったりそのときどきで量がちがうので、キューブはすごく使いやすいです。ひとつ難点は、袋から出にくいこと。子供を抱っこしながら片手で作るときはイライラしました。なので☆4つです。
314,B00FQZRSUY,明治ほほえみ らくらくキューブ 27g×16袋入り,明治ほほえみ,川下まつり,2015年12月26日,4.0,便利！,これ以外は買わないです。溶けやすい。ただ、半分に割ると結構な確率で粉々になる。だから割ることを諦め、増やすときは４０ｍｌ単位で増やしています。賞味期限が長いので数か月分購入して、非常事態用にストックしてあります。
315,B00FQZRSUY,明治ほほえみ らくらくキューブ 27g×16袋入り,明治ほほえみ,ペコティ,2013年10月3日,4.0,惜しい,キューブなのんで外出時に便利。ただ溶けにくい、値段が高いのが気になります。普段使いなら粉末で十分ですね。
316,B00FQZRSUY,明治ほほえみ らくらくキューブ 27g×16袋入り,明治ほほえみ,アマゾネス,2014年2月28日,5.0,愛用,商品自体はとても良いもので，全く問題ありません．ただ，単価が少し高いのが気になります．もしもっと大量に必要であれば，量が多いもののほうが単価が安く良いと思います．
317,B00FQZRSUY,明治ほほえみ らくらくキューブ 27g×16袋入り,明治ほほえみ,ぺんぎん先輩,2016年6月1日,5.0,持ち運びには便利だけど…,外出用、避難グッズ用にしてます。作る量を40ml単位でしか調整できないのが残念ですけど、便利です。封を開けた後にまた口を閉じるためのシール的な何かを持ってないと、外出時には少し困ります。
318,B00FQZRSUY,明治ほほえみ らくらくキューブ 27g×16袋入り,明治ほほえみ,藤崎詩織,2018年7月24日,4.0,良いのですが・・・,家では粉タイプのミルクですが、外出時などにこちらを使用してます。計量する必要がないのですばやく哺乳瓶に入れられ、しかも溶けやすいのでストレスなくミルクが作れます。200ml分ずつにパッキングされているので、あまり頻繁につかわなくても清潔に保存できます。子供もよく飲んでくれるので重宝してます。
319,B00FQZRSUY,明治ほほえみ らくらくキューブ 27g×16袋入り,明治ほほえみ,Amazon カスタマー,2017年7月18日,5.0,便利です,第2子の時に使用しました。混合で毎回40cc足すだけだったので、キューブタイプのこの粉ミルクはとても便利でした。缶だと開封すると使用期限があるしね。よく振っても少し解け残るのが気になったけど、こどもはまったく気にせずに飲んでいました。
320,B00FQZRSUY,明治ほほえみ らくらくキューブ 27g×16袋入り,明治ほほえみ,いもいも,2014年3月1日,5.0,らくです,なかなか安く売っていないですほんのわずかかも知れませんが調べた中では一番お得です
321,B00FQZRSUY,明治ほほえみ らくらくキューブ 27g×16袋入り,明治ほほえみ,工場長,2014年8月20日,4.0,混合にはこれが一番,産院でこちらの商品を使っていたので、退院後もこちらの商品を使っています。とっても便利です。ただお値段がやはり高いです。。。新生児の時期は当分外出もないので、缶入りのほほえみも購入して、昼間は缶入り、夜中はキューブを使っています。
322,B00FQZRSUY,明治ほほえみ らくらくキューブ 27g×16袋入り,明治ほほえみ,けんくーまん,2017年12月7日,5.0,調べた中では一番お得です,とにかく楽。少々割高に感じるが、外出時のミルクの無駄がなくなった。今までは、200mlとか100mlとかで計量して持ち歩いてたが、離乳食後のミルクや時間があまり空いてない時、逆に追加でもっと飲ませたい時など微妙な量が難しく、かなり無駄にしていた。これは20ml単位で使えるので、微妙な調整ができる。スティック型なのでかさばらないし。
323,B00FQZRSUY,明治ほほえみ らくらくキューブ 27g×16袋入り,明治ほほえみ,トト,2014年5月13日,4.0,便利,これは本当に安いと思う。ただ、買って間もなく、母乳が出すぎて乳腺炎に何度もなるほどになってしまったため、全く使わなくなった。いらなくなったときに、この量は困ったもんです。
324,B00FQZRSUY,明治ほほえみ らくらくキューブ 27g×16袋入り,明治ほほえみ,ちょちょちょりーん,2016年4月18日,5.0,外出時の持ち歩きに,普段は缶のほほえみを使ってました。これは、外出時に使うように買いました。スプーンで計らなくていいし、少なく作りたいときは手で簡単に半分にできます。もう、ウチの子は飲まなくなってしまったので、余った未開封の分をいとこにあげたら、すごく喜ばれました。
325,B00FQZRSUY,明治ほほえみ らくらくキューブ 27g×16袋入り,明治ほほえみ,Nancy Martin,2016年11月17日,4.0,安い！,ほぼ母乳ですが、どうしても泣きやまない時や預ける時用に購入。特にすぐに使いたい時には計量しなくていいし、溶けやすく買って良かったです。コスパよりもたまに使う時の便利さ重視の方にはいいと思います。
326,B00FQZRSUY,明治ほほえみ らくらくキューブ 27g×16袋入り,明治ほほえみ,ちっち,2016年12月5日,4.0,外出の時に使ってました。,完全母乳なんですが、本当にたまーに出かけなければいけないとき、旦那さんにこれと託したら使えたらしい。たまにしか使わないならこれくらいしかいらないし、保存もかさばらずちょうどよかった。常備してると安心できる。
327,B00FQZRSUY,明治ほほえみ らくらくキューブ 27g×16袋入り,明治ほほえみ,limesachi,2017年8月21日,5.0,使いやすい,新生児から3ヶ月までは混合で育てていましたので違うメーカーの缶タイプの粉ミルクを使用していました。完全母乳になり、離乳食の調理や、ちょっとしたお出かけ用にこちらを使用しています。個別包装なので缶タイプのように缶を開けてからの日にちを気にすることがなく、少しずつ使用できるので便利です。
328,B00FQZRSUY,明治ほほえみ らくらくキューブ 27g×16袋入り,明治ほほえみ,miya,2014年3月3日,4.0,お得です,らくらくキューブは、産院で提供されるものだったので、現在は缶タイプと併用して使用しています。缶タイプは、スプーンで「いーち、にーい、さーん・・・」と数えながら、哺乳瓶に投入していますが、忙しいときは数がわからなくなってしまったり・・・その点、忙しいときは、ひと目で数量が見えるので、とても助かります。
329,B00FQZRSUY,明治ほほえみ らくらくキューブ 27g×16袋入り,明治ほほえみ,よっしー,2015年8月16日,3.0,安い、長持ち、便利,軽量の必要がないのは便利。ただ、他の方が書いているように袋から取り出しにくいのが難点。キューブを半分におる時に失敗すると粉々になってしまって机が汚れる
330,B00FQZRSUY,明治ほほえみ らくらくキューブ 27g×16袋入り,明治ほほえみ,仁科 祐子,2014年6月6日,5.0,お出かけや忙しいとき,粉が散らばらない、すぐに溶ける！お気に入りです。小6の息子でも簡単に作れました。
331,B00FQZRSUY,明治ほほえみ らくらくキューブ 27g×16袋入り,明治ほほえみ,ebiebi,2014年4月27日,5.0,袋から取り出しにくいのが難点,よく、考えて作られていると、思いました。赤ちゃん、よろこんでもらえるといいですね
332,B00FQZRSUY,明治ほほえみ らくらくキューブ 27g×16袋入り,明治ほほえみ,お銀,2014年8月24日,5.0,外出に便利,使い切るのが大変なので購入しました。外出時や夜中の授乳にとても便利です。
333,B00FQZRSUY,明治ほほえみ らくらくキューブ 27g×16袋入り,明治ほほえみ,辛くち商品評価の達人,2016年12月21日,5.0,定期的に,新生児と6歳の長男が居て、旦那は単身赴任中。重さのある買い物が大変なので、ネットでまとめて注文。普段は缶を使用なのですが、年末旦那の実家にお泊まりなのでミルクを作る時間短縮の為と荷物がかさばるので購入。いろいろ見たのですが、ネットも店舗も含めこちらが１番お買い得でした。発送も早いし、このサイズでこの金額はとても助かります。
334,B00FQZRSUY,明治ほほえみ らくらくキューブ 27g×16袋入り,明治ほほえみ,ノシ,2013年12月30日,5.0,缶は,40CCで1個なので、ミルクをいくつつくるかがすぐに判って便利です。固形状なので、若干溶けにくいですが、管理は楽です。他社のは顆粒状で溶けやすいのですが、量の加減が難しいです。
335,B00FQZRSUY,明治ほほえみ らくらくキューブ 27g×16袋入り,明治ほほえみ,ジャスミン,2016年4月21日,5.0,年末のお泊まりの為に,実家の常備用に2箱購入しました。私が買った時で一箱あたり3500円でした。これはどこのお店より安いと思います。賞味期限も1年ありました。
336,B00FQZRSUY,明治ほほえみ らくらくキューブ 27g×16袋入り,明治ほほえみ,kaya,2014年6月15日,5.0,簡単・便利！ただ…,40mlで１つのブロックになっているので、わたしのようなとっても不器用な人でも、使いやすいです。お湯:お水=2:1の割合で入れてまぜるだけで、適温のミルクが出来上がりです！大変重宝しています！
337,B00FQZRSUY,明治ほほえみ らくらくキューブ 27g×16袋入り,明治ほほえみ,二児の母,2018年2月21日,3.0,使い勝手、いいです。,何度も注文してます。定期便登録したら景品がつかなくなりました。ついているときは30枚入りのウェットティシュです。商品に関しては、赤ちゃんはよく飲んでくれます。個包装なので持ち運びも便利ですし、衛生的です。袋からキューブが出にくいので、急いでるときには不便だなと感じます。キューブ型に圧縮してるからか、溶け残ってるときがあるので少し時間を置いてから再度混ぜて飲ませたほうがいいです。
338,B00FQZRSUY,明治ほほえみ らくらくキューブ 27g×16袋入り,明治ほほえみ,坂井慎一,2018年3月24日,4.0,だれでも使える！,キューブタイプなので使いやすいところもありますが、急いでいるときにキューブの３個め４個めがなぜかなかなか袋から出てこなくて焦ることもありました＾＾；よく振ったつもりでも溶け残りがあったり・・・ミルク粥などに使うにはキューブのほうが量がはかりやすくてよかったです。粉のものよりも床などにこぼれにくいですが、多少粉が出ることもありました。
339,B00FQZRSUY,明治ほほえみ らくらくキューブ 27g×16袋入り,明治ほほえみ,mikan0505,2014年1月19日,5.0,衛生的だけど不便な面もある。景品付と書いてあるがつかない。,色々な店舗と比べても安くお買い得です。おむつと違いサイズオーバーはないので量が多くても大丈夫だと思います。これで定期購入できれば最高です。
340,B00FQZRSUY,明治ほほえみ らくらくキューブ 27g×16袋入り,明治ほほえみ,ゆ～ゆ,2016年4月20日,5.0,キューブ,母乳がたくさんでるためほとんど母乳ですが、どうしても泣き止まない時、外出のため預ける時、疲れたり寝不足で母乳が出にくい時など、意外とミルクが必要になることがあります。ですが缶だと期限を気にしてしまうので、こちらを購入して良かったなと思いました。
341,B00FQZRSUY,明治ほほえみ らくらくキューブ 27g×16袋入り,明治ほほえみ,ずん,2017年6月7日,5.0,安いです,子供にミルクを上げる際に、男親の私でも簡単に作れます。お湯にもサッと溶けるので素早く作ることが出来、とても重宝しています。
342,B00FQZRSUY,明治ほほえみ らくらくキューブ 27g×16袋入り,明治ほほえみ,Amazon カスタマー,2017年10月4日,4.0,意外とミルクが必要になりました。,三ヶ月の我が子に購入。病院のときから、これを飲んでました。母乳とミルクを半々くらいで育ててます。お乳だけでは足りない時に、飲ませてますが、グビグビ一気飲みをするので、美味しいのかも？すくすく育ってます。
343,B00FQZRSUY,明治ほほえみ らくらくキューブ 27g×16袋入り,明治ほほえみ,tak,2015年11月9日,4.0,使いやすく便利です。,缶タイプも以前使ってましたが、キューブタイプを使用するともう缶タイプには戻れなくなりました。ただ最近は品切れの時が多く、明治のキャンペーンの時を狙って購入していたのになかなか買えなくて割高になってしまうのでマイナス☆
344,B00FQZRSUY,明治ほほえみ らくらくキューブ 27g×16袋入り,明治ほほえみ,amazonカスタマー,2017年7月24日,5.0,使いやすいです。,とにかく外出に便利です。スティックの粉末タイプですと、量の微調整が難しいため、こちらを重宝しております。溶けにくそうに見えますが、普通に溶けます。外出先でちょっと余った時用にシールなんかが付属してあるともっと良かったです。
345,B00FQZRSUY,明治ほほえみ らくらくキューブ 27g×16袋入り,明治ほほえみ,Amazon カスタマー,2016年7月13日,5.0,少しはお得,とにかく楽。基本母乳なので、たまにしか使わないため保存も気を使わなくていいこちらを使用しています。月齢が小さいころは余って捨てちゃったこともありますが、１本分飲むようになたら楽でやめられません。
346,B00FQZRSUY,明治ほほえみ らくらくキューブ 27g×16袋入り,明治ほほえみ,きりん,2012年12月5日,4.0,外出時に便利,お出かけの時に便利で、取り出しやすく、使いやすいです!!!!
347,B00FQZRSUY,明治ほほえみ らくらくキューブ 27g×16袋入り,明治ほほえみ,RIN,2018年3月16日,5.0,らくちん,他社の物は全て粉タイプで、一袋が100ｍｌなので、100ml以上か以下だと測らないといけないしかといって粉末を測って持ち運ぶのも・・・そんな中、らくらくキューブは１個が４０ml、半分に割れる様にもなっているので２０mlで調整できるのがいい！！なので、家では缶の粉末タイプを使っていますが、お出かけの時はキューブを・・・と、使い分けてます。
348,B00FQZRSUY,明治ほほえみ らくらくキューブ 27g×16袋入り,明治ほほえみ,江藤,2014年1月10日,4.0,☆,持ち運びには大変便利！家の子供が、母乳大好きすぎて哺乳瓶から飲まない為、活躍するはずが・・・。
349,B00FQZRSUY,明治ほほえみ らくらくキューブ 27g×16袋入り,明治ほほえみ,クマっぱち,2015年8月7日,5.0,キューブで測らないでいいっていうのがいいですね！,産院でサンプルを頂いてからずっと便利で愛用してます。外出時には手放せません(^.^)
350,B00FQZRSUY,明治ほほえみ らくらくキューブ 27g×16袋入り,明治ほほえみ,畑　陽,2013年8月28日,5.0,らくらく,ほとんど母乳でミルクは少ししか使わないので、20mlから調乳できるこちらは本当に便利です。新生児期のミルク量の細かな調整もしやすかったです。たくさん飲む赤ちゃんなら缶の方が割安なのでしょうが、缶タイプは湿気てしまうので開けたら早く使い切らないといけないし、夜中に寝ぼけながら調乳する時など粉は何杯入れたか間違えそうで、視覚的にも絶対間違いのないキューブタイプは良かったです。小分けで保存がきくので非常用ストックにもなるし、少量から使えるので離乳食期にミルク粥やパン粥にも使えて便利です！
351,B00FQZRSUY,明治ほほえみ らくらくキューブ 27g×16袋入り,明治ほほえみ,そくじん,2014年3月1日,4.0,すぐ溶けるし使い勝手がいい,このらくらくキューブ、外出時に便利です。まあ、スティックタイプと比べても便利さはさほど変わらないかもしれませんが、とにかくこぼしてザラザラ・・・ということもなくて良いです。すごく溶け易いように工夫されているし。ところで、単価を計算すると、このサイズが一番ではありませんが、Ｃ/Ｐも優れています。一番たくさん入っているものは、一見安いようで、そうでもありませんから注意してください。（１袋にブロックが４つ入ったものと５つ入ったものがあります）普段は和光堂の『はいはい』なんですが、外出時にはこれ。うちの子は、特に嫌がることもなく、両方ともよく飲んでくれます。
352,B00FQZRSUY,明治ほほえみ らくらくキューブ 27g×16袋入り,明治ほほえみ,Dai,2015年11月29日,4.0,販売されているキューブの中で,夜中、外出用にとキューブタイプを探していたので、購入。小分けで袋に入っているので、便利です。
353,B00FQZRSUY,明治ほほえみ らくらくキューブ 27g×16袋入り,明治ほほえみ,sheee,2015年4月19日,4.0,しけない、扱いやすいミルク,我が家では、自宅では粉タイプ、お出かけ時はキューブタイプを使ってます。キューブタイプは持ち運びに便利だし、いくつ飲ませたかわかりやいので重宝しています。
354,B00FQZRSUY,明治ほほえみ らくらくキューブ 27g×16袋入り,明治ほほえみ,Ｔ,2016年1月24日,5.0,夜中、外出用に,森永のはぐくみを使っていましたが、問題なく移行できました。キューブは一粒40ccですが、半分にするのも手で綺麗に割れたので必要な分だけ使えてとても便利です。
355,B00FQZRSUY,明治ほほえみ らくらくキューブ 27g×16袋入り,明治ほほえみ,nyamo,2018年7月14日,5.0,とても重宝しています,DHA配合ということで、これにしてる。混合でDHAサプリ飲み、これの次はステップも飲ませました。そのおかげか分からないけど、上の子は早生まれだけど、クラスでいちばんくらいに言葉が早く、2歳前に三語文以上の文章話してた。下の子にもこれにします。
