,ASIN,product,brand,name,date,score,title,comment
468,B00FQZRSUY,明治ほほえみ らくらくキューブ 27g×16袋入り,明治ほほえみ,Alexa,2016年10月5日,2.0,唯一の欠点は袋から取り出しにくい,いつもここで購入していますが届いた際にダンボールがとても大きくダンボールが開いた状態で届きました。運送会社の方がテープで貼り直してくれたみたいですが。 ダンボールが開封された状態でとても心配です。 このような事が2度とないようにして頂きたいです。あといつもはベビーフードが付いてきましたが最近はポーチ、子供用のハンガーでした。
469,B00FQZRSUY,明治ほほえみ らくらくキューブ 27g×16袋入り,明治ほほえみ,みぃ,2016年8月4日,5.0,景品付…,敏速な対応大変助かりました。また機会がありましたら宜しくお願いいたします。
470,B00FQZRSUY,明治ほほえみ らくらくキューブ 27g×16袋入り,明治ほほえみ,Amazon カスタマー,2015年7月30日,2.0,ダンボールが開封された状態,説明をよく読まずに購入しました。店頭で購入した時は200cc作れるタイプだったので、これも同じと思ったら、160ccしか作れません。買う方はご注意を、、品質は問題なく送料無料で翌日に届くのでとても便利です。
471,B00FQZRSUY,明治ほほえみ らくらくキューブ 27g×16袋入り,明治ほほえみ,ティナさんとマリアさん,2017年3月6日,2.0,良い製品です。,ミルクと母乳を併用していたが、このミルクに慣れると母乳をあまり飲んでくれなくなってしまった赤ちゃんの飲みは良いが、甘く赤ちゃんが好む味にし過ぎているのではないか?
472,B00FQZRSUY,明治ほほえみ らくらくキューブ 27g×16袋入り,明治ほほえみ,B,2015年8月27日,1.0,残念,ベビーフード付きと書いてあったのに入っていなかった。値段は変わらなかったから、そのまま開けました。
473,B00FQZRSUY,明治ほほえみ らくらくキューブ 27g×16袋入り,明治ほほえみ,ひろ＆めぐ,2014年7月27日,2.0,使いやすいが値段が高い,使いやすいサイズですDr.ベッタの小さいサイズの哺乳瓶を使っていますが、ちょうど160mlなので、一袋使い切れますキューブになっていて、調整もしやすいです。小袋入りでも、少しだけとか、微調整は、適当になってしまうので、分量通り作るのには適していますやはり衛生上、使い切りたいと思ってしまいますただ、子供の好みに合わなかったようなので、リピートしないです
474,B00FQZRSUY,明治ほほえみ らくらくキューブ 27g×16袋入り,明治ほほえみ,かっちん,2016年9月20日,1.0,ベビーフード付き？,他の方が書いている通り、景品がついていませんでした。たかが景品ですが、不当表示だということを、真剣に受け止めて欲しい。
475,B00FQZRSUY,明治ほほえみ らくらくキューブ 27g×16袋入り,明治ほほえみ,はま,2015年1月27日,4.0,使いやすい,らくらくキューブですが、とても便利です。特に出先で重宝します。しかしこちらの５袋入りのものはキューブが４つしかはいっていません。160mlのミルクしか作れません。16袋入り・48袋入りのものは1袋にキューブが5つ入っています。（200ｍｌ分今はキューブが５つ入っているものを使っていますが、こちらのほうが便利です。低月齢の混合や、お試しにこのサイズを買うならちょうど良いと思います。
476,B00FQZRSUY,明治ほほえみ らくらくキューブ 27g×16袋入り,明治ほほえみ,Amazon カスタマー,2013年11月11日,1.0,不当表示だと思う,人気のキューブタイプ。車で外出時用にと初めて購入してみました。思った以上に便利で使いやすかったです。ただ、固形だからなのか、その固形にするための成分が影響してるのかは分かりませんが、今までに経験のない強烈な便秘をしました。（他にも、これを飲んで便秘になったとレビューで書かれてた方がいました。）うちの子は、残念ながらこれを飲んでお腹全体の機能が一時的に低下してしまったので（正常な時によく聞こえるはずのお腹の音が弱くなり、鼠蹊部の動きが悪くなった）、救急病院で診てもらったぐらいです。使いやすさではいいのですが、体のことを思うと、絶対にこれ以上便秘させるわけにはいかなかったので、使わなかった分は勿体ないと思いながら、これ以上飲ませれる勇気がなく、処分させてもらいました。便秘にもしっかり対応したキューブタイプが出るといいですね。
477,B00FQZRSUY,明治ほほえみ らくらくキューブ 27g×16袋入り,明治ほほえみ,ありさん,2016年4月9日,2.0,お試しにちょうどいい,11か月ごろ断乳と同時に小児科で感染症をもらい下痢が1か月くらい続いて食欲があまりなかったのですがほかのミルクは飲まないけれどこれはよく飲んでくれて助かりました。もの自体はとても使いやすくてずっとこれをリピートしていくつもりですが午前中もう切れていたので当日配送で検索チェックを入れて購入したのに当日に届きませんでした。いやな予感がしてほかのネットスーパーでお願いして間に合いましたがこういうライフラインにかかわる商品の納期が間違って表記されるのは勘弁していただきたいです。
478,B00FQZRSUY,明治ほほえみ らくらくキューブ 27g×16袋入り,明治ほほえみ,stepstep,2015年10月31日,3.0,便秘になりました,納品書にもベビーフード付と書いてありましたが、入ってませんでした。
479,B00FQZRSUY,明治ほほえみ らくらくキューブ 27g×16袋入り,明治ほほえみ,marupun,2017年4月10日,5.0,品物自体はずっとこれ,最初は産院で使っていた他のメーカーの粉ミルクを使っていましたが、ある日全く飲まなくなりました。とにかく飲ませなければとあらゆるメーカーのミルクを試し、子供がたくさん飲んでくれたこちらに変えました。実際にはアイクレオが一番飲んだのですが、お腹がゆるくなってしまったのでほほえみにしました。軽量いらずなので粉をこぼすことがなく、缶の底に残った粉をもったいないと思うこともなくなり寝る前にミルクケースに軽量したミルクを入れておく手間もなくなり楽になりました。４０ｍｌからなのは月齢が低いうちはもったいないと思いましたがたくさん飲むようになったので気にならなくなりました。今は月に４８袋入りを４個定期便で購入しています。毎回ウェットティッシュがついてくるので離乳食の時に手や口をふいたり、テーブルをふいたりして惜しげもなく使っています。子供も１０カ月になり、もうすぐフォローアップミルクになるんだなぁ・・・と最近は感慨深いものがあります。
480,B00FQZRSUY,明治ほほえみ らくらくキューブ 27g×16袋入り,明治ほほえみ,Chika.o☆,2019年12月24日,5.0,便利です,キューブのほうが楽かと思い、最初からキューブを使用。ただ、コストを考えて、缶の粉タイプのほうがお得なのかと思ったので、内容量を比較、計算。その結果、27グラム200ミリと換算した結果、粉もキューブも金額的に大差なかった。なので、このまま固形を続投することにした。定期オトク便を使用すれば、もっと安くなるのではなかろうか。個別包装されており、水が入ったり湿気たりする危険性とか手間を考えればどう考えたってこちらのほうが楽。明治は本当に良い製品を出してくれたと思う。
481,B00FQZRSUY,明治ほほえみ らくらくキューブ 27g×16袋入り,明治ほほえみ,Amazon カスタマー,2016年12月12日,5.0,ほほえみキューブ,パウダーはこぼしちゃったり、今何杯目？みたいなことになってしまう自分にはキューブが助かる。スティック状の袋から出しにくい時もあるけど、それ以外は使い勝手は星五つ。外出にも◎です。ちょっと高めなのでこちらでお安く購入できてよかったです。
482,B00FQZRSUY,明治ほほえみ らくらくキューブ 27g×16袋入り,明治ほほえみ,我妻,2015年10月29日,5.0,内容量を比較して、粉タイプと大差なかった,商品はとても気に入って使っています。お出掛けの時、母親や夫にミルクを頼むとき、夜泣きで疲れて計るのが億劫なときなど、重宝しています。ですが、定期便を申し込んでいるのに、値上がりしたり、在庫がないから(発売元で販売中止だとamazonからアナウンスがありましたが、発売元HPなどにそのような情報はありませんでした)と配送をキャンセルされたりと、とても困っています。粉ミルクのような必需品が安定供給されないなら、amazonファミリーに年会費を払う必要性が見いだせません。
483,B00FQZRSUY,明治ほほえみ らくらくキューブ 27g×16袋入り,明治ほほえみ,みーやん,2014年4月12日,3.0,いい！,景品付きと書いてあったが付いていなかった。記載された事と違ったのでこの評価とさせて頂きます
484,B00FQZRSUY,明治ほほえみ らくらくキューブ 27g×16袋入り,明治ほほえみ,あんころもち,2019年7月22日,4.0,商品は満足。でもamazonの対応は…,産院から愛用しています。息子もほほえみ大好きでパックを見ただけでキャッキャ言います（笑）マタニティ時代購入を検討していた時に、溶けにくいと口コミを見ていたので気になっていました。出産後たまたま産院が使っていて、入院中にメーカーさんの講義もあり、その時に質問して受けて溶かし方を教わりました。哺乳瓶にキューブを入れてお湯を少し入れ、そのまま混ぜずに しばらく置いておくと 見事にキューブが溶けて 沈殿します。全て沈殿してから哺乳瓶を軽く回し混ぜると すぐに混ざります。そこからお湯をたすなり湯冷ましを入れるなりすると簡単に調乳できます。それをやるようになってからは ダマに悩まされずにすむようになりました。量が増えてくるとたまに待ちきれなくて混ぜちゃってましたが ストレスは減りました。これを見た方はぜひ試して見てください。
485,B00FQZRSUY,明治ほほえみ らくらくキューブ 27g×16袋入り,明治ほほえみ,ぱぴこ,2015年12月9日,2.0,景品付きと。。。,60ミリを作りたいので不便。細かい量をつくれるように改良してほしいです。
486,B00FQZRSUY,明治ほほえみ らくらくキューブ 27g×16袋入り,明治ほほえみ,mimi.,2019年8月2日,4.0,キューブの溶かし方,ほほえみの缶を買っている人はなんで缶で買うのかが分からないくらい、キューブタイプは使いやすいです。特に、夜中の3時ごろに起こされた時など重宝しています。しかし、包装についてですが、コンソメスープのように、アルミの袋を途中で千切れるようになっているみたいですが、手で上手くちぎれたことはありません。また、1つ目は取り出しやすいですが、2つ目以降を取り出すのが難しいです。
487,B00FQZRSUY,明治ほほえみ らくらくキューブ 27g×16袋入り,明治ほほえみ,ガーコ,2017年11月15日,5.0,作る量が限られます,今まで使っていたほほえみらくらくキューブは、一袋200ml（キューブ5個入り）でした。家族に子どもを預けるときに、作りやすくてとても便利と好評でした。今回このキューブは、一袋160ml（キューブ4個入り）でした。お試し用だからかな？届いた時にはすぐ気づかなかったのですが、預けている間に家族から電話があって気づきました(^^;2種類あることを初めて知りました。使用する際には、一袋何個入りか確認して作ったたほうが良いです。
488,B00FQZRSUY,明治ほほえみ らくらくキューブ 27g×16袋入り,明治ほほえみ,アロン,2020年5月12日,5.0,外出用に購入しました,今は別の高い粉ミルクを使っていて持ち運び用のスティック粉ミルクは1本100ml出来上がりで今はまだ160mlしか飲まず出先でミルクを無駄にしてたので試しに買ってみました。思った以上の溶けやすさでびっくりしました。普通の粉ミルクより数段溶けやすいです。1キューブ40mlで半分に割ると20mlと調節できますしすり切りも必要ないので粉をこぼすこともないです。思いの外息子の飲みもよかったのでリピする予定です。今使ってるミルクほどではないですがやや値がはるので普段使いよりはお出かけ用という感じで使おうと思います。粉ミルクも買おうかな
489,B00FQZRSUY,明治ほほえみ らくらくキューブ 27g×16袋入り,明治ほほえみ,Amazon カスタマー,2016年4月21日,1.0,ベビーフードいらないです,プライム対象品だったので購入。ベビーフードも付いてるということでしたが、届いた品には付いてない…どうしても欲しいと言うわけではないですが、表示内容と異なる商品を送るのはやめてください。ちなみに納品書にもベビーフード付きと表示されてました。
490,B00FQZRSUY,明治ほほえみ らくらくキューブ 27g×16袋入り,明治ほほえみ,Minnmu,2017年6月19日,5.0,すごく溶けやすい,普段母乳ですが、薬を飲むことになり授乳ストップの時期がありこの商品にお世話になりました。完全母乳でミルク作りに慣れていない私には非常に作りやすい便利な商品で助かりました。1キューブ40mlで、半分にしたいときは手でパキッと割れば簡単に20mlになります。70度以上のお湯であればスプーンなど使わなくても哺乳瓶をゆらゆら揺らせば、粉より少し掛かるかもしれませんが、わりとすぐ溶けます。5個1袋で手でつままなくても袋から1個ずつコロッと出せるので衛生的です。ミルク作りに慣れていないママ以外の家族もじゅうぶん慌てず作れます。キューブタイプがもっと主流になればいいのにと思っちゃうくらいです。味の違いはわかりませんが、母乳慣れしていた子どもが突然ミルク生活になってもしっかり美味しそうに飲んでくれてお腹の調子も壊さず、母乳に近づけて作りましたと言うだけあるなぁと感心した次第です。
491,B00FQZRSUY,明治ほほえみ らくらくキューブ 27g×16袋入り,明治ほほえみ,Amazon カスタマー,2016年12月8日,5.0,確認してから送って欲しいです,重宝してます。母乳でなんとかやってますが、足りないころはコレを使ってました。カンのやつは安いですが開封してから１カ月で使い切らないといけないので半分くらいは捨てる羽目に、、、。これは、期限も長くて使い易いので、母乳の補助ならまずこれをオススメします！70度以上のお湯なら溶けにくいということもないですよー。完全にミルクならこれよりカンがコスパがいいと思います！
492,B00FQZRSUY,明治ほほえみ らくらくキューブ 27g×16袋入り,明治ほほえみ,Amazon カスタマー,2016年10月27日,5.0,ラクラク作れました,産院では、このキューブタイプでした。コスパの面では800g缶の倍くらいするので、自宅では缶、お出掛けの際はキューブと使い分けてます。地震等の災害時用にも持っておきたいですね。粉末よりは溶けるのに時間が掛かりますが、使い易いです。粉末のように何杯入れたか忘れませんし（笑）
493,B00FQZRSUY,明治ほほえみ らくらくキューブ 27g×16袋入り,明治ほほえみ,ナスカまん,2016年9月3日,4.0,とても良い,哺乳瓶が必要なお出かけのときはこちらを持って行きます。持ち運びは本当に便利です。粉ミルクに比べて日持ちもするので常備しています。ただ、70℃ではまず溶けないように思います。できる限り熱湯で溶かすようにしています。取り出すときも、推奨されているように袋の外側から押すだけではなかなか取り出せません。つい急いでいると、指でつまんでしまいます。
494,B00FQZRSUY,明治ほほえみ らくらくキューブ 27g×16袋入り,明治ほほえみ,エターナル,2017年11月10日,4.0,お出掛けの時に使ってます,授乳が安定するまでの生後1ヶ月に使用しました。1キューブが、40ccで本当に良いサイズ！さすが、研究され尽くされているなと思いました。新米ママは何をするにも手間取ってしまいますので、あっという間にミルクが作れて赤ちゃんのギャン泣きも最小限に抑えられたと思います。ただ、産院では、便利な反面、キューブ状に固めるために本来の母乳には入っていない成分を入れている、と説明を受け理解した上での使用でした。
495,B00FQZRSUY,明治ほほえみ らくらくキューブ 27g×16袋入り,明治ほほえみ,杏こっこ,2018年10月6日,5.0,溶けにくいですが便利です,キューブ1個で40mlのミルクがつくれます。公式サイトにも書かれているとおり袋にキューブのイラストが描かれており、イラストを目印に手でおさえ下に向けると作りたい分だけ取り出せます。また取り出す際に袋の上から触れるためとても衛生的です。余った際には密封して、少しの間保存もできます。コストはかかりますが、夜中に寝ぼけて何杯入れたか分からなくなる事などを考えるととても便利な一品です
496,B00FQZRSUY,明治ほほえみ らくらくキューブ 27g×16袋入り,明治ほほえみ,美波,2016年2月29日,4.0,実質無料キャンペーンで購入,ほほえみは、DHAとアラキドン酸が含まれているというところに惹かれて使ってます。キューブはお出かけや帰省時にとても便利なので重宝してます。ただ、一つのキューブに切れ目が入っており、半分に割れるようになってますが難しいです。あと、袋からキューブを出すのがキツくてなかなか出てこないのでマイナス１です。
497,B00FQZRSUY,明治ほほえみ らくらくキューブ 27g×16袋入り,明治ほほえみ,ルーベンス,2017年9月8日,5.0,詐欺！,産院でおススメされてそのまま使っています。40mlなど、少ない量を作りたい時にも使いやすい。(キューブを割ると20mlから作れます)粉タイプの単包パックのミルクよりおススメです。新生児の飲む量は本当に少ししか飲まないので、キューブタイプは調節しやすくて楽ちんです。
498,B00FQZRSUY,明治ほほえみ らくらくキューブ 27g×16袋入り,明治ほほえみ,Amazon カスタマー,2019年11月23日,2.0,お出かけ、帰省時に。,こぼれなくて良さそうなので買ったのですが天然水をチンして温めてるのでぬるい温度30.40度だとダマのままで溶けないです。袋から取り出しにくく一回一回袋がゴミになります。旦那は使いにくいので今まで通り缶の方がいいそうです。
499,B00FQZRSUY,明治ほほえみ らくらくキューブ 27g×16袋入り,明治ほほえみ,たかこ,2019年3月30日,4.0,主人でも作りやすい☆,計量いらず粉ミルクはこれしか使ったことがないが毎回計量するのは考えられない1個で40ml作れるし、半分に割れば20ml単位にできるので調整もしやすい40ml x 5キューブで一袋200mlお出かけ時には2袋持ってたら安心でしたが、液体ミルクが発売されたので、お出かけ時には使わなくなりました自宅では引き続き利用中
500,B00FQZRSUY,明治ほほえみ らくらくキューブ 27g×16袋入り,明治ほほえみ,Amazon カスタマー,2018年7月6日,4.0,溶けなかった,お出かけに最適な固形ミルク。今までは粉のミルクを持ってお出かけしてましたが、この固形ミルクは計ることなく一目で分かり尚且つ入れた後混ぜることなく溶けます。荷物も減るし簡単でこんな商品待ってましたと言うべき商品です。
501,B00FQZRSUY,明治ほほえみ らくらくキューブ 27g×16袋入り,明治ほほえみ,shiratori,2016年4月7日,5.0,キューブ型だと一択,退院後初めてのミルクとして使いました。40ミリ単位でブロックされていますがブロックの真ん中に切れ目の凹み線があり少し力を加えると半分になるので20ミリ単位でも使えます。袋からは最初の一つ以降は出しにくいので毎回使った分まで袋を破った方がスムーズに出せました。少し面倒ですが。缶タイプの方がお買い得なので今は外出の時用に購入しています。かさ張らないし、事前に量る手間もなく、粉まみれになることもなくとっても便利です。
502,B00FQZRSUY,明治ほほえみ らくらくキューブ 27g×16袋入り,明治ほほえみ,TOMO,2018年10月10日,5.0,簡単で便利,粉ミルクだとミルク作ってくれない旦那でも、らくらくキューブなら作ってくれました。旦那曰く粉だとよくわからないけど、これだったらわかりやすいだそうです。まだ32歳なのに…。
503,B00FQZRSUY,明治ほほえみ らくらくキューブ 27g×16袋入り,明治ほほえみ,オレンジティー,2017年10月29日,3.0,外出用のミルクにオススメ,キャンペーンをやっていたので実質タダでお試しGET。出先調乳には楽で丁度いいんですが、高くつくんですよね。母乳メインでごくたまーに哺乳瓶、て方は普段使いも良いんじゃないでしょうか。完ミだとこういう出費もバカにならないのでミルカーとか袋がよいです。
504,B00FQZRSUY,明治ほほえみ らくらくキューブ 27g×16袋入り,明治ほほえみ,Amazonカスタマーさん,2017年7月13日,5.0,持ち歩きには便利です,混合で育てていて、缶タイプだと使い切る前に開封後1ヶ月経ちそうになり、小分けされていると安心です。スプーンで計量だと月齢が高くなると飲む量も増え、何杯入れたかわからなくなるので、キューブだとわかりやすくていいです。
505,B00FQZRSUY,明治ほほえみ らくらくキューブ 27g×16袋入り,明治ほほえみ,INA,2018年8月7日,5.0,外出時や母乳メインの方には最適,元々産院で使用していたので、我が子も拒否などないため継続するために、安くなるキャンペーンをしていたため購入しました。基本的に母乳ですが、何かのために哺乳瓶でも飲めるようにしたいので定期的に使用してます。なので、粉より賞味期限など気にせず使えます！
506,B00FQZRSUY,明治ほほえみ らくらくキューブ 27g×16袋入り,明治ほほえみ,Amazonカスタマー,2019年11月14日,5.0,便利,キューブ状なので扱いやすく、粉ミルクを計る手間がなくて重宝しました！使いきれなかったものは料理にも活用できて栄養も満点、買ってよかったものの１つです！
507,B00FQZRSUY,明治ほほえみ らくらくキューブ 27g×16袋入り,明治ほほえみ,キューピー★,2019年3月19日,5.0,計量の手間なく、賞味期限も気にせず使えます！,手が汚れず衛生的で使いやすい。粉をこぼす心配もなく、携帯するにも便利。20mlから作れるので重宝しています。
508,B00FQZRSUY,明治ほほえみ らくらくキューブ 27g×16袋入り,明治ほほえみ,遠藤舞,2018年10月14日,4.0,手軽で使いやすい！,キューブになっているので調乳時便利だが一袋を数回に分けて使う場合、キューブが出づらい。コストがすこし高い。
