,ASIN,product,brand,name,date,score,title,comment
0,B00FQZRSUY,明治ほほえみ らくらくキューブ 27g×16袋入り,明治ほほえみ,めかぶ,2018年10月30日,4.0,高いけどお得に購入させていただきました！,難病で完全ミルクの我が子。このミルクはごくごく飲んでいます。e赤ちゃんやはいはいも飲んでいますが我が子はこれが一番好きらしく夜中寝ぼけているとき粉ミルクをこぼさす作って飲ませることもできます。定期便で注文したさいカトーレック宅配業者が来ました。私と子どもが寝ていて上の子と主人が散歩に行ったそうで鍵が開いていたそうです。インターホンに出なかったからと勝手に玄関に入り荷物が置いていました。私がドアを開けると少し離れたところで「あ！今不在票をいれようと。」と話されていました。また入って荷物を持って行くつもりだったと思うとぞっと怖い気持ちになりました。
1,B00FQZRSUY,明治ほほえみ らくらくキューブ 27g×16袋入り,明治ほほえみ,もっさん。,2019年1月22日,5.0,遺伝子組み換えが……,出産した病院がこのミルクだったので、退院後も継続して使っています。缶のミルクとの違いは↓↓●スプーンを使わなくていいので楽♪●缶をリサイクル回収に出す手間がない♪●外出時に持ち運び便利♪コスパ的にも缶とあまり変わらないので、使いやすいキューブタイプを使っています。キューブが1個40ml、半分に割れば20mlとして使えるので、20-40-60-80-100-...と赤ちゃんの成長に合わせてミルクが作れます。奇数のmlで作りたいときは、捨てて調節します。(70ml作りたいときは、キューブ2個で80mlを作ってから10ml捨てる。)今までは小箱をドラッグストアーで購入していたのですが、大箱をAmazonで購入してみました。オマケもついていたので♪大箱の中に箱が2つ入っていたので、保管する際にかさばらずに便利です。注文から2日で届き、助かりました。また、購入したいと思います！！
2,B00FQZRSUY,明治ほほえみ らくらくキューブ 27g×16袋入り,明治ほほえみ,Miyuki,2017年3月1日,3.0,ミルクは美味しい！宅配業者に問題あり,3-5か月になってくると1回量は200cc程度になってきます。粉タイプだと　スプーンすりきり1さじ分が20㏄に相等し10さじ必要です。キューブだと一袋に40ccつくれるキューブが5個入っており何も考えずに1袋，160ccで満足しちゃうだろうなというときもあるのでそのときは4個つかって1個おいておきます。夜眠いときなど粉タイプだと何さじいれたか忘れちゃうかもしれません。また入れるときに粉がこぼれたーとか，薬液消毒後などかわいてない哺乳瓶を使うときはスプーンがぬれてしまい次いれたいのにぬれたスプーンどうする？となってしまうかもしれません。キューブならこぼれてよごれることもないし，何個いれたっけとなっても哺乳瓶のなかで数えることができます。ぬれた哺乳瓶でも外側の袋に少々水滴がつくくらいです。低月齢でもキューブを半分に割ることができ20㏄，1.5個で60ccと調節可能です。キューブが端数になっても取り出しやすいように途中でカットできる青い点線の切り口がついていますが，袋の裏の折り返しになっている部分がかたくてうまくちぎれないことがあります。旦那さんや母にお世話をお願いするときも手間が少なくミルクが作りやすそうです。持ち運びも個包装なので清潔で簡便です。長期保存が可能で防災にも便利です。粉のほほえみ800g缶で１さじ約2.7g　200ccつくるのに10さじ27ｇで約29回つくれます。キューブ16袋入りは200ccつくるのに１袋27gで16回分432gで缶約0.54缶相当のようです。和光堂のはいはいなどよりはお高いですが，ほほえみどうしで考えると値段はあまりかわらないようなので，キューブタイプをおすすめします！ただし1日で200ccを5回程度のむと48本入りでさえ10日程度でなくなってしまいます。割高なので48本入り以上をおすすめします。帰省などで少しでも荷物を軽くしたいときに配送し、荷物を少なくするのにはよいかもしれません。あと忘れがちですが，ほほえみには応募マークがついていて，オリジナル絵本やフォトブックに応募ができるようです。はじめは気づかずに捨ててしまっていました。お忘れなく！
3,B00FQZRSUY,明治ほほえみ らくらくキューブ 27g×16袋入り,明治ほほえみ,はなはな,2018年9月3日,4.0,便利です♪,産院で使っていて、息子が飲む味なのでそのまま継続。1日１回100㍉飲むか飲まないかだから、缶だと賞味期限が短い。なのでキューブにしてます。もう少し袋から取り出しやすいとせっかちの私は助かる。
4,B00FQZRSUY,明治ほほえみ らくらくキューブ 27g×16袋入り,明治ほほえみ,いつか・子育て奮闘中,2019年1月9日,5.0,応募マークの回収もお忘れなく！簡単便利。16袋はすぐになくなり割高。帰省などで少しでも荷物を減らしたい方へ。,３０年前に苦労した事はズバリ缶ミルクの測り哺乳瓶へ入れて混ぜる事でした。外出の際には小分けにしてミルクを測り持ち歩くといつのまにかミルクが湿度で固まるので大変でした。このキューブのミルクは超便利ですね。今産まれて1週間でミルクと母乳の混合です。ミルクを作るタイミングもそれぞれ毎回違うので時間が読めませんね。キューブのミルクだとポイと入れて後お湯を足すばかりなので、赤ちゃんを待たせる事なく授乳がスムーズにやれてます。ホントにこの商品を考えて下さったメーカーさんに感謝！です。
5,B00FQZRSUY,明治ほほえみ らくらくキューブ 27g×16袋入り,明治ほほえみ,Amazon カスタマー,2019年6月7日,1.0,たまにあげる混合育児に。,出産前に購入し、産後は完母だったので粉ミルクが必要なくなり離乳食メニューに活用しようと使ったところ口の周りと喉周りに見事に赤くぷつぷつとアレルギー反応が…。粉ミルクが原因かどうかを確かめるために、翌日そのまた翌日も粉ミルクだけを皮膚に付けて様子を見たところ、ぷつぷつと赤く反応が出てしまいました。我が子にはアレルギー反応が出てしまうモノで大量に買ったのでもったいないことをしてしまいました。我が子のようなことがあるので大量に買う前に試される事をオススメします。
6,B00FQZRSUY,明治ほほえみ らくらくキューブ 27g×16袋入り,明治ほほえみ,non/non,2021年1月26日,1.0,時代は変わったね。,今までは、48袋+48袋+16袋+4袋+4袋の120袋入だったの。商品写真もそうなってる。でも開けてみたら、48袋+48袋+16袋＝112袋とお尻ふきが入ってた。お尻ふきいらねー笑たくさん入ってて割安だからコレ買ってるのに、1月から値上げするわ、中身がお尻ふきに変わってるわ、ダメダメだよ。
7,B00FQZRSUY,明治ほほえみ らくらくキューブ 27g×16袋入り,明治ほほえみ,りーちゃん,2019年4月13日,3.0,我が子はアレルギー反応出たので大量に買う前にまずはお試しを,急遽仕事復帰する事になり、その間主人に子供を見てもらう為、調乳の簡単そうなこちらを購入。ですが普段完母なので…全く飲みませんでした…哺乳瓶が嫌なのかとも思いましたが、搾乳した母乳は一応飲んでくれるのでミルクが嫌なのだと思います。完ミや混合で尚且つ、ほほえみの味が好きな子でしたら凄く便利な商品だと思います。大量に余ってるので、試しに普段飲んでるカフェインレスコーヒーにクリープ代わりに入れてみたら本物のクリープには敵いませんが、そこそこ美味しく飲めました。子供が離乳食を食べ始めるようになったら、離乳食にも混ぜてみたいと思ってます。
8,B00FQZRSUY,明治ほほえみ らくらくキューブ 27g×16袋入り,明治ほほえみ,くまぽん,2018年10月20日,5.0,景品が急に変わった……,混合ですがお出掛け時にはとっても便利です。二本の魔法瓶にお湯と水を入れておけば外出先でも怖いものなしです。大体冷まし水でちょうど良い温度になるので結構はやく出来上がります。粉に比べるとやはり溶けるのが遅いですが、それでも乳首に詰まることなどはないです。まだ新生児なのでこれからどれだけお世話になるかわかりませんがすぐに届くのも良いですね。
9,B00FQZRSUY,明治ほほえみ らくらくキューブ 27g×16袋入り,明治ほほえみ,ゆめ,2021年1月18日,3.0,1年以上賞味期限があります,特別パック 景品付き内容量:3
10,B00FQZRSUY,明治ほほえみ らくらくキューブ 27g×16袋入り,明治ほほえみ,こそどろ,2017年12月3日,5.0,持ち運びにすごく便利,母乳で頑張ってましたが、体調を崩し、いつもオムツを買ってるアマゾンでミルク選び。粉ミルクが固形になってる！溶けるのか気になり、調べると適温ならきちんと問題なく溶けると。試しに5袋を購入しビックリ！簡単に作れる！パパに試してみても問題ない！これは使える！これからは夜寝る前にミルクにしようと思います！らくらくキューブ最高！
11,B00FQZRSUY,明治ほほえみ らくらくキューブ 27g×16袋入り,明治ほほえみ,Amazon カスタマー,2017年11月1日,4.0,中身が違います。景品がおしりふきになっていました。,キューブタイプなので、粉ミルクをこぼして掃除する手間を増やすこともなく、また何杯入れたか分からなくなることもないので便利です。キューブに切り込みが入っているので、とても綺麗に割れます。ですが、他の粉ミルクと比べると価格が高めなので、お出掛け用に使っています。
12,B00FQZRSUY,明治ほほえみ らくらくキューブ 27g×16袋入り,明治ほほえみ,アマゾンファン,2020年9月28日,4.0,ミルクに悩むならコレ！,今までおまけが手口拭きで嬉しかったのですが急に除菌シートになり、少し残念でしたが除菌シートも日常でよく使うからまぁいいかと思って使ってみたら本当に除菌シートなの？なんかのリキュールに浸したような変な匂いがしてとても使えません。日本製じゃないしなんか怖いです。売れ残ったものをおまけにしてるのかな。毎月定期お得便で2
13,B00FQZRSUY,明治ほほえみ らくらくキューブ 27g×16袋入り,明治ほほえみ,きき,2021年3月21日,1.0,便利です。,ほほえみキューブはとても良い商品ですが、このセットを購入し、かなり割高に購入してしまったものです。当初、景品を含めるとやや割安（数百円程度）なため、Amazonで毎回購入してました。ところが、定期購入していたら、突然景品が変わり、（画像はそのまま）問い合わせましたが、Amazonは何も保証できないと言われました。カスタマーサポートによると、景品は明治が決めてるから明治に問い合わせして解決してくれとのことで、Amazonは販売商品の景品の中身に関与しないとのことでした。返品も不可でした。問い合わせは営業時間が短い明治のお客様サポートセンターです。仕事が忙しく千円程度なので断念しました。なお、景品のミルク含めて他の店舗より千円近く割高になるため、結果としてこれまでのほんの数百円の節約が全て無意味になりましたので、割高でも、きちんとお店が責任もってくれるお店の方が節約になったと思います。現在、タイムセールの価格は割安に見えますが景品が変わってしまい、他店と比較し、それほど割安ではないです。景品は確かにこちらからは勝手に変更されてもどうにもできないため、景品でオトクは最終的に損する可能性があります。この時期は、子育て商品にトラブルがあると、とても、大変なので景品付きは景品が写真と変わっても後悔しない人だけ利用をおすすめします。
14,B00FQZRSUY,明治ほほえみ らくらくキューブ 27g×16袋入り,明治ほほえみ,Amazon カスタマー,2018年1月14日,5.0,おまけが‥,離乳食で、パン粥を作るときに特に重宝しました。缶の粉ミルクだとスプーンではかりますが、こちらははからずとも良いのでとても作るのがラクでした。兄弟が出来てもこちらを使いたいと思います。
15,B00FQZRSUY,明治ほほえみ らくらくキューブ 27g×16袋入り,明治ほほえみ,Amazon Customer,2019年11月9日,5.0,写真とは違う景品が届くことも。購入は注意が必要,缶のほほえみを使っていましたが、こちらのほうがコスパがいいので乗り換えました。最初は、袋からミルクの元をだすのに苦労しましたが書かれている手順通りに持つ手の力の入れ具合を変えるだけで必要な量を自由に取り出せるようになりました。また缶のときは忙しい時など何ｇ分いれたのか忘れてしまうことがありましたが、これは目で簡単に確認できる点も気に入っています。味はわかりませんが、子供もこのミルクが好きなようで生まれてからこれまで嫌がらずに飲んでいます。
16,B00FQZRSUY,明治ほほえみ らくらくキューブ 27g×16袋入り,明治ほほえみ,ラーテン,2018年8月5日,4.0,使い易い。よく飲む。文句なしです。,少々値は張りますが、やはり楽です。小さい頃まだ一包も飲めないときは、調節しやすいのでお出かけのときも重宝しました。我が家は、夜間授乳とお出かけのときはこちらを使用していました。溶けも良いし、息子も問題なく飲んでくれたので良かったです。
17,B00FQZRSUY,明治ほほえみ らくらくキューブ 27g×16袋入り,明治ほほえみ,ひとみ,2021年1月21日,5.0,景品は画像とは別のおしりふきでした！！！！,【追記】特別パック景品付きの内容が、４８袋×２+１６袋×１+おしりふき２つに変更されています。以前のものと値段は同じで１０袋少なくなっているので、注意してください。【本文】サンプルでもらったときからこれは絶対に便利だと思っていて、ミルクは基本的に明治ほほえみを使っています。４０ミリリットルずつのキューブになっていて計量しなくてよいのが最高。母乳が少しだけ足りなくて赤ちゃんが泣きやまないとき、哺乳瓶にコロンと１粒入れてポットのお湯を注ぎ、ちょっと冷ますだけで完成です。計量スプーンも、こぼれた粉をふき取る手間もいりません。どれだけ不器用でも、常に同じ濃さで少量からミルクを作れます。プロテインを大袋で買ったことがあるパパorママなら、きっとこのストレスフリー感を理解していただけると思います。
18,B00FQZRSUY,明治ほほえみ らくらくキューブ 27g×16袋入り,明治ほほえみ,culture et confiture,2019年2月16日,5.0,やっぱり楽,2018/11/07に購入し、2020/2/22までのものが届きました。1ヶ月までは混合、その後完母で外出時等たまにミルクを使用しています。持ち運びやすく溶けやすく、子供もよく飲んでくれています。保存の関係で袋から出し辛いのは仕方無いのかなと思いつつも、やはり出し辛いですね。半分に折りやすいのはとても良いと思います。16袋入りの大きさは、そのまま避難袋に入れるのにもぴったりで非常時用に未開封のものを置いてます。使用しなかった分は離乳食に混ぜたり、キューブが1個だけ残った場合は旦那のコーヒーのフレッシュ代わりにしたりしていました。
19,B00FQZRSUY,明治ほほえみ らくらくキューブ 27g×16袋入り,明治ほほえみ,ぽより,2018年12月17日,5.0,今さら粉を計量できない,キューブ状でとっても使いやすいです。粉は毎回はかるのが面倒ですが、こちらは40gがぽんと取り出せるのですごく便利です。外出時に特に重宝しました。ぱきっと割れば20gで使えます。最初は上手く割れませんでしたが、慣れると真ん中の線でポッキリ割れるようになります。赤ちゃんが小さいうちは10g単位であげたいときがあるので、粉と併用して使用していました。お湯にとかすのは粉の方が簡単かもしれません。おまけで手口ふきがついていたので良かったです！
20,B00FQZRSUY,明治ほほえみ らくらくキューブ 27g×16袋入り,明治ほほえみ,えいり,2019年5月22日,5.0,非常用にも良く便利,この製品の利点はなんと言っても便利なところ。スプーンできっちり測ったり、こぼれないように気をつけたり、何杯入れたか途中で分からなくなったりがないのでストレスフリーです。1粒で40cc調乳出来ますが、半分に割れば20cc単位で作れます。キューブに入ってる線に沿って、包丁を入れれば綺麗に割れます。半分サイズをまとめて作ってタッパーに入れて使ってます。飲む量が増えてきたので、コスパを考えて和光堂のはいはいに変えましたが、こちらは外出時の携帯用に使っています。和光堂のはいはいと比べた使用感飲みやすさ…テクスチャー軽めで飲みやすい印象(悪く言えば薄い？)香り…ミルク臭さが少ない便…ゆるめ、1日ほど貯めてまとめてたくさん出す
21,B00FQZRSUY,明治ほほえみ らくらくキューブ 27g×16袋入り,明治ほほえみ,Amazon カスタマー,2019年4月30日,4.0,キューブ状で使いやすいです,嫁の母乳が2か月過ぎに出なくなり頼ってます。2080㎏⇒8900㎏（10か月）何の心配もなく大きくなってくれました。真夜中に起きてミルクを作る時にいくつ入れたか一目瞭然です。粉がこぼれませんから汚れませんね。キューブは付加価値が高いんでわかるのですが、もう少しお安くできないんでしょうかね？
22,B00FQZRSUY,明治ほほえみ らくらくキューブ 27g×16袋入り,明治ほほえみ,snowleaf,2017年5月14日,5.0,とにかく便利,子供三人育て中ですが、これは便利。お出かけの時もふたパックもって水筒にお湯いれてけばm(._.)m、
23,B00FQZRSUY,明治ほほえみ らくらくキューブ 27g×16袋入り,明治ほほえみ,sisimaru,2019年7月22日,5.0,らくちんですね。,It is very easy to use in home as well as outside home. You don't need spoon and you don't make dirty while preparing it. It melt very easy in water
24,B00FQZRSUY,明治ほほえみ らくらくキューブ 27g×16袋入り,明治ほほえみ,harion,2021年2月15日,3.0,計量いらずって素晴らしい！,キューブは持ち出しの手軽さゆえに第一子からずっと愛用しています。去年注文した分までは景品がミルクだったのに、今年に入っておしりふきに変更になりました。我が家にはおしりふきのストックがたくさんあるので不自由してないため変更がショックです。
25,B00FQZRSUY,明治ほほえみ らくらくキューブ 27g×16袋入り,明治ほほえみ,Amazon カスタマー,2020年7月30日,4.0,便利！,産後、くたくたで寝不足なときに、大泣きする赤ちゃんの横でスプーンで１、２、と数えながらミルクを急いですくっていると、たまに「あれ、今何杯いれたっけ...」となっていましたが、こちらはどれだけ入れたか確認できるので、入れ間違いがなくて便利です。子供もよく飲んでくれました。難点は溶けにくいこと。そこが解決してもらえたら星５つです。
26,B00FQZRSUY,明治ほほえみ らくらくキューブ 27g×16袋入り,明治ほほえみ,いっぴょ,2019年8月3日,5.0,キューブは管理しやすい。でも…,夜中のミルク作りが苦痛になった時に使用しました。計る手間が省けるだけでも大分ストレスが減ります…！また、外出時や家族等に子どもをみていてもらう時にも大活躍です。誰でも、簡単にミルクを作ることができるので◎そして粉タイプだと100mlで1本ですが、こちらだと分けて使うことができるので月齢の量に応じて使えて◎やや割高ではありますが、便利さを買っているのだと思えば最高の商品だと思います。
27,B00FQZRSUY,明治ほほえみ らくらくキューブ 27g×16袋入り,明治ほほえみ,なみ,2019年8月26日,5.0,溶けにくい,外出のときはこちらを使ってます！なんせコンパクトで便利！直ぐに溶けてくれるので赤ちゃんを待たせることなくミルクをあげられます😍赤ちゃんも美味しそうに飲んでくれてるので星5！取り出し方を丁寧に書いてくれてますが、取り出しにくいなと思うことはあります😂でも量も調整できて便利だし、星を減らす程ではないかな！
28,B00FQZRSUY,明治ほほえみ らくらくキューブ 27g×16袋入り,明治ほほえみ,yuzuo,2021年1月31日,5.0,夜中や外出時に◎便利さNo. 1,粉ミルクと違ってとにかく計量が楽です！缶の粉ミルクと比べると割高かもしれないですが頻繁に作る際は楽するに限るのでとにかく簡単で便利！人に頼んだ際も「〇〇個入れてね」というだけで誰でも出来ちゃうしお出かけの時にも楽です上の子の時から利用！味も甘い美味しそうな匂いがするし、ごくごく飲んでくれるのでこれからもお世話になります。
29,B00FQZRSUY,明治ほほえみ らくらくキューブ 27g×16袋入り,明治ほほえみ,まりし,2021年4月8日,3.0,コンパクトで量も変えられるから便利！,粉ミルクとちがって哺乳瓶にいれやすいけど、泡だちがすごい。最後の方は泡だけになってる。━━━━━あまり泡立たなくなった。謎(ﾟAﾟ;)おまけはウェットティッシュ1袋でした…ショボすぎないか。西松屋でみたものは液体ミルクが2缶はいってましたよ。
30,B00FQZRSUY,明治ほほえみ らくらくキューブ 27g×16袋入り,明治ほほえみ,miiippp03,2017年9月11日,2.0,ミルクはやっぱり明治！,値段はスーパーやドラッグストアと変わりませんが重いので運んでいただいて、便利です。でも景品ついてませんでした。パッケージにも景品付きって書いてあるのに…
31,B00FQZRSUY,明治ほほえみ らくらくキューブ 27g×16袋入り,明治ほほえみ,ねこねこ,2019年4月18日,4.0,泡,袋からキューブが出し辛いです。ふっても出てこないときもあるので仕方なく手でつまんでいます。また、以前使っていた他社のはいはいよりは、やや溶けにくい感じもします。キューブなので軽量いらずで、子どもを抱っこしながらなど、片手でも粉がこぼれたりせず使いやすい。40ccずつのキューブなので量の調節がしやすい。(半分に簡単に割れるので20ccの調節もできる)点は良いかと思います。ただ100cc単位で調乳する場合はスティックタイプを使用したほうがより手軽です。また、やはり缶タイプより値段が高いのでもう少し安くなればと思います。
