,ASIN,product,brand,name,date,score,title,comment
0,B00I39BQM6,国太楼 ルイボスティー ティーバッグ (3g×18P)×5個,国太楼,たいちん,2017年3月14日,5.0,ゴボウ茶からの乗り換えです。クセが無く飲みやすい。,産後、授乳期のノンカフェインの飲み物としてルイボスティーを飲んでいます。10種類程度各社のを試した結果、こちらの商品に落ち着きました。1Lのポットに1袋で作って飲んでいます。私はもちろん、夫も赤ちゃんも(薄めて)毎日愛飲しています。しっかり色が出て、香りも味もしっかり出ているのに、変なクセはありません。18袋を2週間程度で飲みきるので、開封後新鮮なうちに飲みきれるのも気に入っています。授乳が終わっても定番飲料としてリピしようと思っています。
1,B00I39BQM6,国太楼 ルイボスティー ティーバッグ (3g×18P)×5個,国太楼,norihatsu,2019年3月9日,5.0,リピートします,飲み始めて20年近くなります。夏は冷たくして、冬は熱々で1年中欠かすことができません。周りにもファンが多いです。
2,B00I39BQM6,国太楼 ルイボスティー ティーバッグ (3g×18P)×5個,国太楼,NAT,2018年12月2日,4.0,我が家の定番です,もう何年も一年中ルイボスのんでいます。まとめ買いで安いので助かります。
3,B00I39BQM6,国太楼 ルイボスティー ティーバッグ (3g×18P)×5個,国太楼,Amazon カスタマー,2016年1月11日,5.0,美味しくて健康的,今までメーカー直販で購入していましたが、こちらで購入したほうが安くて便利です。
4,B00I39BQM6,国太楼 ルイボスティー ティーバッグ (3g×18P)×5個,国太楼,細川健一,2016年11月15日,5.0,安価,高齢で便秘・アトピー性皮膚炎に苦しんでいる身内に飲ませている。便秘薬では効きすぎて腹痛となり逆に体調を崩していたが、この茶を飲み始めてから薬に頼ることなくコンスタントに排便できており、自然に腹具合が整い腸内環境も改善したのか十数年患っているアトピー性皮膚炎の痒みも軽減したと喜んでいた。また注文させていただく。
5,B00I39BQM6,国太楼 ルイボスティー ティーバッグ (3g×18P)×5個,国太楼,Amazon カスタマー,2016年7月23日,1.0,Amazonさんのほうが利便性良いです。,この手の健康茶にありがちなお腹の不調が・・。お腹弱い人はワンパスした方が良いです。効能は一切感じませんでした。５個ｘ２箱も買ってしまったorz
6,B00I39BQM6,国太楼 ルイボスティー ティーバッグ (3g×18P)×5個,国太楼,Amazon user,2021年6月20日,2.0,整腸・皮膚状態改善に利用,味にクセがなくノンカフェインで飲む時間帯を選びません。スッキリして飲みやすいのですが、パッケージにチャックが付いていたら便利なのに…と思いました。別のケースに入れ替えてます。
7,B00I39BQM6,国太楼 ルイボスティー ティーバッグ (3g×18P)×5個,国太楼,積み師,2021年4月9日,5.0,はははは腹がｗｗ,以前別途何気なく購入したのだが一家で愛飲。そのとき購入したパックが少なくなり、探してみたら同じ会社（国太楼）のものがあるじゃないですか。ということで早速購入。なくなりそうになったらまた買います。
