,ASIN,product,brand,name,date,score,title,comment
131,B013OSZVC6,Lakshimi(ラクシュミー) 極上はちみつ紅茶 ティーバッグ25袋入り,Lakshimi,Amazon カスタマー,2020年3月15日,2.0,とても美味しい！,味はおいしいらしいが、指定した時間通りに品物が届かなかった。
132,B013OSZVC6,Lakshimi(ラクシュミー) 極上はちみつ紅茶 ティーバッグ25袋入り,Lakshimi,纐纈 ゆか,2020年8月19日,5.0,とても美味しい,蜂蜜の味が、紅茶に溶けて、はまる美味しさです！毎日、ホットします❗
133,B013OSZVC6,Lakshimi(ラクシュミー) 極上はちみつ紅茶 ティーバッグ25袋入り,Lakshimi,Amazon カスタマー,2021年5月27日,5.0,味はおいしいらしいが。。。,家族みんな大好きなので　切らさないよう購入しています。手土産にも喜ばれます。
134,B013OSZVC6,Lakshimi(ラクシュミー) 極上はちみつ紅茶 ティーバッグ25袋入り,Lakshimi,佐野,2017年3月22日,5.0,甘さ。,本当においしい紅茶です！疲れたときとかに飲むのがおすすめです
135,B013OSZVC6,Lakshimi(ラクシュミー) 極上はちみつ紅茶 ティーバッグ25袋入り,Lakshimi,Amazon カスタマー,2020年5月19日,5.0,他にはない美味しさ,友人に勧められ飲んでみてすっかりはまってしまいました。はちみつの甘さたっぷりで美味しい！甘党の方には本当におすすめです。
136,B013OSZVC6,Lakshimi(ラクシュミー) 極上はちみつ紅茶 ティーバッグ25袋入り,Lakshimi,杉山洋子,2021年6月8日,3.0,美味しい❤,疲れて　ホットする時には、心癒される。蜂蜜の香りが、良いです。
137,B013OSZVC6,Lakshimi(ラクシュミー) 極上はちみつ紅茶 ティーバッグ25袋入り,Lakshimi,藤井駿,2021年6月20日,5.0,ぜひ試してみてください！！,疲れた時に飲んでホッと一息できました！
138,B013OSZVC6,Lakshimi(ラクシュミー) 極上はちみつ紅茶 ティーバッグ25袋入り,Lakshimi,明美,2021年2月24日,5.0,ホッコリする,とても、気に入っています
139,B013OSZVC6,Lakshimi(ラクシュミー) 極上はちみつ紅茶 ティーバッグ25袋入り,Lakshimi,由美,2018年3月28日,3.0,砂糖なしで甘くとっても美味しい,かなり甘いので1杯飲むだけで満足できます。疲れた時にいいかもしれません。
140,B013OSZVC6,Lakshimi(ラクシュミー) 極上はちみつ紅茶 ティーバッグ25袋入り,Lakshimi,山本景子,2020年3月22日,5.0,こんな紅茶飲みたくない！,甘くて良い香りに癒されます。
141,B013OSZVC6,Lakshimi(ラクシュミー) 極上はちみつ紅茶 ティーバッグ25袋入り,Lakshimi,くま,2020年10月1日,5.0,疲れた時にいいかも,おいしい
142,B013OSZVC6,Lakshimi(ラクシュミー) 極上はちみつ紅茶 ティーバッグ25袋入り,Lakshimi,MRK131620,2020年3月4日,5.0,甘い。香り良し。,はちみつの匂いも紅茶の味もとても良かったです。友達に勧められて買いました！
143,B013OSZVC6,Lakshimi(ラクシュミー) 極上はちみつ紅茶 ティーバッグ25袋入り,Lakshimi,ちび,2020年3月15日,5.0,おいしい,紅茶とはちみつの香りがバランスよく、口に入れた時に香りから想像する甘さを伴った味わいが感じられました。また買いまーす！
144,B013OSZVC6,Lakshimi(ラクシュミー) 極上はちみつ紅茶 ティーバッグ25袋入り,Lakshimi,27歳女性,2019年3月2日,5.0,美味しい！,疲れた時にホッと出来る甘さで凄く美味しいです☕またリピしたいと思います✨✨✨
145,B013OSZVC6,Lakshimi(ラクシュミー) 極上はちみつ紅茶 ティーバッグ25袋入り,Lakshimi,きつね,2020年4月12日,5.0,おすすめ！,大好きな紅茶です🎵はちみつの甘味も❤️
146,B013OSZVC6,Lakshimi(ラクシュミー) 極上はちみつ紅茶 ティーバッグ25袋入り,Lakshimi,Amazon カスタマー,2020年5月13日,5.0,甘い紅茶が好きな方にオススメ,濃いめに入れてアイスにしたら美味しいです❗️
147,B013OSZVC6,Lakshimi(ラクシュミー) 極上はちみつ紅茶 ティーバッグ25袋入り,Lakshimi,Amazon カスタマー,2020年11月1日,5.0,癒される紅茶です,ほどよい甘味で香りもいいです(^^)
148,B013OSZVC6,Lakshimi(ラクシュミー) 極上はちみつ紅茶 ティーバッグ25袋入り,Lakshimi,ままさん,2020年4月17日,5.0,凄く美味しい,蜂蜜の香りもよく、甘くて美味しいです
149,B013OSZVC6,Lakshimi(ラクシュミー) 極上はちみつ紅茶 ティーバッグ25袋入り,Lakshimi,mayosakoki,2020年6月3日,3.0,香りで幸せになれる☆,美味しかったですが、私には少し甘すぎました😅
150,B013OSZVC6,Lakshimi(ラクシュミー) 極上はちみつ紅茶 ティーバッグ25袋入り,Lakshimi,つ,2020年10月18日,5.0,濃厚。1杯で満足感がある。,想像以上に1口目から甘さが広がって美味しかったです。
151,B013OSZVC6,Lakshimi(ラクシュミー) 極上はちみつ紅茶 ティーバッグ25袋入り,Lakshimi,こうたん,2021年1月7日,5.0,甘い😊,送り先から美味しいとよろこばれた。
152,B013OSZVC6,Lakshimi(ラクシュミー) 極上はちみつ紅茶 ティーバッグ25袋入り,Lakshimi,ゆきんこ,2021年2月25日,1.0,リラックスタイムに。,砂糖を入れなくてもハチミツの甘味で本当においしいです！
153,B013OSZVC6,Lakshimi(ラクシュミー) 極上はちみつ紅茶 ティーバッグ25袋入り,Lakshimi,BLUE,2021年6月7日,5.0,はちみつの風味が凄くしてとても美味しいです,蜂蜜の香りと丁度良い甘さでホッとします。
154,B013OSZVC6,Lakshimi(ラクシュミー) 極上はちみつ紅茶 ティーバッグ25袋入り,Lakshimi,nao,2020年6月25日,5.0,冬におすすめ,とても美味しい。ホットでもアイスでも美味しかった。
155,B013OSZVC6,Lakshimi(ラクシュミー) 極上はちみつ紅茶 ティーバッグ25袋入り,Lakshimi,マロン,2019年12月2日,5.0,美味しい,美味しいです。お湯を少し少なめにして甘めにして飲むのが好き
156,B013OSZVC6,Lakshimi(ラクシュミー) 極上はちみつ紅茶 ティーバッグ25袋入り,Lakshimi,f,2019年4月22日,4.0,味,紅茶とゆうより蜂蜜をといて飲んでいるみたいなかんじです。蜂蜜好きなので好みです。
157,B013OSZVC6,Lakshimi(ラクシュミー) 極上はちみつ紅茶 ティーバッグ25袋入り,Lakshimi,tago2016,2020年3月2日,5.0,美味しいこと,ほどよい甘さにハチミツの良い香りで癒されます。美味しいです。
158,B013OSZVC6,Lakshimi(ラクシュミー) 極上はちみつ紅茶 ティーバッグ25袋入り,Lakshimi,山本 明日香,2020年1月26日,4.0,蜂蜜です。,はちみつの甘さが最高！すごくリラックスできる味です。
159,B013OSZVC6,Lakshimi(ラクシュミー) 極上はちみつ紅茶 ティーバッグ25袋入り,Lakshimi,田中 麻理,2020年4月10日,5.0,美味しい,普段は珈琲派なんですが、これは美味しい。思わずリピしちゃいます。癒しのひとときですね
160,B013OSZVC6,Lakshimi(ラクシュミー) 極上はちみつ紅茶 ティーバッグ25袋入り,Lakshimi,Amazon カスタマー,2020年4月11日,5.0,ハチミツ紅茶,香りだけでなくしっかりはちみつの味がします！とっても美味しいです
161,B013OSZVC6,Lakshimi(ラクシュミー) 極上はちみつ紅茶 ティーバッグ25袋入り,Lakshimi,大田 敏治,2020年4月28日,5.0,味と香り,定期的に購入してます！美味しくて紹介した人はみんな気に入って飲んでます。
162,B013OSZVC6,Lakshimi(ラクシュミー) 極上はちみつ紅茶 ティーバッグ25袋入り,Lakshimi,りんご飴,2020年10月3日,4.0,はちみつの味,もう少しお安くなれば⭐︎5個になるかなぁ
163,B013OSZVC6,Lakshimi(ラクシュミー) 極上はちみつ紅茶 ティーバッグ25袋入り,Lakshimi,M,2021年2月10日,5.0,本当に美味しい！！,リピートします
164,B013OSZVC6,Lakshimi(ラクシュミー) 極上はちみつ紅茶 ティーバッグ25袋入り,Lakshimi,永井　珠代,2020年5月10日,5.0,美味しい,はちみつの香りとほどよい甘さで癒されます。家族にも好評です。
165,B013OSZVC6,Lakshimi(ラクシュミー) 極上はちみつ紅茶 ティーバッグ25袋入り,Lakshimi,さこ,2019年12月25日,5.0,ギフトに,以前、友人にもらって、とても美味しかったので購入しました。またリピするつもりです。
166,B013OSZVC6,Lakshimi(ラクシュミー) 極上はちみつ紅茶 ティーバッグ25袋入り,Lakshimi,kimie,2021年1月9日,5.0,おこもり生活でひと息つきたい時に,おいしいです
167,B013OSZVC6,Lakshimi(ラクシュミー) 極上はちみつ紅茶 ティーバッグ25袋入り,Lakshimi,もこにゃん,2020年3月2日,5.0,美味しい紅茶です！,はちみつの良い香りと紅茶で、美味しくいただきました。
168,B013OSZVC6,Lakshimi(ラクシュミー) 極上はちみつ紅茶 ティーバッグ25袋入り,Lakshimi,スペース,2017年8月2日,5.0,味と風味,びっくりしましたが、とても美味しかったです。ありがとうございました。
169,B013OSZVC6,Lakshimi(ラクシュミー) 極上はちみつ紅茶 ティーバッグ25袋入り,Lakshimi,てっちゃぁん,2020年7月11日,5.0,あまくてほっとする味,蜂蜜の甘さが最高！
170,B013OSZVC6,Lakshimi(ラクシュミー) 極上はちみつ紅茶 ティーバッグ25袋入り,Lakshimi,sydney,2020年6月28日,5.0,ありがとうございました。,安定の美味しさです！
171,B013OSZVC6,Lakshimi(ラクシュミー) 極上はちみつ紅茶 ティーバッグ25袋入り,Lakshimi,傳法千里,2020年6月22日,5.0,蜂蜜の甘さ,美味しかった🤗
172,B013OSZVC6,Lakshimi(ラクシュミー) 極上はちみつ紅茶 ティーバッグ25袋入り,Lakshimi,ゆー,2020年2月3日,5.0,無くなると欲しくなる,早いし美味しかったです。
173,B013OSZVC6,Lakshimi(ラクシュミー) 極上はちみつ紅茶 ティーバッグ25袋入り,Lakshimi,もも,2016年5月2日,5.0,●,美味しすぎます。プレゼンした方からは必ず入手先を聞かれます。
174,B013OSZVC6,Lakshimi(ラクシュミー) 極上はちみつ紅茶 ティーバッグ25袋入り,Lakshimi,Amazon カスタマー,2018年3月1日,1.0,早かった。,楽しみにしてましたが、私は美味しいとは思えません甘すぎです普通の紅茶に蜂蜜入れたほうがおいしいですね150ccで2分蒸らすって描いてあるけど、相当濃くなるし、人工甘味料の後味なのか気持ち悪いです。まだ美味しくのむなら、大きいティーポットで入れたほうがいいです。
175,B013OSZVC6,Lakshimi(ラクシュミー) 極上はちみつ紅茶 ティーバッグ25袋入り,Lakshimi,Amazon カスタマー,2015年11月13日,5.0,癒しのお茶,紅茶の香りがよく、甘味もちょうどよくてとても気に入っています。
176,B013OSZVC6,Lakshimi(ラクシュミー) 極上はちみつ紅茶 ティーバッグ25袋入り,Lakshimi,Amazon カスタマー,2016年11月16日,3.0,すごく美味しい。ティーバッグ紅茶の概念を変えてしまいます(*^^*),カモミールと飲み比べてみました。カモミールのほうは紅茶の味は控えめな分、はちみつの味がよくわかり甘く感じます。こちらは紅茶の味が強く、はちみつの味はほんのりでした。個人的にはカモミールのほうが好きです。
177,B013OSZVC6,Lakshimi(ラクシュミー) 極上はちみつ紅茶 ティーバッグ25袋入り,Lakshimi,いろまる,2017年7月12日,5.0,美味しい。,いただいて飲んでからすごく美味しくてすっかり虜です。最初はうわ、甘い！！ってなるんですがw慣れれば味の濃さも自分の好みで調整していけます。喉が弱いのでお高いマヌカハニーではコストかかり過ぎるのでこれと併用してます。
178,B013OSZVC6,Lakshimi(ラクシュミー) 極上はちみつ紅茶 ティーバッグ25袋入り,Lakshimi,アマゾネス,2018年1月14日,5.0,カモミールと飲み比べ,すぐに届きました☆はちみつの甘さや香りはあるけど、はちみつ独特の喉に残る感じはなく、後味スッキリの紅茶です！！
179,B013OSZVC6,Lakshimi(ラクシュミー) 極上はちみつ紅茶 ティーバッグ25袋入り,Lakshimi,サユ,2016年5月13日,4.0,子供も大好きなハニーティー,甘いものが食べたくなってもこちらを楽しんでます。美容にも良い。
180,B013OSZVC6,Lakshimi(ラクシュミー) 極上はちみつ紅茶 ティーバッグ25袋入り,Lakshimi,syk,2016年10月23日,2.0,本当に美味しい。,みなさん甘くて美味しいとレビューされていますが、届いて飲んでみたところフツーの紅茶でした。少なくとも以前頂いて飲んだものとは別物です。あの美味しさに感動して購入したのになんだかがっかりです。鮮度とかあるんですかね？多少遠出ですがやっぱ現地で買えば良かった。
181,B013OSZVC6,Lakshimi(ラクシュミー) 極上はちみつ紅茶 ティーバッグ25袋入り,Lakshimi,ゆいまる,2018年5月27日,1.0,美容にも,忙しくしていて、友達から息抜きにとプレゼントしてもらいました。びっくりするほど甘くて、飲み干してしばらくすると胸焼けがして、吐き気が…農薬でも入ってるのかと成分調べたら「主原料 茶葉（紅茶）、はちみつパウダー（粉末はちみつ・、香料)甘味料（アスパルテーム（L－フェニルアラニン含む）」甘味料がアウトだったようです…。これが極上？安っぽい紅茶の味です。化学調味料を気にしない方は、美味しく飲めるのかなと思いますが。
182,B013OSZVC6,Lakshimi(ラクシュミー) 極上はちみつ紅茶 ティーバッグ25袋入り,Lakshimi,t-2014,2019年8月25日,1.0,なんかちがう,他の方も指摘されてますが、「極上」「はちみつ」の表記がありながら人工甘味料入り。作り物感満載なはちみつ風の強すぎる香りと、強烈すぎる甘さ。紅茶ですが、ティーカップで出してはいけません。喉が焼けます。どうしても飲むというのであればティーポットやマグにたっぷりのお湯で薄く抽出するか、ミルクをたっぷり入れるか、アイスティーが良いでしょう。普段まともな紅茶を飲んでらっしゃる方にはオススメしません。どうかお手持ちの紅茶にはちみつを入れて召し上がってください。紅茶の香りなどどうでも良い、とにかく甘けりゃ良いという方には向いているのではないでしょうか。極上はちみつシリーズにはカモミールとミントがありますが、強烈なハーブの香りが喧嘩しているので更におすすめしません。
183,B013OSZVC6,Lakshimi(ラクシュミー) 極上はちみつ紅茶 ティーバッグ25袋入り,Lakshimi,田中光代,2020年5月14日,2.0,胸焼け、吐き気、甘味料,極上っていうネーミングに騙されてる気がする。いや、はちみつ入れた紅茶のお味です。おいしいとは思うけど甘過ぎて飲めない。１袋開けて、２袋目を開ける気にならない。ちなみに私は普段紅茶に砂糖を入れずに飲む派ですので甘党の方には参考にならないかもしれません。糖分の入った液体の紅茶が好きな方にはおいしいい紅茶だと思います。私は苦手でした。甘すぎる。
184,B013OSZVC6,Lakshimi(ラクシュミー) 極上はちみつ紅茶 ティーバッグ25袋入り,Lakshimi,みねすと,2020年11月26日,2.0,ハチミツ味を期待してはいけない,ホテルに泊まった際、アメニティでこれが置いてあり飲んだところ、凄く美味しい！甘くて幸せになり購入を検討したのだが、何とアスパルテームが入っているではないか…！甘味料について知識が乏しいのでアスパルテームについて調べてみたところ、恐ろしい添加物だとわかった。甘味料なしでも十分甘みがあるのではないだろうか？私のように味は気に入ったけれども甘味料が引っかかってリピートに繋がらない人は意外と沢山いると思う。甘味料なしで販売を検討してもらいたい。
185,B013OSZVC6,Lakshimi(ラクシュミー) 極上はちみつ紅茶 ティーバッグ25袋入り,Lakshimi,kuwaman,2019年2月6日,1.0,甘味料の味が強すぎる,以前雑貨屋さんで小分けで売られていたので気になって1つ購入...紅茶にハチミツを入れて飲むのが大好きなのでめっちゃ期待してたんですけど飲んだらとてつもなく甘いし人口甘味料の味が気になります...レビューで高評価なのが不思議です。箱買いしなくて正解でした！！
186,B013OSZVC6,Lakshimi(ラクシュミー) 極上はちみつ紅茶 ティーバッグ25袋入り,Lakshimi,attarhj,2019年12月24日,1.0,人工甘味料が無ければ良かった,知り合いが絶賛するので購入しましたが、あまりの甘さにビックリしました。そしてアスパルテームが入っているとわかってもう一度びっくり！３箱も買ってしまって、どう消費しようか困っています。
187,B013OSZVC6,Lakshimi(ラクシュミー) 極上はちみつ紅茶 ティーバッグ25袋入り,Lakshimi,メキ,2020年10月30日,1.0,香りはいいですがこれはまずいです,商品名につられて購入しましたが甘すぎて飲めないです。捨てるのがもったいないので一度お湯でパウダーを落としてからミルクティーにすればなんとかやさしい味になります。人工甘味料が紅茶本来の旨味を損なっています。
188,B013OSZVC6,Lakshimi(ラクシュミー) 極上はちみつ紅茶 ティーバッグ25袋入り,Lakshimi,たまたん,2018年8月14日,1.0,残念です,人工甘味料の甘さが強烈で、独特の後味がします。いい茶葉を使っていたとしても台無しですね。
189,B013OSZVC6,Lakshimi(ラクシュミー) 極上はちみつ紅茶 ティーバッグ25袋入り,Lakshimi,いぬ座,2017年5月7日,4.0,甘すぎて紅茶本来の旨味を味わえない,一口飲んだ瞬間に魅了されました。おいしい。ただ残念ながら人工甘味料が使われてる！リピするか迷います。人工甘味料…やめてください！
190,B013OSZVC6,Lakshimi(ラクシュミー) 極上はちみつ紅茶 ティーバッグ25袋入り,Lakshimi,K-A9,2021年5月9日,2.0,人工甘味料風味,近所の洋菓子店に置いてあり、気になったので購入しましたが、甘すぎます午後の紅茶が好きな方や普通の紅茶にガムシロップをガバガバ入れている人にはおすすめです。午後の紅茶はちみつ風味、または紅茶にガムシロップをたくさん入れたような味です私は午後の紅茶好きでも甘党でもないので合いませんでした。人工甘味料の味が強いです。他の方も書いてますが牛乳を入れるとマシになります。
191,B013OSZVC6,Lakshimi(ラクシュミー) 極上はちみつ紅茶 ティーバッグ25袋入り,Lakshimi,Amazon カスタマー,2021年4月22日,2.0,はちみつが優しい,最初の1杯は甘くて美味しい〜と思いました。しかし、何回か飲んでると蜂蜜の味は感じなくなり、人工甘味料の甘さだけしか感じなくなりました。そのうちその甘さが気持ち悪くなり、１箱を飲みきるのは無理そうです。自然の蜂蜜だけで甘さを出すのは難しいのでしょうか？買うことはないですね。
192,B013OSZVC6,Lakshimi(ラクシュミー) 極上はちみつ紅茶 ティーバッグ25袋入り,Lakshimi,cat,2019年12月11日,4.0,香りはとても良いです,仕事で遅くまでしてる時、夜中にほっこりリセットできる。友人もらったから飲みでみようと、ティーパックを開けた時から蜂蜜の香りが。はじめての一口目は、正直、めちゃ甘いって思ったけど飲み始めるとそうでもなくなる。そそぐ湯量でも甘さは変えれるけど、この甘さがないとって感じるようになってくる...疲れている時に飲むからかもだけど、連日、飲んでいる自分に気がつく。家や職場でもホットミルクに、はちみつを入れて飲んでたけど職場では、極上はちみつ紅茶にいつの間にか比重がって感じで美味しくいただいてる。
193,B013OSZVC6,Lakshimi(ラクシュミー) 極上はちみつ紅茶 ティーバッグ25袋入り,Lakshimi,Daria,2020年12月6日,4.0,ほっこり,甘めが好きなので、砂糖入れなくてます甘くてとても美味しかったです。人工甘味料とあったのが少しだけ残念だけど、さほど気にしないので、味だけで言えば好みです。無くなったらまた買いたい。
194,B013OSZVC6,Lakshimi(ラクシュミー) 極上はちみつ紅茶 ティーバッグ25袋入り,Lakshimi,ぴかる,2021年1月24日,5.0,いつの間にか日課に。,美味しくてビックリ！！甘いとは思わずに飲んだので、驚きました！美味しさに癒されます。
195,B013OSZVC6,Lakshimi(ラクシュミー) 極上はちみつ紅茶 ティーバッグ25袋入り,Lakshimi,ゆゆゆ,2021年5月29日,3.0,美味しい,１０箱まとめ売とはいえ、全ての箱をテープで一つにされていたので剥がすのに苦労した。せめて袋に入れたものをテープでとめるくらいにしてほしかった。そのままダイレクトにテープが貼られており、一箱一箱バラすのが包装フィルムが剥がれてしまいそうで困った。お礼として配るものだったので。それが無ければ星５個。
196,B013OSZVC6,Lakshimi(ラクシュミー) 極上はちみつ紅茶 ティーバッグ25袋入り,Lakshimi,ビューティ,2021年5月29日,1.0,美味です！,甘すぎです。スプーン一杯だけ飲んで甘すぎて後は飲めず…人工甘味料のしつこい甘さがいつまでも残ります。せっかくのはちみつがもったいない。一箱買って、減らず困ってます
197,B013OSZVC6,Lakshimi(ラクシュミー) 極上はちみつ紅茶 ティーバッグ25袋入り,Lakshimi,まるもちゃん,2021年1月27日,5.0,テープで止めるのはやめてください…,ティパック1つを大きいポットに入れて800くらいお湯入れて家族皆で飲んでます。特に子供に好評です。甘さが癒やされます。美味しいし、皆で飲めて幸せです。市販の紅茶にはちみつ入れてもこんな味になりません。ただ、棚がハチミツの匂いになるので、ジップロックが必要です。
198,B013OSZVC6,Lakshimi(ラクシュミー) 極上はちみつ紅茶 ティーバッグ25袋入り,Lakshimi,Amazon カスタマー,2020年3月14日,3.0,飲めない,こればかりは人それぞれ、甘さ控えめが好みの私には甘すぎた。タンブラーにたっぷり入れて薄めに作っても甘いけどまあ飲める。人工甘味料は気になるけど飲み続けるわけではないから、と納得させる。とあるSNSで絶賛してたけど私には？が付いた。
199,B013OSZVC6,Lakshimi(ラクシュミー) 極上はちみつ紅茶 ティーバッグ25袋入り,Lakshimi,川と海,2020年2月20日,4.0,たくさん出せる,想像以上に甘いのでかなりお湯を多めにしないと飲めない。　従って濃い紅茶を好む方にはお勧め出来ない。ただ、かなりの甘党なら濃いめも大丈夫だとは思う。後で砂糖を加えたりする必要も無いので手間がなくて便利。
200,B013OSZVC6,Lakshimi(ラクシュミー) 極上はちみつ紅茶 ティーバッグ25袋入り,Lakshimi,てるてる,2021年5月20日,2.0,人工甘味料はやめましょう,友人に薦められて購入。楽しみにしていたのにマズくてほとんど飲めませんでした…人工甘味料の後味が凄く苦手なので入っているとわかっていたら買わなかったです。かなり甘かったので大量に入っているかと。
201,B013OSZVC6,Lakshimi(ラクシュミー) 極上はちみつ紅茶 ティーバッグ25袋入り,Lakshimi,aaa,2020年4月19日,5.0,人工甘味料,リピート買いしました。
202,B013OSZVC6,Lakshimi(ラクシュミー) 極上はちみつ紅茶 ティーバッグ25袋入り,Lakshimi,sa,2020年5月15日,5.0,はちみつの香りは良いが…,これは美味しい！人工甘味料ガーの人はオーガニックの茶葉とオーガニックの蜂蜜で自作してください。今時何が含まれてるか事前に情報とれるのに、よく読まずに買って人工甘味料云々言うのは情弱のすることかなと。
