,ASIN,product,brand,name,date,score,title,comment
203,B013OSZVC6,Lakshimi(ラクシュミー) 極上はちみつ紅茶 ティーバッグ25袋入り,Lakshimi,遊佐なつみ,2019年12月1日,5.0,オススメ,いつもおいしくいただいています。届いたらすぐにジップロックに入れ、風味が飛ばないようにしています。香りが長持ちする気がします。
204,B013OSZVC6,Lakshimi(ラクシュミー) 極上はちみつ紅茶 ティーバッグ25袋入り,Lakshimi,Amazon カスタマー,2021年1月19日,5.0,なくなると困る美味しさ,驚くほど美味しい。
205,B013OSZVC6,Lakshimi(ラクシュミー) 極上はちみつ紅茶 ティーバッグ25袋入り,Lakshimi,さとみ,2016年9月11日,5.0,甘さがちょうど良い,２煎、３煎は当たり前。な、なんと４煎５煎めも　多少薄くはなりますが、まだまだ味わえちゃいます。紅茶では多少高価ですが、それだけの価値はあるのではと思います。が１０００円くらいならもっと嬉しいのは本音ですが。（＾＾）
206,B013OSZVC6,Lakshimi(ラクシュミー) 極上はちみつ紅茶 ティーバッグ25袋入り,Lakshimi,urahero,2016年3月17日,4.0,ホッとする美味しさ。,ウッホ！おもわずゴリラになるくらい美味しい。甘いうまいウッホ！
207,B013OSZVC6,Lakshimi(ラクシュミー) 極上はちみつ紅茶 ティーバッグ25袋入り,Lakshimi,ともりん,2020年10月22日,5.0,ほっとする贅沢気分を味わえます。,ラクシュミーの極上はちみつ紅茶は知人から頂いて気に入り、今回はこちらで購入しました。ミルク入れて飲むのがお気に入りです。
208,B013OSZVC6,Lakshimi(ラクシュミー) 極上はちみつ紅茶 ティーバッグ25袋入り,Lakshimi,Amazon カスタマー,2021年4月25日,3.0,めちゃめちゃ美味しい,今、届いたのですが…まだ箱が開いていない状況ですでに破れていました。
209,B013OSZVC6,Lakshimi(ラクシュミー) 極上はちみつ紅茶 ティーバッグ25袋入り,Lakshimi,西尾ゆか,2020年12月15日,5.0,うまい,以前、友人にいただきとっても美味しくてそれ以来、リピートしています♪
210,B013OSZVC6,Lakshimi(ラクシュミー) 極上はちみつ紅茶 ティーバッグ25袋入り,Lakshimi,困ったちゃん,2020年8月13日,5.0,開いたら…,最高に、美味しい！誰かにプレゼントしたくなりますよ。私は、配りまくりました。
211,B013OSZVC6,Lakshimi(ラクシュミー) 極上はちみつ紅茶 ティーバッグ25袋入り,Lakshimi,あっす,2020年10月19日,5.0,最高の紅茶！,ほんのり甘くて美味しいです
212,B013OSZVC6,Lakshimi(ラクシュミー) 極上はちみつ紅茶 ティーバッグ25袋入り,Lakshimi,よっしー,2021年1月2日,5.0,癒されます❗️,甘くておいしいです
