,ASIN,product,brand,name,date,score,title,comment
51,B013OSZVC6,Lakshimi(ラクシュミー) 極上はちみつ紅茶 ティーバッグ25袋入り,Lakshimi,野村美惠子,2018年3月18日,5.0,ハチミツの甘さがとても良い,妹に勧められて買ってみました。なんとおいしい！思っていたよりも蜂蜜の味がしっかり濃いくて、甘くてほんわかします。これはまた買いたいと思いました。
52,B013OSZVC6,Lakshimi(ラクシュミー) 極上はちみつ紅茶 ティーバッグ25袋入り,Lakshimi,えむえむ,2020年5月12日,5.0,甘味料さえなければ……,はちみつの香りがすごい、お砂糖ミルクなしで飲めます
53,B013OSZVC6,Lakshimi(ラクシュミー) 極上はちみつ紅茶 ティーバッグ25袋入り,Lakshimi,Chisato,2020年4月7日,5.0,予想以上においしい！,めっちゃ驚いた衝撃の美味さ紅茶革命来たり本当に飲んでほしい勿体なさすぎて大切に飲んでる甘いの！！！ちゃんと甘い！！！美味しいの！！！ありがとうを伝えたい
54,B013OSZVC6,Lakshimi(ラクシュミー) 極上はちみつ紅茶 ティーバッグ25袋入り,Lakshimi,かなまうす,2021年4月23日,3.0,ストレートでも飲める,普段、紅茶はストレートで飲むことが多いのですが、個人的には甘すぎでした。結構甘いです。想像している以上に甘かったです。ミルクティーにしても大分甘いので、甘党な人向けだと思います。私は1人で飲みきれない感じだったので知り合いにあげたりしましたが、皆さん美味しかったとのことで気に入って頂けたみたいなので、贈り物としてまた買いたいです。
55,B013OSZVC6,Lakshimi(ラクシュミー) 極上はちみつ紅茶 ティーバッグ25袋入り,Lakshimi,Amazon カスタマー,2021年1月23日,5.0,甘いの！！,ミルクティーにしたら、甘くて紅茶の味も美味しい。甘いものが食べたくなった時におやつを食べなくて済む！リラックスします。
56,B013OSZVC6,Lakshimi(ラクシュミー) 極上はちみつ紅茶 ティーバッグ25袋入り,Lakshimi,ちい,2021年7月4日,4.0,手軽で甘くて美味しい,私にはかなり甘めでした。薄めに入れようと思います。リピートはしないかも
57,B013OSZVC6,Lakshimi(ラクシュミー) 極上はちみつ紅茶 ティーバッグ25袋入り,Lakshimi,アマゾン,2019年12月27日,3.0,ちょっと高い,お砂糖を入れなくてもはちみつの味がほんのり甘い、というところを気に入り購入しました。商品そのものに不満はありませんが、届いたときに紅茶の箱が一部傷んでいたのがすごく残念でした。
58,B013OSZVC6,Lakshimi(ラクシュミー) 極上はちみつ紅茶 ティーバッグ25袋入り,Lakshimi,Amazon カスタマー,2021年7月13日,1.0,甘い,風味付け程度かと思ったら想像の何十倍も甘くて驚きました。よく紙パックで売られているような飲料よりも甘いです。甘味料の味なのかは分かりませんが、飲んだ後も純粋な砂糖や蜂蜜とは違う変な甘さがしばらく口に残り、正直気分の良い後味ではありません。
59,B013OSZVC6,Lakshimi(ラクシュミー) 極上はちみつ紅茶 ティーバッグ25袋入り,Lakshimi,もち,2019年3月12日,5.0,箱がボコボコ,ここの極上はちみつ紅茶は、疲れている時、ストレスがたまっている時に心を穏やかにリラックスさせてくれます。癒される紅茶で気に入ってます。
60,B013OSZVC6,Lakshimi(ラクシュミー) 極上はちみつ紅茶 ティーバッグ25袋入り,Lakshimi,ましろ,2020年7月16日,5.0,とにかく甘い,風味が良く美味しい少し甘いのでミルクを入れています
61,B013OSZVC6,Lakshimi(ラクシュミー) 極上はちみつ紅茶 ティーバッグ25袋入り,Lakshimi,山下公子,2021年1月13日,5.0,癒し効果ぎある,これは美味しい　味もしっかり出る少し多めのお湯で出しても良いくらい味がしっかりでます
62,B013OSZVC6,Lakshimi(ラクシュミー) 極上はちみつ紅茶 ティーバッグ25袋入り,Lakshimi,ラベンダー,2020年3月5日,3.0,風味豊か,リピート購入で今回1箱しか注文しなかったためか、袋上の簡易梱包で、開けると中身みえてきそうなぐらい箱があちこちへこんでいました。過重包装は好みませんが、中身品質には影響ないとはいえ、箱がぐちゃぐちゃでは、テンションさがります。
63,B013OSZVC6,Lakshimi(ラクシュミー) 極上はちみつ紅茶 ティーバッグ25袋入り,Lakshimi,KK,2021年2月24日,3.0,人におすすめしたくなる紅茶です,淹れたてはおいしい！冷めると蜂蜜の味が強くなって甘ーくなってしまうので、早めに飲むのがおすすめ。
64,B013OSZVC6,Lakshimi(ラクシュミー) 極上はちみつ紅茶 ティーバッグ25袋入り,Lakshimi,Amazon カスタマー,2021年6月5日,2.0,噂通りでした,甘すぎて私には飲めません、女の子向きかと思います。
65,B013OSZVC6,Lakshimi(ラクシュミー) 極上はちみつ紅茶 ティーバッグ25袋入り,Lakshimi,政之助,2021年6月17日,3.0,甘ぁ〜い！,流行りに乗っかって買ってみました。味は美味しいです！ただ1700円もすると思うとやっぱり高いかな日常的にがぶがぶ飲むので。紅茶は高いですけどね。
66,B013OSZVC6,Lakshimi(ラクシュミー) 極上はちみつ紅茶 ティーバッグ25袋入り,Lakshimi,暇人,2020年10月11日,2.0,甘すぎる,はちみつの香りは良いけれど甘味料の味がかなり舌に残ります。甘味が強すぎて紅茶の味がわかりません。原材料とレビューをちゃんと見れば良かった。もう買いません。
67,B013OSZVC6,Lakshimi(ラクシュミー) 極上はちみつ紅茶 ティーバッグ25袋入り,Lakshimi,とっとこハム太郎,2019年10月25日,5.0,おいしい。コスパ的にはどうなんだろう。,上品な甘みとハチミツの心地よい香りに癒される商品。
68,B013OSZVC6,Lakshimi(ラクシュミー) 極上はちみつ紅茶 ティーバッグ25袋入り,Lakshimi,SALAMI,2020年2月22日,4.0,甘すぎて紅茶の味がしない,美味しいです！凄く甘いので牛乳で作ると美味しいです。
69,B013OSZVC6,Lakshimi(ラクシュミー) 極上はちみつ紅茶 ティーバッグ25袋入り,Lakshimi,naomi,2021年2月8日,5.0,友達に紹介されて購入,職場でワンパックもらい、とてもおいしかったので即買いました。他の人のご指摘のとおり、甘味料が入っているようですが、美味しいのて気にしません。ハチミツの味が幸せな気持ちにさせてくれます！来客があった時に出すと皆さん喜んでくれて好評です！
70,B013OSZVC6,Lakshimi(ラクシュミー) 極上はちみつ紅茶 ティーバッグ25袋入り,Lakshimi,糞パンチパーマ,2021年6月28日,1.0,甘い,雑誌に掲載されてて、商品名に釣られて購入。中身は聞いたことのない甘味料が入っており怖くて飲むのをやめました。
71,B013OSZVC6,Lakshimi(ラクシュミー) 極上はちみつ紅茶 ティーバッグ25袋入り,Lakshimi,matsumoku guitar,2021年7月14日,4.0,好評です！,友達からもらって飲んでみたら美味しかったので、自分にご褒美に買いました。別の友達にも教えてあげたら、神戸のお店に行ってました。
72,B013OSZVC6,Lakshimi(ラクシュミー) 極上はちみつ紅茶 ティーバッグ25袋入り,Lakshimi,mooa,2017年12月20日,5.0,ミルクティーにしたら更に美味しい,Amazonで購入するのは今回が初めてですが、以前からリピートしている商品です。本当に美味しい！寒い日に飲むと、心が温まります。
73,B013OSZVC6,Lakshimi(ラクシュミー) 極上はちみつ紅茶 ティーバッグ25袋入り,Lakshimi,和美,2021年1月12日,3.0,美味しさに驚いています。,甘味料の強すぎる甘みが邪魔に思えます。SNSで評判が良かったので買ってみたのですが、リピートはしません。この味で1杯110円は高すぎる。
74,B013OSZVC6,Lakshimi(ラクシュミー) 極上はちみつ紅茶 ティーバッグ25袋入り,Lakshimi,Amazon カスタマー,2020年6月27日,4.0,とても美味しい,友達の家でごちそうになって、おいしかったので、頼んでみました。甘過ぎない味とはちみつの香りで、ホッとします。
75,B013OSZVC6,Lakshimi(ラクシュミー) 極上はちみつ紅茶 ティーバッグ25袋入り,Lakshimi,SURUME111,2019年12月13日,5.0,甘味料の味,すごく美味しいです。凄く蜂蜜の味と香りがします。会社デスクで使うには少し高めでしたが、買って満足です😃
76,B013OSZVC6,Lakshimi(ラクシュミー) 極上はちみつ紅茶 ティーバッグ25袋入り,Lakshimi,つよまま,2021年7月13日,4.0,ホッとする味です。,美味しいです。
77,B013OSZVC6,Lakshimi(ラクシュミー) 極上はちみつ紅茶 ティーバッグ25袋入り,Lakshimi,さる吉,2021年6月8日,5.0,凄く蜂蜜の味と香りがします🐝⋆︎*ﾟ∗🐝,早く届いて良かったです。味も美味しかったです。リピ確定です。次回はまとめ買いします。
78,B013OSZVC6,Lakshimi(ラクシュミー) 極上はちみつ紅茶 ティーバッグ25袋入り,Lakshimi,gossan51,2019年9月26日,5.0,美味しい,箱から出す前から甘い香りがしました。甘味料が入っていて、ミルクティーにして飲むと美味しかったです。
79,B013OSZVC6,Lakshimi(ラクシュミー) 極上はちみつ紅茶 ティーバッグ25袋入り,Lakshimi,ひらひら,2016年2月13日,5.0,噂通り美味しい。,以前頂いてあまりの美味しさにただ飲むだけではと思い購入しました。シフォンケーキやロールケーキ生地、ミルクとホワイトチョコを合わせてのパンナコッタ、などなど紅茶の香りとはちみつのコクがたまりません。はちみつパウダーの力は凄いです。
80,B013OSZVC6,Lakshimi(ラクシュミー) 極上はちみつ紅茶 ティーバッグ25袋入り,Lakshimi,マリンちゃん,2020年12月15日,5.0,本当に飲めば納得します,蜂蜜の香りだけのフレーバーかな？と期待を持ちすぎないように飲んだら驚きの蜂蜜味でした。すっかり虜になりました。
81,B013OSZVC6,Lakshimi(ラクシュミー) 極上はちみつ紅茶 ティーバッグ25袋入り,Lakshimi,mie,2021年2月22日,5.0,甘くておいしい,はちみつのちょうど良い甘さが、とても美味しいです。
82,B013OSZVC6,Lakshimi(ラクシュミー) 極上はちみつ紅茶 ティーバッグ25袋入り,Lakshimi,三好,2021年2月14日,5.0,商品名に偽りなし！,家族ではまってます。中々手に入らないのでありがたかったです。高価なので二箱にしましたが、もっと買っておけばよかったです。もう在庫無し、入荷予定未定だから…残念。
83,B013OSZVC6,Lakshimi(ラクシュミー) 極上はちみつ紅茶 ティーバッグ25袋入り,Lakshimi,Akira,2021年4月15日,5.0,絶品,お気に入り！誰に飲ませても美味しいって言われる❤
84,B013OSZVC6,Lakshimi(ラクシュミー) 極上はちみつ紅茶 ティーバッグ25袋入り,Lakshimi,にゃんこの大河,2020年3月8日,1.0,満足です。,思った以上に甘すぎた。アイスで飲んだ方がいいかも。
85,B013OSZVC6,Lakshimi(ラクシュミー) 極上はちみつ紅茶 ティーバッグ25袋入り,Lakshimi,Amazon カスタマー,2021年2月24日,5.0,オススメ,すぐ売り切れてしまうので、他社サイトでも購入しております。誰にあげても喜ばれるので、良く購入しております。カロリーが記載されているよりもあるんじゃないかと思うぐらい甘いです。文句なし。
86,B013OSZVC6,Lakshimi(ラクシュミー) 極上はちみつ紅茶 ティーバッグ25袋入り,Lakshimi,エマ,2021年2月11日,5.0,甘い！,蜂蜜そのものの味と甘さがします。甘すぎると思った時には、レモン汁を入れたり、ミルクを足したりしています。
87,B013OSZVC6,Lakshimi(ラクシュミー) 極上はちみつ紅茶 ティーバッグ25袋入り,Lakshimi,サイトウ,2016年4月7日,5.0,売ってたら即買いしてます。特に最近。,喫茶店で、見つけました。まったくおなじものがティポット1つで800円でした。他には味わえない紅茶だったので、こちらで買えて満足です。プレゼントにも喜ばれます。疲れたときなど、自分のご褒美にも、リピートです。
88,B013OSZVC6,Lakshimi(ラクシュミー) 極上はちみつ紅茶 ティーバッグ25袋入り,Lakshimi,ミスター　ミゾ,2021年2月27日,5.0,プチ贅沢,職場の同僚と分けました。はちみつの甘さがすごく美味しいです！毎日飲んでます！
89,B013OSZVC6,Lakshimi(ラクシュミー) 極上はちみつ紅茶 ティーバッグ25袋入り,Lakshimi,R,2020年11月3日,1.0,サロンのお客様にも出せる一品,これだけ甘くてなぜ甘味料をさらに加えるのか？大量にレモンを投入すれば飲めます。
90,B013OSZVC6,Lakshimi(ラクシュミー) 極上はちみつ紅茶 ティーバッグ25袋入り,Lakshimi,Amazon カスタマー,2020年5月22日,3.0,とにかく、おいしい！,お店で購入していたが売り切れだった為ネットで購入。お店にあるときは箱を開ける前から香りがしたけど今回のは全然香りがなく、飲んでみても前のと全然違って蜂蜜感がうすかった。前のが香りすぎるくらいだったからなんだか不思議。香りが飛んじゃったのかな。
91,B013OSZVC6,Lakshimi(ラクシュミー) 極上はちみつ紅茶 ティーバッグ25袋入り,Lakshimi,ひなごじん,2021年2月15日,5.0,甘すぎる,一度頂き飲んだら美味しすぎて購入しました。甘いの苦手な方には不評でした。ミルクティーにしても、さらに美味しさアップです。
92,B013OSZVC6,Lakshimi(ラクシュミー) 極上はちみつ紅茶 ティーバッグ25袋入り,Lakshimi,kooi,2020年5月3日,3.0,香りが薄くてちょっと残念…,香りがよかった。お礼の品物のひとつに加えた。
93,B013OSZVC6,Lakshimi(ラクシュミー) 極上はちみつ紅茶 ティーバッグ25袋入り,Lakshimi,あっこママ,2020年2月5日,4.0,はちみつの香り漂よう,値段がやっぱり高いので、気楽に飲めないのが残念。
94,B013OSZVC6,Lakshimi(ラクシュミー) 極上はちみつ紅茶 ティーバッグ25袋入り,Lakshimi,Amazon カスタマー,2021年5月24日,5.0,香る紅茶,地元では、なかなか購入出来ないので今回購入できて嬉しかった。とても美味しく友達もはまりました。
95,B013OSZVC6,Lakshimi(ラクシュミー) 極上はちみつ紅茶 ティーバッグ25袋入り,Lakshimi,J,2021年7月29日,5.0,うまい,開封した時の蜂蜜の香りと甘さがお気に入りです。砂糖なしでも蜂蜜の甘さがしっかりとあります。ホットもアイスもミルクティーにするのが大好きです。
96,B013OSZVC6,Lakshimi(ラクシュミー) 極上はちみつ紅茶 ティーバッグ25袋入り,Lakshimi,読書マニア1号,2021年4月29日,4.0,美味しいけど,知人に紹介され、入荷待ちして購入。少しお高めですが紅茶に蜂蜜が加わって、ほんのり甘いほんとに美味しい紅茶です！　リピしたいです！
97,B013OSZVC6,Lakshimi(ラクシュミー) 極上はちみつ紅茶 ティーバッグ25袋入り,Lakshimi,さぁちん🧸,2021年6月25日,2.0,美味しいです,思ったより甘かったです。甘いけどサッパリした甘さで、甘いのが苦手な人はオススメ出来ないです。
98,B013OSZVC6,Lakshimi(ラクシュミー) 極上はちみつ紅茶 ティーバッグ25袋入り,Lakshimi,rinko,2021年5月2日,5.0,美味しい！,話題になっていたが近場は売り切れで購入出来ずAmazonで購入。とーっても美味しかった！はちみつ入りだから砂糖は要らない甘さ！
99,B013OSZVC6,Lakshimi(ラクシュミー) 極上はちみつ紅茶 ティーバッグ25袋入り,Lakshimi,Tkm,2020年12月13日,3.0,思ったより甘い,極上っていう割には甘味料入ってます笑ハチミツのみの紅茶をお探しの方はやめたほうがいいかも！
100,B013OSZVC6,Lakshimi(ラクシュミー) 極上はちみつ紅茶 ティーバッグ25袋入り,Lakshimi,Amazon カスタマー,2021年2月27日,5.0,砂糖要らない,はちみつの香りと味かわ美味しかった。お砂糖なしでも、甘い。
101,B013OSZVC6,Lakshimi(ラクシュミー) 極上はちみつ紅茶 ティーバッグ25袋入り,Lakshimi,藤波 竜太,2021年4月19日,5.0,味,本当に美味しい。甘さが凄くいい！
102,B013OSZVC6,Lakshimi(ラクシュミー) 極上はちみつ紅茶 ティーバッグ25袋入り,Lakshimi,こゆり,2021年1月31日,4.0,はちみつ体験出来る紅茶,味に変わりはありませんが商品の箱が潰れた状態で着きました。Amazonを多数利用していますがこんな状態で到着したのは、初めてです。
103,B013OSZVC6,Lakshimi(ラクシュミー) 極上はちみつ紅茶 ティーバッグ25袋入り,Lakshimi,向山桃子,2021年5月10日,5.0,甘くて美味しい、飲みやすい。,とっても美味しい。はちみつの香りが最高でした。
104,B013OSZVC6,Lakshimi(ラクシュミー) 極上はちみつ紅茶 ティーバッグ25袋入り,Lakshimi,Miku,2020年8月31日,5.0,ハマりそうです,タイトル通り。飲むと幸せな気分になります。お湯の量で甘さを調節してください。
105,B013OSZVC6,Lakshimi(ラクシュミー) 極上はちみつ紅茶 ティーバッグ25袋入り,Lakshimi,はちみつ好き,2021年2月5日,5.0,甘い香りと味,はちみつの味がしっかりしており甘さもありそのまま飲めます。とても美味しいです！一度飲んだら必ずリピしたい味です
106,B013OSZVC6,Lakshimi(ラクシュミー) 極上はちみつ紅茶 ティーバッグ25袋入り,Lakshimi,mio,2021年2月21日,5.0,究極のご褒美紅茶,1番好きな紅茶です。味も香りも良く、我が家は大満足です。
107,B013OSZVC6,Lakshimi(ラクシュミー) 極上はちみつ紅茶 ティーバッグ25袋入り,Lakshimi,匿名希望,2021年3月4日,5.0,まさに極上です！,蜂蜜の風味がとても贅沢です。
108,B013OSZVC6,Lakshimi(ラクシュミー) 極上はちみつ紅茶 ティーバッグ25袋入り,Lakshimi,タイサク,2020年6月16日,5.0,大満足,めちゃくちゃ美味しい。冬とか喉にもいいし子供でも飲めるおいしさです。
109,B013OSZVC6,Lakshimi(ラクシュミー) 極上はちみつ紅茶 ティーバッグ25袋入り,Lakshimi,居原田,2020年4月19日,5.0,美味しい,友人から数個頂いて、凄く美味しかったので即購入しました！はちみつのしっかりした香りと味わい、ホッとする紅茶で大好きです
110,B013OSZVC6,Lakshimi(ラクシュミー) 極上はちみつ紅茶 ティーバッグ25袋入り,Lakshimi,Amazon カスタマー,2020年6月4日,4.0,早く出会いたかった,この一杯でホッとします 甘さが疲れを癒してくれます ただ甘みが濃厚なので 苦手な方もいらっしゃると思います 甘すぎる方はミルクやレモンを足したりと 調節するといいと思います ホットもアイスもOKですよ
111,B013OSZVC6,Lakshimi(ラクシュミー) 極上はちみつ紅茶 ティーバッグ25袋入り,Lakshimi,Amazon カスタマー,2021年3月15日,4.0,美味しい！,蜂蜜の香りがかなりあります。思ったより甘いですが、甘味の少ないスコーンなどと一緒に飲むと美味しいです。
112,B013OSZVC6,Lakshimi(ラクシュミー) 極上はちみつ紅茶 ティーバッグ25袋入り,Lakshimi,がっちゃん,2020年5月4日,2.0,ほっとできる味,想像していたよりはるかに甘かった。蜂蜜の甘さだけでいいのに、人工甘味料をいれる必要があるのか…
113,B013OSZVC6,Lakshimi(ラクシュミー) 極上はちみつ紅茶 ティーバッグ25袋入り,Lakshimi,Amazon カスタマー,2020年6月14日,5.0,少し高いかな?でも美味い！,お店で、どこにも探せず、冬は特に必需品として置いておきたいくらいです。
114,B013OSZVC6,Lakshimi(ラクシュミー) 極上はちみつ紅茶 ティーバッグ25袋入り,Lakshimi,えり,2020年11月14日,5.0,甘すぎ,甘くて最高においしい‼️贅沢な味です。
115,B013OSZVC6,Lakshimi(ラクシュミー) 極上はちみつ紅茶 ティーバッグ25袋入り,Lakshimi,Amazon カスタマー,2020年4月6日,4.0,美味しい,甘味を加えなくても結構甘い。大人にはやや甘すぎる気はするが、子供は大変喜んで飲んでいる。疲れている時などに、飲むと結構ほっとする。
116,B013OSZVC6,Lakshimi(ラクシュミー) 極上はちみつ紅茶 ティーバッグ25袋入り,Lakshimi,くまくま,2020年12月25日,5.0,最高においしい,はちみつの優しい味と匂いがあり、でも紅茶としての味、匂いもあり大変美味しかったです！これはリピートしたくなってしまう…！
117,B013OSZVC6,Lakshimi(ラクシュミー) 極上はちみつ紅茶 ティーバッグ25袋入り,Lakshimi,カレン,2020年2月8日,5.0,子どもが喜ぶ味,友達からいただき、気に入って購入。はちみつが美味しくて、仕事の休憩に飲むとホッとします。毎日飲んでます。
118,B013OSZVC6,Lakshimi(ラクシュミー) 極上はちみつ紅茶 ティーバッグ25袋入り,Lakshimi,Amazon カスタマー,2021年2月26日,4.0,大変美味です,想像以上に甘かったです。でも、そこもまた良い。また買いたい商品だけど、人気商品でいつも品切れ状態。なので、⭐4つです。
119,B013OSZVC6,Lakshimi(ラクシュミー) 極上はちみつ紅茶 ティーバッグ25袋入り,Lakshimi,カズカズ,2020年10月13日,5.0,美味しい,すごく美味しかったです…甘味料とかはよくわからないのですが、自分は好きな味でした。砂糖入れなくて、この蜂蜜の甘さ，味はわたしには百点です🙆‍♀️
120,B013OSZVC6,Lakshimi(ラクシュミー) 極上はちみつ紅茶 ティーバッグ25袋入り,Lakshimi,Amazon カスタマー,2021年3月24日,5.0,おいしいです？,味が良く贈り物で喜ばれる。
121,B013OSZVC6,Lakshimi(ラクシュミー) 極上はちみつ紅茶 ティーバッグ25袋入り,Lakshimi,Amazon カスタマー,2020年7月6日,5.0,あまーくて、大好きな紅茶です,高いけど旨い
122,B013OSZVC6,Lakshimi(ラクシュミー) 極上はちみつ紅茶 ティーバッグ25袋入り,Lakshimi,Amazon カスタマー,2021年1月11日,5.0,美味しい,濃厚なはちみちの香りと味がたまりません。冬はとってもあったまるのでご褒美やプレゼントにも最適！
123,B013OSZVC6,Lakshimi(ラクシュミー) 極上はちみつ紅茶 ティーバッグ25袋入り,Lakshimi,ぴえん,2021年3月25日,5.0,女性に喜ばれるプレゼント,おいしいです
124,B013OSZVC6,Lakshimi(ラクシュミー) 極上はちみつ紅茶 ティーバッグ25袋入り,Lakshimi,tama,2021年7月1日,5.0,おいしい！,飲んだ瞬間、はちみつの香りがいっきに広がってとてもおいしいです。癒やしの紅茶です。
125,B013OSZVC6,Lakshimi(ラクシュミー) 極上はちみつ紅茶 ティーバッグ25袋入り,Lakshimi,くー,2020年8月23日,5.0,いいです,在宅ワーク中のお供に購入しました。はちみつのいい香りとくどくない甘さがとても美味しかったです。ホットでいただきましたが、アイスでも美味しいと思います！
126,B013OSZVC6,Lakshimi(ラクシュミー) 極上はちみつ紅茶 ティーバッグ25袋入り,Lakshimi,長島明奈,2021年3月10日,5.0,癒やし紅茶,非常に美味しい既存の紅茶と一線を画す味満足度最高
127,B013OSZVC6,Lakshimi(ラクシュミー) 極上はちみつ紅茶 ティーバッグ25袋入り,Lakshimi,mum,2021年5月19日,5.0,おいしい！,砂糖の甘さじゃなくてはちみつなのが良いね
128,B013OSZVC6,Lakshimi(ラクシュミー) 極上はちみつ紅茶 ティーバッグ25袋入り,Lakshimi,浦谷　泰弘,2020年10月16日,4.0,はちみつうまい,かなり甘いです。しかし2倍以上に薄めるとちょうど良い甘さになります。疲れた時に飲むと癒されます。
129,B013OSZVC6,Lakshimi(ラクシュミー) 極上はちみつ紅茶 ティーバッグ25袋入り,Lakshimi,布施真由美,2021年2月10日,5.0,優しい甘さと香りを楽しめるお茶,驚くほど美味しくて、周りにお勧めして、周りの友人も皆、虜になりました！
130,B013OSZVC6,Lakshimi(ラクシュミー) 極上はちみつ紅茶 ティーバッグ25袋入り,Lakshimi,めいぞー,2020年11月24日,5.0,飲むと癒される,思ったよりはちみつ感がすごくて美味しかったです。リピートしたい商品ですね。
