,ASIN,product,brand,name,date,score,title,comment
0,B0142F7N7G,名糖 オレンジティー 500g,名糖産業,‪＼あまじょんかしゅたまー／,2017年1月2日,5.0,水で溶けるので入院用、避難グッズ用にも,コンビニでよく1リットルパック100円とかでフルーツ系のジュースを出しているあのメイトーの味です。500ml換算すると約8～９パック分相当になります。そう考えるとかなりお買い得ではないでしょうか。あと人工甘味料が使われていないので安心して飲めます。それに冷水でも一瞬で溶けて手軽にオレンジティーが作れてしまう点が良いです。
1,B0142F7N7G,名糖 オレンジティー 500g,名糖産業,りる,2020年5月16日,5.0,初めて購入,普通の店舗にはこのオレンジだけ見たことがなくAmazonで見て購入。レモンとアップルは飲み飽きてしまってしかもオレンジはこれらの2種より甘みが少ないですし香りが優しくて程よい甘さです！普通の店舗でもレモン、アップルのように売られていたらいいのに、、と思うようなおいしさ、手軽さです。わざわざティーパックから淹れる時間がない朝などいいです！ゴミも出ないしアイスもいけるからいいですね〜！
2,B0142F7N7G,名糖 オレンジティー 500g,名糖産業,ヨッシー,2018年12月28日,3.0,コンビニでおなじみのメイトーの味でお買い得,ちょっと薄味な蜜柑の皮のような味に感じます。おススメは同じ種類の１番手アップルティー、２.３番手レモンティー、レモネードかな。正直２番手、３番手は同じくらい。ホットが美味しい季節、冷たい水でもかき回しても溶け易い。美味しいお給料だワンニャン♪
3,B0142F7N7G,名糖 オレンジティー 500g,名糖産業,カスタード,2021年1月3日,3.0,このシリーズの中で一番好きです,このシリーズのレモンティーとアップルティーがおいしかったので、本商品も試してみたところ、オレンジの風味が好みではなかった。なっちゃんとかファンタオレンジの、あの人工っぽい「オレンジ風味」が好きではない人は好まない味だと思う。
4,B0142F7N7G,名糖 オレンジティー 500g,名糖産業,Amazon カスタマー,2020年8月23日,3.0,ちょっとミカンの皮のような薄味かなぁ。,メーカーは子供の頃からチョコレートなどで馴染みがあるのでその辺は安心。本商品、美味しいけど作りが子供さん向けかな。書いてあるとおり作ると、甘い。私には甘すぎる。ちょっと甘いものが欲しい時にいいんだけど、甘さを抑えてその分オレンジ風味の香りや味を強調するとかして大人向けを作って欲しいなあ。甘味料的な口に変な甘さがないところが好きなので、そこがより良くなれば、良いなと。
5,B0142F7N7G,名糖 オレンジティー 500g,名糖産業,kou,2019年7月6日,5.0,人工オレンジジュースの風味が苦手な人にはおすすめしない,このオレンジティー、美味しくてハマりました。甘酸っぱくて、レモンティーとはまた違う味で好きです。無くなったらまた購入したいです。
6,B0142F7N7G,名糖 オレンジティー 500g,名糖産業,フラウ,2016年1月30日,4.0,美味しいけどちょっと甘すぎかも。,生オレンジのフレッシュ感というより駄菓子の粉ジュース的なオレンジ感に近い印象です。オレンジ風味の粉末紅茶は見かけないのでオレンジ好きな人には良いんじゃないかと思います。やや甘めなのでお湯の量で調節するか、レモン果汁なんかを少し入れて好みの風味にすると良いと思います。
7,B0142F7N7G,名糖 オレンジティー 500g,名糖産業,saram,2021年3月8日,5.0,美味しい！,コーヒー・紅茶好きなのですが、この粉末紅茶というのもなかなかイケますよね。１杯分で結構な量をスプーンでよそりますが、量をけちると薄く感じます。適量入れてお湯を注ぐだけなので楽ちんです。こちらは他社にはラインナップされていないオレンジ風味で、香りと果汁感がしっかりあります。
8,B0142F7N7G,名糖 オレンジティー 500g,名糖産業,Namio,2018年11月12日,2.0,それぞれにそれぞれの美味しさが…,あ～昔の粉ジュースみたいだね。オレンジ味の粉ジュースだわ。こんな砂糖だらけの飲み物飲んで大丈夫かな？もうちょっと紅茶の風味が欲しいな。嫌じゃないけど、リピしたいものじゃなかった。
9,B0142F7N7G,名糖 オレンジティー 500g,名糖産業,Amazonのお客様,2021年2月7日,5.0,粉末ジュース,味は同社のアップルティーよりも飲み易い。アップルティーの方は適量で作るとほぼアップルジュースで飲んでも飲んでも喉が渇く。こちらは爽やかな甘さで適量でも喉が渇き辛い。
10,B0142F7N7G,名糖 オレンジティー 500g,名糖産業,wbeam,2020年5月6日,5.0,粉ジュース？,冷たい水でも溶けがいいので、手軽に飲めます。入れる量で味の濃さをその時の気分で変えられますし、オレンジの香りがちょっとした気分転換になります。健康のために飲んでいるクエン酸も、これがあると飲みやすく重宝しています。
11,B0142F7N7G,名糖 オレンジティー 500g,名糖産業,百足丸,2020年11月6日,4.0,飲み易い,在宅で仕事中などに飲んでます。甘くて香りもよくリラックスできます。くつろぎタイムですね♪その甘さが運動不足でもあり太らないか心配ではありますが・・・
12,B0142F7N7G,名糖 オレンジティー 500g,名糖産業,Amazon カスタマー,2021年2月21日,2.0,美味しいです。,名糖のものはいつも美味しいのに、これはアレと拍子抜け。買って半年以上経って半分以上残っているのですがもう飲むことはないと捨てました。
13,B0142F7N7G,名糖 オレンジティー 500g,名糖産業,カスタマー,2020年9月7日,1.0,リラックス出来ます,大量に入れないと薄いです…紅茶の味もしないような…(￣▽￣;)別メーカーのレモンやアップルが無難です…
14,B0142F7N7G,名糖 オレンジティー 500g,名糖産業,和歌,2020年1月12日,5.0,正直味がほとんどないです。,頂き物なんかの渋めの赤ワインにこのオレンジティー入れてお湯で割ったら、ホットサングリアの出来上がり。真冬の飲み物にどうぞー。
15,B0142F7N7G,名糖 オレンジティー 500g,名糖産業,himi,2021年1月2日,5.0,紅茶の味は…(￣▽￣;),私はとても美味しく感じました。ガブガブ飲むのでカロリーは気になりますが、とても美味しい。ホットでもアイスでも心和むひとときを得られることでしょう
16,B0142F7N7G,名糖 オレンジティー 500g,名糖産業,Amazon Customer,2020年9月14日,5.0,店頭ではあまり見かけないので,レモンティーと一緒に試しに買ってみました。すっごく美味しかったです！香りも良い◎今度また購入します♪
17,B0142F7N7G,名糖 オレンジティー 500g,名糖産業,ケイト,2021年4月16日,4.0,サッパリした甘さ,甘党ですが、駄菓子のような甘さが目立つもので飲みきるのが大変そうです。が、普通の紅茶に砂糖として使えばバランスがとれていいのかも。と思ってます。(追記：アイスで飲むと甘いですが、ホットで飲むと紅茶感も感じられて美味しかったです！)
18,B0142F7N7G,名糖 オレンジティー 500g,名糖産業,かなえ,2021年2月10日,4.0,レモンティー好きならコレも好きなはず,紅茶というより紅茶風味ジュースって感じです。美味しいのですぐなくなりそうｗ
19,B0142F7N7G,名糖 オレンジティー 500g,名糖産業,るるる,2016年1月19日,5.0,アイスだと甘過ぎ、ホットだと美味しい。,レモンティーやアップルティーは飲んだことあっても、オレンジティーは売っているのさえも見たことがなく、気になったので購入。ほのかなオレンジのフレーバーがおいしかったです。
20,B0142F7N7G,名糖 オレンジティー 500g,名糖産業,まーさ,2017年4月23日,4.0,オレンジ風味紅茶(甘め),同社のアップルティーやレモンティーは甘すぎて私は苦手ですが、こちらは、もう少し甘さをおさえてくれたら？とは思うものの、オレンジ皮の苦みが微妙に交差してけっこうGOODでした☆ 手元においておくと重宝する商品かと思います。
21,B0142F7N7G,名糖 オレンジティー 500g,名糖産業,しらたま子,2019年12月2日,1.0,(^-^),私には、無理でした。
22,B0142F7N7G,名糖 オレンジティー 500g,名糖産業,Fundboy,2021年5月3日,5.0,いがいにいけます☆,湯でも、水でもさっと溶けるし、味も懐かしい感じピーチとレモンのテイストもあるんで、いい感じ
23,B0142F7N7G,名糖 オレンジティー 500g,名糖産業,ひまわり,2020年11月13日,5.0,❓,3時のティータイム用に買いました。オレンジのいい香りです。とても気に入りました。
24,B0142F7N7G,名糖 オレンジティー 500g,名糖産業,Amazon カスタマー,2018年2月26日,4.0,甘過ぎずない,甘いけど甘過ぎず、ホッとする味わいですよ。冬の朝なんかは、特に温まる品物です。
25,B0142F7N7G,名糖 オレンジティー 500g,名糖産業,蜜柑,2018年8月30日,5.0,オレンジ飴を溶かした濃さで、ホットがおすすめです。,一応紅茶ではあるがオレンジ味のような感じがする甘い飲み物です、個人的には美味しかったですカロリーが高めなので使用には注意しましょう…
26,B0142F7N7G,名糖 オレンジティー 500g,名糖産業,Ye_ENTRANCEMPERIUM,2017年11月21日,4.0,甘いけど甘過ぎず,オレンジティーなんて珍しい！と思い初めて購入しました。適度なオレンジの香りがして美味しいのですが、半分ほど使ったくらいで段々と飽きてしまいました…笑。やはり馴染みのあるアップルやミルクティーが無難かなぁ。
27,B0142F7N7G,名糖 オレンジティー 500g,名糖産業,328,2021年4月4日,3.0,オレンジ風味の紅茶のようなもの,オレンジの味わいがしっかりある美味しい紅茶です。
28,B0142F7N7G,名糖 オレンジティー 500g,名糖産業,Amazon カスタマー,2020年3月8日,5.0,珍しいですが、,美味しいです。レモネードはスーパーに置いてありますが、これは色々探しても置いてないのですが何故でしょうね？良いもの見つけました。
29,B0142F7N7G,名糖 オレンジティー 500g,名糖産業,yuyuyuyu,2020年7月15日,5.0,アイスティーも直ぐに溶けてつくれます,Amazonで知って買いました他の方々の言うとうり茶葉で入れる物とは違いますけど自分にはこっちのほうがあってますなんせ冷たくも暖かくも簡単に出来ますからね
30,B0142F7N7G,名糖 オレンジティー 500g,名糖産業,Amazon カスタマー,2020年11月15日,4.0,美味しい,紅茶の風味は少し薄いかな、と。紅茶入れるフレーバーシュガー代わりに使っています。
31,B0142F7N7G,名糖 オレンジティー 500g,名糖産業,ふせん,2019年7月7日,5.0,自分にあってる,ホームベーカリーで、オレンジティー味にしています。アップル、ピーチ、レモン、抹茶ミルク、ココア、と、色々試しています。
32,B0142F7N7G,名糖 オレンジティー 500g,名糖産業,Amazon カスタマー,2020年5月28日,5.0,アップル、レモンにも全然負けてない‼︎,很喜歡!!價格合理。氣味芬芳~感恩~~
33,B0142F7N7G,名糖 オレンジティー 500g,名糖産業,ｽｰﾊﾟｰけろた,2018年11月9日,3.0,あんまり,レモンティーの方が美味しい。オレンジの風味はレモンティーと比べると薄いです。味がぼやけてる。
34,B0142F7N7G,名糖 オレンジティー 500g,名糖産業,瞄瞄,2018年5月30日,3.0,柳橙茶,レモン、ミルクティーなどは見たことありましたが、オレンジティーは見たことなくすぐ購入しました。まあまあでした。
35,B0142F7N7G,名糖 オレンジティー 500g,名糖産業,まるさんかく,2018年9月17日,5.0,レモンより風味がうすい,レモンやミルクティーはよく見かけますが、オレンジティーは初めて！美味しいです。仕事の休憩で癒されてます
36,B0142F7N7G,名糖 オレンジティー 500g,名糖産業,くまちゃんママ,2019年12月29日,5.0,オレンジティーはじめてみました～。,オレンジの味がします
37,B0142F7N7G,名糖 オレンジティー 500g,名糖産業,しましま,2018年7月26日,5.0,オレンジ,昔、小さい頃の駄菓子屋さんに有った、オレンジ味の粉末のお菓子の味に、良くにていましたが、だんだんとなれて、美味しく、飲まして頂いてます。
38,B0142F7N7G,名糖 オレンジティー 500g,名糖産業,本物レビュアー,2019年2月23日,5.0,美味しい,いろいろな紅茶飲みましたが、もう少しオレンジが強いと良いと思いましたが、子供も飲める優しい味でした
39,B0142F7N7G,名糖 オレンジティー 500g,名糖産業,森田悦子,2019年2月24日,4.0,懐かしい味❗️,とても美味しいのですが、もう少しオレンジの酸味があるともっと良い。標準使用量よりも多めに入れてます。
40,B0142F7N7G,名糖 オレンジティー 500g,名糖産業,komo,2017年10月11日,5.0,名糖 オレンジティー,冷水でもOKなので、夏は大助かりでした。これからの季節は、HOTでいただきます。オレンジの香りと甘さが、ちょうど良くて、本当に美味しいです。
41,B0142F7N7G,名糖 オレンジティー 500g,名糖産業,Samarqand,2020年12月13日,4.0,香りが好み,初めて飲んでみたけど、レモンティーやアップルチィーより美味しいかも。
42,B0142F7N7G,名糖 オレンジティー 500g,名糖産業,Amazon カスタマー,2019年9月8日,5.0,美味しいです,去年の冬は近くのお店に売ってたが今年から入荷しないとのことなのでAmazonで購入！毎日マイボトルに入れて仕事や出かけるのでよい！味も美味しい！
43,B0142F7N7G,名糖 オレンジティー 500g,名糖産業,江原正平,2016年9月5日,5.0,初めて飲んでみた,珍しいオレンジ味のインスタント紅茶ということに惹かれて購入してみました。人工甘味料が使用されていないところも魅力です。同じ名糖さんでも、スティックタイプのものには人工甘味料が使用されているようで、残念です。身体への影響はわかりませんが、人工甘味料の後味が好きではありません。お店で見かけないお品ですので、また注文したいと思います。
44,B0142F7N7G,名糖 オレンジティー 500g,名糖産業,miyuki,2016年9月16日,3.0,美味しい😋,レモンティーが良いですね。面白半分で購入したので、まずまずではありました。
45,B0142F7N7G,名糖 オレンジティー 500g,名糖産業,koyuki_o,2021年1月7日,5.0,人工甘味料無添加,オレンジの香りがよく、甘さは控えめで、粉の方も溶けやすい
46,B0142F7N7G,名糖 オレンジティー 500g,名糖産業,買った人,2019年1月17日,5.0,これなら,スーパーで売ってないお味だったので試しに購入。紅茶好きな子供達の今1番のお気に入りです。
47,B0142F7N7G,名糖 オレンジティー 500g,名糖産業,5次元世界,2017年10月9日,4.0,美味しいです,苦味なく、すっきりとした、甘い紅茶。オレンジっぽい香りは、粉末時につよい。
48,B0142F7N7G,名糖 オレンジティー 500g,名糖産業,大内　弘樹,2017年1月31日,5.0,お値段重視,とても美味しいです。大好きなので、大きい缶のタイプもあれば嬉しいです。
49,B0142F7N7G,名糖 オレンジティー 500g,名糖産業,ko,2018年1月20日,5.0,美味しい,ってのもあって、3回目とかのポチりですアップルティーもレモンティーもレモネードも袋のは、探せばスーパーで買えちゃうんで、ついでポチり程度てか、スーパーの方がちょっぴり安かったりするしなんとかティーだと思って飲むと「ありゃりゃ？」って感じのジュースですなホットでしか飲んでませんが、Amazonカップ（結構デカイ）で3杯くらい連チャンで飲めちゃうジュース感覚なのも好きですアップルよりもオレンジの方が好みなだけで、人それぞれでしょうアップルのレモネードも切らしてませんが...今んとこオレンジがマイブームっす('Д` )
50,B0142F7N7G,名糖 オレンジティー 500g,名糖産業,Amazon カスタマー,2015年11月21日,5.0,美味しい,オレンジの香りが良くて、甘くて美味しかった👍😄オレンジティーはお店になかなか見かけないので気になって2袋購入しました。オレンジティーに癒されます🌟
51,B0142F7N7G,名糖 オレンジティー 500g,名糖産業,cow-g,2017年9月1日,3.0,これだけスーパーで売ってないし,コップ1杯(200ml)に粉末をスプーン5杯分も使う。味はまずまず。炭酸水に入れるとシュワシュワシュワと泡が発生するのが面白い。
52,B0142F7N7G,名糖 オレンジティー 500g,名糖産業,Amazon カスタマー,2016年7月4日,4.0,美味しい❗,ちょっと甘めに作るととても美味しく、会社の休憩時間に飲むのにぴったりです。
53,B0142F7N7G,名糖 オレンジティー 500g,名糖産業,カルラ,2017年5月10日,3.0,粉末を大量に使う。,香りはとても良いですがちょっと甘いです。無糖のものがあったら嬉しいのですが。
54,B0142F7N7G,名糖 オレンジティー 500g,名糖産業,nicoco,2015年12月30日,5.0,美味しい(^-^),good　itemgood　itemgood　itemgood　itemgood　item
55,B0142F7N7G,名糖 オレンジティー 500g,名糖産業,mwn,2020年11月23日,1.0,ちょっと甘い,ま、飲めばわかりますが「オレンジ風の・・・紅茶風の只ただ甘～い飲み物」。一度飲んだだけで嫌になってしまいました。オレンジの風味は殆どしない、紅茶の香りもないに等しい。こういう商品にオレンジティーなどという商品名をよくつけられたものです。
56,B0142F7N7G,名糖 オレンジティー 500g,名糖産業,公開名,2020年1月9日,4.0,オレンジの香りがリアル,オレンジティー初めて飲みましたが私は美味しかったです。
57,B0142F7N7G,名糖 オレンジティー 500g,名糖産業,おやつはパン,2018年12月30日,3.0,オレンジティー・オレがおすすめ,家族の中でも甘さが強いため好き嫌いが分かれました。味より香りを楽しむつもりなら、星３つで良いかと。
58,B0142F7N7G,名糖 オレンジティー 500g,名糖産業,Amazon カスタマー,2015年9月16日,5.0,オレンジティー,オレンジが大好きなワタシ。見つけた瞬間買いました。紅茶としてはもちろん、お菓子(パウンドケーキとか？)に使っても良いかもです(*^.^*)しっかりオレンジの味と香りもあります☆ミおすすめです❗
59,B0142F7N7G,名糖 オレンジティー 500g,名糖産業,Amazonカスタマー,2018年12月6日,3.0,香りが良い,冬の飲み物、お得そうなものをまとめ買いしました。これから飲み比べてみます。とりあえず★４つ。飲み比べしてみました。オレンジティー、アップルティー、レモンティーの比較です。マグカップに300cc+スプーン4杯位で作っています。ちょい濃い目です。【オレンジティー】香り：強め、味：強め。オレンジの風味が強くメリハリがある。無理足し感が強い。…いつもの紅茶が物足りない人向け。★４。【アップルティー】香り：弱め、味：弱め。紅茶にアップルシロップをちょい足しした感じ。強い変化を求める人には物足りない。…無理足し感を好まない人向け。★３。【レモンティー　】香り：安定、味：安定。安定したレモンの風味です。落ち着きたい時にはこれです。…レモンが嫌いでない人には万人受けです。★５。この中でのお勧めは安定感のあるレモンティーですが、この３つだけ飲んでいると普通の紅茶が物足りなく感じそうなので、普通の紅茶とこの３つを併せて４種類をその時の気分で飲み替えるのが良いですね。私は普通の紅茶ばかり飲んでいたので変化の強いオレンジティーが好きです。オレンジティーは無理足し感が強いので好き嫌いは分かれると思います。名糖 オレンジティー 500g名糖 アップルティー 500g名糖 レモンティー 500g追記です。牛乳屋さんシリーズも購入したのでそちらも含めた自分勝手に順位①牛乳屋さんのキャラメルミルクティー。★５②名糖 レモンティー。★５③名糖 アップルティー。★４④名糖 オレンジティー。★３⑤牛乳屋さんのほうじ茶ミルクティー。★２名糖ティーシリーズのみと、順位や★も変わっていますが、自分好みのモノが加わるとこんな感じです。濃い目の味が好きですが「牛乳屋さんのキャラメルミルクティー」があれば、無理足し感の強い「名糖 オレンジティー」は要らないかな。次は安心して飲めるレモン・アップル。オレンジは上位落ちです。「牛乳屋さんのほうじ茶ミルクティー」は好みの問題で最下位です。ほうじ茶ラテは自分的にはなしですがコンビニのモノよりはほうじ茶感は弱く飲みやすいです。【キャラメルミルクティー】香り：強め、味：強め。キャラメル味は美味しいですね。【ほうじ茶ミルクティー　】香り：弱め、味：弱め。「ウニに醤油でプリン」的なノリで無駄な組み合わせなのでズバリ嫌いです。牛乳屋さんのキャラメルミルクティー 240g牛乳屋さんのほうじ茶ミルクティー 200g好き嫌いはありますがその時の気分ですぐに飲めるようにダイソー100均カゴにまとめて台所に置いて楽しんでいます。
60,B0142F7N7G,名糖 オレンジティー 500g,名糖産業,さち,2020年5月12日,3.0,待ってました‼,香りはオレンジティーのいい香りがします。お味が少し薄くて、もう少しオレンジ独特の甘みが欲しいところ。でもまぁまぁおいしいので、可もなく不可もなくといった感じ。
61,B0142F7N7G,名糖 オレンジティー 500g,名糖産業,アマドン,2020年6月26日,5.0,冬の飲み物をまとめ買いで飲み比べ。,良かったです
62,B0142F7N7G,名糖 オレンジティー 500g,名糖産業,NANA,2021年1月22日,5.0,もう少し甘みが欲しい,甘くて美味しい
63,B0142F7N7G,名糖 オレンジティー 500g,名糖産業,Amazon カスタマー,2019年2月3日,4.0,良かったです,ティーバッグからオレンジティーを作るのは面倒ですがこれは、お湯を注ぐだけ、簡単で美味しいです。
