,ASIN,product,brand,name,date,score,title,comment
0,B01E4VWE2M,● カモミール ● ハーブティー ● ティーバッグ ● 夜の寝る前に、リラックスできる香り ● ノンカフェイン・無香料・無着色 ● 原料＝,紅茶専門店 京都セレクトショップ,Milkzero,2018年11月28日,5.0,睡眠の質が良かったかも,最近、夜中にぱっちりと目が覚め明け方まで眠れなくなりました、テレビのcmを見てサプリを試しましたが効き目なし。それが、夜、ゆっくりとカモミールティーを飲みますとぐっすり眠れるようになりました。旅先にも持っていきました。私にはすごくあっていてうれしいです。当然ﾘﾋﾟしました。
1,B01E4VWE2M,● カモミール ● ハーブティー ● ティーバッグ ● 夜の寝る前に、リラックスできる香り ● ノンカフェイン・無香料・無着色 ● 原料＝,紅茶専門店 京都セレクトショップ,エリック・カール,2020年4月29日,5.0,新鮮❗,ストレスから入眠しにくいことに悩んでいて、薬に頼る前にまず試してみようと購入しました。過去に凄く青臭いカモミールティーを飲んでから苦手意識があったのですが、このカモミールティーは青臭くないし癖のないさっぱり(あっさり？)とした味でとても飲みやすく感じました。
2,B01E4VWE2M,● カモミール ● ハーブティー ● ティーバッグ ● 夜の寝る前に、リラックスできる香り ● ノンカフェイン・無香料・無着色 ● 原料＝,紅茶専門店 京都セレクトショップ,くろ　まめこ,2018年2月2日,5.0,安眠できました,美味しいカモミ―ルティーです。私は、お風呂上がりのスキンケアの後にゆっくり飲むのが好きです。薄いのや、味がもうひとつのも有りますが、このお店の物はきちんと作られていて今のところ一番のお気に入りです。
3,B01E4VWE2M,● カモミール ● ハーブティー ● ティーバッグ ● 夜の寝る前に、リラックスできる香り ● ノンカフェイン・無香料・無着色 ● 原料＝,紅茶専門店 京都セレクトショップ,モリーユ茸,2019年12月6日,5.0,癖のない美味しいハーブティー,夕食後のリラックスタイムに飲むと、よく眠れるように思います。もう少し価格が安いと尚良いです。
4,B01E4VWE2M,● カモミール ● ハーブティー ● ティーバッグ ● 夜の寝る前に、リラックスできる香り ● ノンカフェイン・無香料・無着色 ● 原料＝,紅茶専門店 京都セレクトショップ,たえ,2020年11月22日,2.0,とても美味しいです。,夜がすっきり寝れていない感じがして色々検索した結果、カモミールティいいよ、知りお試しで購入した結果。元々ハーブティーは未経験で口コミで花のような香りがする、と書いていたので「いけるんじゃなかろうか」と買ってみました。けど、想像とは全く違う香りで封を開けた時になんとも言えない草の匂い。いやいや、お湯に蒸らしたらおいしいんだろう考え直し試し飲みしたら匂いは苦手で味も口の中に草の香りが広がるだけ...。本来の味がどんなものかを知らないのでこれが正解なのか不正解なのかもわかりません。ミルクティにするといいとも書いていましたが、私には残念なことに合わなかったみたいです😱こちらのカモミールティに限らず、匂いが苦手な人とかは控えた方がいいんじゃないかな。いい製品なだけに星少なくて申し訳ないですm(_ _)mまるっきり主観の感想でした
5,B01E4VWE2M,● カモミール ● ハーブティー ● ティーバッグ ● 夜の寝る前に、リラックスできる香り ● ノンカフェイン・無香料・無着色 ● 原料＝,紅茶専門店 京都セレクトショップ,ぷりんのママ,2018年11月17日,5.0,ノンカフェインなので、夜にも安心して飲めます,寝つきが極端に悪く、又最近は17歳の犬が認知症❓になり不眠症で困っていました。睡眠薬等1ヶ月に2〜3回使用する事もありましたが、これを飲むと自然と寝れて快適です。薬はやはり抵抗があるので早く知ってると良かったのにと思っています。
6,B01E4VWE2M,● カモミール ● ハーブティー ● ティーバッグ ● 夜の寝る前に、リラックスできる香り ● ノンカフェイン・無香料・無着色 ● 原料＝,紅茶専門店 京都セレクトショップ,miyo,2020年3月3日,4.0,苦手だけど挑戦した結果...,最近は余程眠気が強くならないと熟睡できなくなってきた為、就寝前のひと時ゆっくりお茶の時間を楽しむという事も含めて、初めてカモミールを購入してみました。気が向いた時だけ飲んでいるので、正直安眠効果があるのかどうかまではわかりませんが、紅茶の茶葉と違い、濃い味・香りではなく優しくほのかな風味なので、その点は夜就寝前に、という意味がわかるなぁと思いました。私はお茶は香りを楽しみたい人なので、このカモミールもゆっくり抽出して飲んでいます。
7,B01E4VWE2M,● カモミール ● ハーブティー ● ティーバッグ ● 夜の寝る前に、リラックスできる香り ● ノンカフェイン・無香料・無着色 ● 原料＝,紅茶専門店 京都セレクトショップ,lalareo,2020年3月24日,4.0,不眠症改善,最近カフェイン抜きにしているので頼みました。ちょっとクセがあるのですがこんなものかと思って飲んでいます。赤い方が発酵させていて値段が安いと知ったので今度は赤い方を頼んでみようと思います。就寝前に飲むと安眠と書いてあったのでしばらく様子をみます。
8,B01E4VWE2M,● カモミール ● ハーブティー ● ティーバッグ ● 夜の寝る前に、リラックスできる香り ● ノンカフェイン・無香料・無着色 ● 原料＝,紅茶専門店 京都セレクトショップ,Amazon カスタマー,2018年11月5日,5.0,美味しい！安眠効果！,美味しいけどティーパックの紐が短い。
9,B01E4VWE2M,● カモミール ● ハーブティー ● ティーバッグ ● 夜の寝る前に、リラックスできる香り ● ノンカフェイン・無香料・無着色 ● 原料＝,紅茶専門店 京都セレクトショップ,Amazon カスタマー,2020年11月8日,5.0,美味しい,喉風邪が長引いたので喉に優しい飲み物を探してみることに。いくつか試してこれが自分に合っているなと感じた。ティーバック時は香りが強いなと思っていたものの、飲むときには丁度いい香りになっている。味にクセもない。安眠効果もあるからか飲むと眠りやすくなる印象。今後、定期的に購入したい。
10,B01E4VWE2M,● カモミール ● ハーブティー ● ティーバッグ ● 夜の寝る前に、リラックスできる香り ● ノンカフェイン・無香料・無着色 ● 原料＝,紅茶専門店 京都セレクトショップ,nao,2019年12月30日,5.0,飲みやすい,夜寝る前に飲んでいます。香りが良く、寝付きが良いように感じます。配送もとても迅速でした。
11,B01E4VWE2M,● カモミール ● ハーブティー ● ティーバッグ ● 夜の寝る前に、リラックスできる香り ● ノンカフェイン・無香料・無着色 ● 原料＝,紅茶専門店 京都セレクトショップ,うさぎニンジン,2018年4月13日,5.0,喉風邪予防に,カモミールティーの中でクセがなく飲みやすいですリピ買いさせてもらっています
12,B01E4VWE2M,● カモミール ● ハーブティー ● ティーバッグ ● 夜の寝る前に、リラックスできる香り ● ノンカフェイン・無香料・無着色 ● 原料＝,紅茶専門店 京都セレクトショップ,NAMI,2016年10月29日,5.0,おすすめです！,はじめて購入しました。味は美味しいです。マグカップに直接入れ、お湯いれて、色がでなくなるまで、何杯か飲んでます❗
13,B01E4VWE2M,● カモミール ● ハーブティー ● ティーバッグ ● 夜の寝る前に、リラックスできる香り ● ノンカフェイン・無香料・無着色 ● 原料＝,紅茶専門店 京都セレクトショップ,coral,2020年3月5日,5.0,飲みやすい,まさにカモミール！　という濃厚さです。他いろいろ混ぜずカモミールだけをしっかり摂りたいなら最高です。
14,B01E4VWE2M,● カモミール ● ハーブティー ● ティーバッグ ● 夜の寝る前に、リラックスできる香り ● ノンカフェイン・無香料・無着色 ● 原料＝,紅茶専門店 京都セレクトショップ,みるくここあ,2021年6月6日,5.0,美味しいです❗,夕食後と寝る前に飲んでいます。500mlのお湯に一つ入れて2日分にして飲んでいます。しっかり香りも味もあってクセがなく美味しいです。自律神経が整う気がしてゆっくり眠れます。
15,B01E4VWE2M,● カモミール ● ハーブティー ● ティーバッグ ● 夜の寝る前に、リラックスできる香り ● ノンカフェイン・無香料・無着色 ● 原料＝,紅茶専門店 京都セレクトショップ,Ellie,2020年12月12日,1.0,シンプルで濃厚！,寝つきが悪いので試して見ましたが、飲んでしばらくしてから少し眠気を感じますが長く続かずすぐに目がさめます。その後は普段より目が冴えて朝までまったく眠れませんでした。寝付けないし不味いので捨てました。
16,B01E4VWE2M,● カモミール ● ハーブティー ● ティーバッグ ● 夜の寝る前に、リラックスできる香り ● ノンカフェイン・無香料・無着色 ● 原料＝,紅茶専門店 京都セレクトショップ,Amazon カスタマー,2019年12月29日,4.0,想像してたより飲みやすい！,けっこう色々試してみましたが、1番美味しかったです。優しい深みのある味で飲むと精神的に落ち着くので寝る前にお勧めです。
17,B01E4VWE2M,● カモミール ● ハーブティー ● ティーバッグ ● 夜の寝る前に、リラックスできる香り ● ノンカフェイン・無香料・無着色 ● 原料＝,紅茶専門店 京都セレクトショップ,mari,2021年4月11日,4.0,ノンカフェインなので安心,カモミールの匂いが好きです年齢的によく寝れるようにはなりませんでしたが…ストレス緩和にはいいと思います
18,B01E4VWE2M,● カモミール ● ハーブティー ● ティーバッグ ● 夜の寝る前に、リラックスできる香り ● ノンカフェイン・無香料・無着色 ● 原料＝,紅茶専門店 京都セレクトショップ,Amazon カスタマー,2020年6月26日,4.0,美味しい,カモミールティーの他の商品を飲んだことがないのでわからないが、味や香りはちゃんとする。ノンカフェインと書かれている通り、寝る前に飲んでも眠くならないということはない。寝る少し前に飲むようにしてから、夜中に目を覚ますことが減った気がする
19,B01E4VWE2M,● カモミール ● ハーブティー ● ティーバッグ ● 夜の寝る前に、リラックスできる香り ● ノンカフェイン・無香料・無着色 ● 原料＝,紅茶専門店 京都セレクトショップ,和田久美子,2019年5月3日,3.0,匂いがいいです,いつものより、湯の中での出が遅く、香りも良くない、又色も薄くしか出ない‼️。こんなのん購入しし始めて以来はじめてです。
20,B01E4VWE2M,● カモミール ● ハーブティー ● ティーバッグ ● 夜の寝る前に、リラックスできる香り ● ノンカフェイン・無香料・無着色 ● 原料＝,紅茶専門店 京都セレクトショップ,Shou.N,2020年3月20日,5.0,良く眠れる,煮だしてゼリーにして、ワンコな食事しました。精神安定になったのかよく寝るようになりました。
21,B01E4VWE2M,● カモミール ● ハーブティー ● ティーバッグ ● 夜の寝る前に、リラックスできる香り ● ノンカフェイン・無香料・無着色 ● 原料＝,紅茶専門店 京都セレクトショップ,キモサベ,2020年8月22日,5.0,香りが変わった。,カモミールの効用は、知ってまさしたが、こちらのお茶は眠る前にいただくと本当にリラックスできます。娘は、飲みながらあくびが出るほど。リピーターになりました。
22,B01E4VWE2M,● カモミール ● ハーブティー ● ティーバッグ ● 夜の寝る前に、リラックスできる香り ● ノンカフェイン・無香料・無着色 ● 原料＝,紅茶専門店 京都セレクトショップ,もものばあ,2019年12月19日,4.0,薫り,大変美味しかった！
23,B01E4VWE2M,● カモミール ● ハーブティー ● ティーバッグ ● 夜の寝る前に、リラックスできる香り ● ノンカフェイン・無香料・無着色 ● 原料＝,紅茶専門店 京都セレクトショップ,☆うるる☆,2020年4月27日,5.0,眠る前にリラックス、よく眠れます,娘に購入したのですが香りも良く味も美味しいとの事でした。無くなったらまた買います。
24,B01E4VWE2M,● カモミール ● ハーブティー ● ティーバッグ ● 夜の寝る前に、リラックスできる香り ● ノンカフェイン・無香料・無着色 ● 原料＝,紅茶専門店 京都セレクトショップ,平井由美子,2020年8月11日,4.0,買って良かったです。,以前も同じカモミールを購入しました。値段は少し高いが色も良く出てあまり癖もなく私にとっては良い味です。ノンカフェイン・無香料・無着色なので気に入っています。無くなったらまた購入したいです。
25,B01E4VWE2M,● カモミール ● ハーブティー ● ティーバッグ ● 夜の寝る前に、リラックスできる香り ● ノンカフェイン・無香料・無着色 ● 原料＝,紅茶専門店 京都セレクトショップ,よぴ,2020年3月14日,5.0,美味しい！,いい香りでリラックスタイムを過ごせてます。
26,B01E4VWE2M,● カモミール ● ハーブティー ● ティーバッグ ● 夜の寝る前に、リラックスできる香り ● ノンカフェイン・無香料・無着色 ● 原料＝,紅茶専門店 京都セレクトショップ,わん大好き,2020年1月21日,5.0,眠れない時に,お茶を入れた時の色も味もとても良かったです香りも良く美味しかった
27,B01E4VWE2M,● カモミール ● ハーブティー ● ティーバッグ ● 夜の寝る前に、リラックスできる香り ● ノンカフェイン・無香料・無着色 ● 原料＝,紅茶専門店 京都セレクトショップ,町田英利佳,2021年1月26日,5.0,リラックスできる。,とっても綺麗な色も出て、濃くて美味しいです。
28,B01E4VWE2M,● カモミール ● ハーブティー ● ティーバッグ ● 夜の寝る前に、リラックスできる香り ● ノンカフェイン・無香料・無着色 ● 原料＝,紅茶専門店 京都セレクトショップ,Amazon カスタマー,2020年11月5日,5.0,又注文します,とても美味しく、良質な感じがしました。毎晩寝る前に飲んでいます。リピーターになると思います。娘にもあげたら大喜びでした。
29,B01E4VWE2M,● カモミール ● ハーブティー ● ティーバッグ ● 夜の寝る前に、リラックスできる香り ● ノンカフェイン・無香料・無着色 ● 原料＝,紅茶専門店 京都セレクトショップ,チロルチョコ,2020年5月2日,3.0,香りも味も良くて、飲みやすいです。,やさしいお味でした。私は香りが好きなので物足りなさを感じました。普段からマイルドなお茶が好みの方はいいと思います。
30,B01E4VWE2M,● カモミール ● ハーブティー ● ティーバッグ ● 夜の寝る前に、リラックスできる香り ● ノンカフェイン・無香料・無着色 ● 原料＝,紅茶専門店 京都セレクトショップ,Amazon カスタマー,2021年2月4日,5.0,良質で美味しい。また買います。,上品な味のするお品でした。また購入させていただきます。
31,B01E4VWE2M,● カモミール ● ハーブティー ● ティーバッグ ● 夜の寝る前に、リラックスできる香り ● ノンカフェイン・無香料・無着色 ● 原料＝,紅茶専門店 京都セレクトショップ,Amazon カスタマー,2020年7月26日,5.0,香りが欲しい,寝る前のカモミールティーはよく寝られます
32,B01E4VWE2M,● カモミール ● ハーブティー ● ティーバッグ ● 夜の寝る前に、リラックスできる香り ● ノンカフェイン・無香料・無着色 ● 原料＝,紅茶専門店 京都セレクトショップ,いっさたろう,2020年5月24日,4.0,ちょっと値段が高めかな,しっかり美味しいですよ。
33,B01E4VWE2M,● カモミール ● ハーブティー ● ティーバッグ ● 夜の寝る前に、リラックスできる香り ● ノンカフェイン・無香料・無着色 ● 原料＝,紅茶専門店 京都セレクトショップ,ぽこぺん,2020年1月13日,3.0,色々試飲中,いちいちパック詰めをしなくて便利だと思います。どこかのコヒー店でも同じ様なカモミールティーパックを。
34,B01E4VWE2M,● カモミール ● ハーブティー ● ティーバッグ ● 夜の寝る前に、リラックスできる香り ● ノンカフェイン・無香料・無着色 ● 原料＝,紅茶専門店 京都セレクトショップ,よんよん,2020年3月18日,5.0,美味しいですよ,就寝前に飲んだら穏やかな気持ちで寝ることができました。
35,B01E4VWE2M,● カモミール ● ハーブティー ● ティーバッグ ● 夜の寝る前に、リラックスできる香り ● ノンカフェイン・無香料・無着色 ● 原料＝,紅茶専門店 京都セレクトショップ,かつらの,2021年5月29日,4.0,感想,香りも良く味も良かったです。
36,B01E4VWE2M,● カモミール ● ハーブティー ● ティーバッグ ● 夜の寝る前に、リラックスできる香り ● ノンカフェイン・無香料・無着色 ● 原料＝,紅茶専門店 京都セレクトショップ,Amazon カスタマー,2020年5月16日,5.0,就寝前の一杯,ほっこり落ち着く味でした。
37,B01E4VWE2M,● カモミール ● ハーブティー ● ティーバッグ ● 夜の寝る前に、リラックスできる香り ● ノンカフェイン・無香料・無着色 ● 原料＝,紅茶専門店 京都セレクトショップ,Amazon カスタマー,2020年2月20日,1.0,香りで癒される,夜、何度も起きてしまうので期待を込めて購入しましたが、、アレルギーなのか喉がむず痒くなり耳の奥に違和感が、、残念ながら身体に合わず飲めませんでした。涙
38,B01E4VWE2M,● カモミール ● ハーブティー ● ティーバッグ ● 夜の寝る前に、リラックスできる香り ● ノンカフェイン・無香料・無着色 ● 原料＝,紅茶専門店 京都セレクトショップ,久米　洋子,2020年10月26日,5.0,よい,カモミールの花がそのまま入っていて嬉しいです。
39,B01E4VWE2M,● カモミール ● ハーブティー ● ティーバッグ ● 夜の寝る前に、リラックスできる香り ● ノンカフェイン・無香料・無着色 ● 原料＝,紅茶専門店 京都セレクトショップ,ゆみ,2020年4月28日,4.0,アレルギー？,カモミールの花そのものを使っていてとても香りがいい
40,B01E4VWE2M,● カモミール ● ハーブティー ● ティーバッグ ● 夜の寝る前に、リラックスできる香り ● ノンカフェイン・無香料・無着色 ● 原料＝,紅茶専門店 京都セレクトショップ,ぽにょ,2021年4月6日,5.0,おいしい,昼の仕事のあいま
41,B01E4VWE2M,● カモミール ● ハーブティー ● ティーバッグ ● 夜の寝る前に、リラックスできる香り ● ノンカフェイン・無香料・無着色 ● 原料＝,紅茶専門店 京都セレクトショップ,ひげじいさん,2020年12月6日,4.0,置き方について,香りがよく、おちつくので寝る前に使ってます
42,B01E4VWE2M,● カモミール ● ハーブティー ● ティーバッグ ● 夜の寝る前に、リラックスできる香り ● ノンカフェイン・無香料・無着色 ● 原料＝,紅茶専門店 京都セレクトショップ,tiro,2020年12月15日,5.0,香りがよくおいしかった,香りも良く、落ち着いてきて良く眠れます！
43,B01E4VWE2M,● カモミール ● ハーブティー ● ティーバッグ ● 夜の寝る前に、リラックスできる香り ● ノンカフェイン・無香料・無着色 ● 原料＝,紅茶専門店 京都セレクトショップ,ｍｍ,2021年1月17日,4.0,寝る前の心を落ち着かせるのに使用,体が暖まるし、リラックス効果あり
44,B01E4VWE2M,● カモミール ● ハーブティー ● ティーバッグ ● 夜の寝る前に、リラックスできる香り ● ノンカフェイン・無香料・無着色 ● 原料＝,紅茶専門店 京都セレクトショップ,pokenyan,2020年10月21日,5.0,オススメです！,美味しかったです
45,B01E4VWE2M,● カモミール ● ハーブティー ● ティーバッグ ● 夜の寝る前に、リラックスできる香り ● ノンカフェイン・無香料・無着色 ● 原料＝,紅茶専門店 京都セレクトショップ,Kindleのお客様,2017年4月7日,5.0,おいしくて、ぽっこりする,ほんとに丁寧に作られてるのがわかりました。混じり気なしの純な味わいで、またリピしたいですね。
46,B01E4VWE2M,● カモミール ● ハーブティー ● ティーバッグ ● 夜の寝る前に、リラックスできる香り ● ノンカフェイン・無香料・無着色 ● 原料＝,紅茶専門店 京都セレクトショップ,いけだ,2017年6月28日,3.0,カモミールティー,あまり、おいしいものではありませんが、他の商品と比べてあまりにかわらないような気がします。うまく蒸さないと、味がでない等あります。　薄目の味がよければそれでいいと思いますが。趣味の問題とおもいますが普通ですね、値段が安ければいいのですが。
47,B01E4VWE2M,● カモミール ● ハーブティー ● ティーバッグ ● 夜の寝る前に、リラックスできる香り ● ノンカフェイン・無香料・無着色 ● 原料＝,紅茶専門店 京都セレクトショップ,チューブちゃん,2020年8月21日,5.0,上質なティー,寝付きが悪く、眠りも浅いため気になって購入してみました。香りは好みが分かれる結構きつめの香りです。わたしはお花の香りって感じがして癒されてますが家族には不評でした。これを飲み始めてから寝つきも良くなりました。プラシーボかも？と思い、飲まずに数日過ごしてみたら元どおり眠れなくなりました。わたしにとってなくてはならないものになりました。
48,B01E4VWE2M,● カモミール ● ハーブティー ● ティーバッグ ● 夜の寝る前に、リラックスできる香り ● ノンカフェイン・無香料・無着色 ● 原料＝,紅茶専門店 京都セレクトショップ,kuku,2020年6月2日,4.0,よい香り,カモミールティーを妻から希望され　この商品を1度購入　使い切り再度　同じ商品を頼まれての2度目の購入です。気に入っての購入なので悪くないのでは　と思います。
49,B01E4VWE2M,● カモミール ● ハーブティー ● ティーバッグ ● 夜の寝る前に、リラックスできる香り ● ノンカフェイン・無香料・無着色 ● 原料＝,紅茶専門店 京都セレクトショップ,Customer j,2021年1月15日,5.0,カモミール,とても美味しかったです。カモミールの純粋な味に癒されます。またリピさせていただきます。
