,ASIN,product,brand,name,date,score,title,comment
40,B071GQL6BH,はくばく 水出しでおいしい麦茶 360g×4袋,はくばく,かっぷ,2019年9月27日,5.0,水出しでは好みが分かれる,少し昔っぽい味。最近の有名メーカーのものが美味しくなくなったので今年はこればかり飲みました。袋から出したときに漂ってくる美味しい麦茶の香り。水を入れて飲む前にこれは絶対美味しいと確信できました。　ありがとうございました。
41,B071GQL6BH,はくばく 水出しでおいしい麦茶 360g×4袋,はくばく,権兵衛,2020年9月7日,4.0,製品のばらつきが酷い,煮出すものを使っていましたが面倒なのでこれを試したところ煮出したものより薄く満足できなかったので２袋で１．５リットルで使っています。他のものより香りがよいのが気に入っています。
42,B071GQL6BH,はくばく 水出しでおいしい麦茶 360g×4袋,はくばく,ハルヤ,2021年1月9日,5.0,美味しい麦茶だった,いつも近くのスーパーで購入していましたが取り扱いをやめたのか見つからなかったためこちらで購入しました。商品はいいのですが、ダンボールがとにかく煙草臭い！食料品なのでほんとやめて欲しいです。配達員の方もものすごく感じ悪いしAmazonさん安いけど次利用するか迷いますね。商品に関しては100点満点でオススメです！一歳半の娘も大好きでいつも沢山飲んでくれます。
43,B071GQL6BH,はくばく 水出しでおいしい麦茶 360g×4袋,はくばく,ひまわり,2019年3月17日,5.0,２袋入れないとちょっと薄いかな,手軽でおいしいです煮沸する必要がないので、夏場にもいいです。我が家はボトルを2つ買ってひとつ飲み切ったらすぐに水出しを作って、というふうにローテーションしてます。
44,B071GQL6BH,はくばく 水出しでおいしい麦茶 360g×4袋,はくばく,みおみお,2021年2月20日,4.0,ダンボールがタバコ臭い!!!,水に数時間入れるだけで美味しい麦茶ができます。少し薄めの仕上がりなので、水は少し少なめに入れています。煮出さなくていいから楽です。子供でも作れます。
45,B071GQL6BH,はくばく 水出しでおいしい麦茶 360g×4袋,はくばく,ぺん,2021年6月22日,3.0,水出しなのに美味しい,家庭用に購入しました。早速作ってみたところ、3時間ほどで色がいい感じになり、飲んでみました。味は今まで購入していた安さが売りの麦茶パックよりは数段美味しいと感じました。麦の香ばしい香りが良く、夏にぴったりだと思います。ただ値段相応か、少し高いかなと感じざるを得ませんでした。
46,B071GQL6BH,はくばく 水出しでおいしい麦茶 360g×4袋,はくばく,ちづちづ,2021年6月26日,4.0,水出しで楽々,ボトルに１つポンッと入れて、水を入れるだけなので簡単。そして美味しい。今年の夏はこれで乗り越えようと思います。
47,B071GQL6BH,はくばく 水出しでおいしい麦茶 360g×4袋,はくばく,伊藤 g,2020年7月28日,5.0,味は良好。コストダウンを。,美味しい、上品な色、香りがよい飲んでいてとても良い気分になる他の麦茶とは違うそして、安い
48,B071GQL6BH,はくばく 水出しでおいしい麦茶 360g×4袋,はくばく,Y,2018年9月17日,4.0,美味しい,ハトムギ茶と 間違えて購入してしまいました。でも、とても美味しい麦茶です。水出しだと いまいちなので うちでは ティーバッグじゃなく 麦茶の粒買って 煮出してましたが暑い夏は きついので 水出しが嬉しいです。
49,B071GQL6BH,はくばく 水出しでおいしい麦茶 360g×4袋,はくばく,mmm,2020年10月4日,3.0,やさしい味です,味は麦の味があって美味しかったです。市販の麦茶よりちょっと薄くできる感じです。濃い麦茶が好きなので、作るときは2パック使っています。
50,B071GQL6BH,はくばく 水出しでおいしい麦茶 360g×4袋,はくばく,Amazon カスタマー,2018年10月24日,5.0,美味しい。,色は薄めですが味はしっかり出ます。自然な香ばしさでごくごく飲めます。つい二日三日パックを入れっぱなしにしてしまうことがあるのですが、濃くならず、にごらず、ボトルもぬめりにくいように思います。
51,B071GQL6BH,はくばく 水出しでおいしい麦茶 360g×4袋,はくばく,高橋,2020年7月16日,2.0,麦の味がして美味しいです,レビューを参考に購入しました。パッケージ指示通りに作りましたが、特に美味しくはないと思います。今まで買っていた商品に戻ります。
52,B071GQL6BH,はくばく 水出しでおいしい麦茶 360g×4袋,はくばく,saro,2020年4月21日,5.0,香ばしくてとてもおいしい,簡単水出しですがしっかりと麦茶です。推奨水出し時間の２時間以上放置しててもえぐ味がでませんし、かえって濃くなり美味しかったです。定期購入して半年以上愛飲しています。
53,B071GQL6BH,はくばく 水出しでおいしい麦茶 360g×4袋,はくばく,quiltyokappa,2020年9月10日,5.0,期待を下回った,スーパーで買っていたけど、なくなったのでちょうどいいやとまとめ買い。見た目は薄いけどちゃんと香ばしく、スッキリした風味で美味しいです。
54,B071GQL6BH,はくばく 水出しでおいしい麦茶 360g×4袋,はくばく,lee,2019年8月22日,5.0,美味しいです。,美味しいのかな？と思い購入したら、本当にうまい！水でもしっかり出る。4パックまとめ買いしたが、賞味期限までに全て使用できるか？と聞かれたら微妙…1~２日で1パックは使ってますが。
55,B071GQL6BH,はくばく 水出しでおいしい麦茶 360g×4袋,はくばく,tomato,2019年11月18日,5.0,スッキリ味の麦茶,鶴瓶の麦茶より香りと香ばしさよく、水だししても濃くなりすぎかいとこがよいのでリピートしてます。
56,B071GQL6BH,はくばく 水出しでおいしい麦茶 360g×4袋,はくばく,GD&TT,2021年4月26日,5.0,これしか飲めない。,最近のお気に入りの麦茶　どこのお店で買ったのか忘れた為wネットで探して購入しました
57,B071GQL6BH,はくばく 水出しでおいしい麦茶 360g×4袋,はくばく,ラララ0211,2019年7月25日,3.0,味・色が薄い系麦茶,レビューの好評ぶりを見て購入したのですが、自分にはあまり合わなかったです･･･。香り？後味？がけっこう独特なんですね。私はたぶん六条大麦が苦手なんだと悟りました。(コンビニで売られている六条大麦の麦茶もあまり好きではないので)はくばくさんの麦茶では麦芽が入っているほうが美味しかったので、そちらを購入し直します。
58,B071GQL6BH,はくばく 水出しでおいしい麦茶 360g×4袋,はくばく,Amazon カスタマー,2020年2月23日,5.0,最近のお気に入り,そんなに麦茶は好きではなかったのですが、これを飲んで大好きになりました。900mlのピッチャーにパックを入れて、水道水で出してます。パックひとつで2回くらい出せます。とても香ばしく、甘味があります。こちらを飲んだ後にペットボトルの麦茶を飲むと、苦味と渋みに驚くほどです。購入が2回めで、とても美味しかったのでレビューしてみました。
59,B071GQL6BH,はくばく 水出しでおいしい麦茶 360g×4袋,はくばく,Amazon カスタマー,2020年11月10日,5.0,自分にはあまり,手軽に美味しい安心の味。水出しなのに直ぐに香ばしくて美味しい。もちろん夏に、そして冬にも美味しい冷たい麦茶はこれ！
60,B071GQL6BH,はくばく 水出しでおいしい麦茶 360g×4袋,はくばく,トトロ,2020年8月27日,5.0,今まで飲んだ中で一番美味しい麦茶,昨年購入して美味しかったので今年も買って毎日飲んでます。渋味などが無いので飲みやすいです。
61,B071GQL6BH,はくばく 水出しでおいしい麦茶 360g×4袋,はくばく,おとましいyeah!,2020年7月29日,5.0,水出しなのに香ばしくて美味しい❤️,いつも買っていた安い麦茶より、香りがしっかりしていて美味しいです。夏場は水出しが基本なので重宝しています。
62,B071GQL6BH,はくばく 水出しでおいしい麦茶 360g×4袋,はくばく,牛乳lover,2020年5月16日,4.0,リピ買い,大容量でお買い得。水出しはせず、煮出していますが、苦くならず、香りもいい麦茶になります。一回くらいは、水出しして飲んでみようと思います。
63,B071GQL6BH,はくばく 水出しでおいしい麦茶 360g×4袋,はくばく,莉菜,2021年6月25日,2.0,香りがいい,いつもは伊藤園の水出し麦茶を飲んでいます。ペットボトルで飲む麦茶の味を想像していると、今まで飲んだことのない味なので、慣れていない分違和感が残りました。伊藤園の麦茶に戻そうと思います。
64,B071GQL6BH,はくばく 水出しでおいしい麦茶 360g×4袋,はくばく,Amazon カスタマー,2019年11月9日,5.0,美味しい,水道水に入れて数時間、香り良く美味しい麦茶が出来ます。売っていたスーパーで見かけなくなりこちらで購入しました。これからもお世話になります。
65,B071GQL6BH,はくばく 水出しでおいしい麦茶 360g×4袋,はくばく,コーヒや,2019年7月8日,5.0,美味しい！,お水で出したものだとスッキリした麦茶です。お湯で出したものだとコクが出ます。他のでお水で出したものよりは確かに美味しいかと思いますが、個人的には、お湯で出した方が好きです。
66,B071GQL6BH,はくばく 水出しでおいしい麦茶 360g×4袋,はくばく,トンちゃん,2021年3月28日,5.0,手軽で美味しいです。,六条大麦の粗びきで粉が少なく、クリアーな色で美味しいです。夏場はこの水出しを愛飲しています。
67,B071GQL6BH,はくばく 水出しでおいしい麦茶 360g×4袋,はくばく,ロゴス,2019年8月16日,5.0,やっぱりお湯で出した方が好き,昔々、真夏に飲んだ味です 2〜3時間ほどでパックを取り出します 香り豊かな味わいが幸せにしてくれます 少し薄いかなぁ‥と思う絶妙なポイントを探す楽しみがあります 今年は砂糖を入れて飲んでみました 一挙50年前にタイムスリップしてしまいました やっぱり、あの味です 素晴らしい商品に感謝しております
68,B071GQL6BH,はくばく 水出しでおいしい麦茶 360g×4袋,はくばく,橋本恵子,2020年9月21日,4.0,手軽で香り豊かなテトラパック,今まで飲んだ麦茶の中で、一番濃くておいしい。香りもいい。
69,B071GQL6BH,はくばく 水出しでおいしい麦茶 360g×4袋,はくばく,isa,2020年7月8日,5.0,リピーターです,味は大変好みです。濃くなく苦みもないです。麦の香がします。
70,B071GQL6BH,はくばく 水出しでおいしい麦茶 360g×4袋,はくばく,ブックストア大和,2020年9月11日,5.0,うまい,こんなにおいしい麦茶があるなんて衝撃です。香ばしくてほんのり甘みがあって最高です。もっと早く知りたかった。
71,B071GQL6BH,はくばく 水出しでおいしい麦茶 360g×4袋,はくばく,匿名,2020年10月23日,5.0,美味しい麦茶,香りが香ばしくとっても美味しいです。夏はもっぱら水出しでいただいています。水出しにすると香りが香ばしく美味しいです。色々な麦茶を買ってみましたが今のところこれがイチオシです
72,B071GQL6BH,はくばく 水出しでおいしい麦茶 360g×4袋,はくばく,Amazon カスタマー,2020年7月1日,4.0,味が美味しい!!,定期便で購入しておりますが、パッケージのまま箱にパンパンに入っているのでカッターでの開封時は要注意です。すっきりして飲みやすい麦茶です。
73,B071GQL6BH,はくばく 水出しでおいしい麦茶 360g×4袋,はくばく,age,2021年2月17日,5.0,香ばしさが素晴らしい,私は水出しでなく、煮出しているのですが、他の麦茶と比べると色はすごく薄いですが、香りと味が良いので、こちらの方をリピ買いしています。お勧めです。
74,B071GQL6BH,はくばく 水出しでおいしい麦茶 360g×4袋,はくばく,Amazon Customer,2020年6月30日,5.0,定期便の場合は開封時要注意です,他社の製品との違いは、風味と味です。明らかに違います。冬には煮出しタイプを利用しています。年間つうじて我が家は麦茶です。最も安心できる飲み物です。
75,B071GQL6BH,はくばく 水出しでおいしい麦茶 360g×4袋,はくばく,kaochan,2020年8月26日,5.0,香りがよい麦茶,麦茶の香りがよくとても美味しいお気に入りです市販で見かける事が少なくなりこちらで購入しました。
76,B071GQL6BH,はくばく 水出しでおいしい麦茶 360g×4袋,はくばく,MK太郎,2021年4月25日,5.0,すばらしい,多少薄くなるけど「いろはす」２Lくらい抽出できて味も美味い
77,B071GQL6BH,はくばく 水出しでおいしい麦茶 360g×4袋,はくばく,ひろきち,2020年12月18日,5.0,香りと味,とにかく味が良い、昔懐かしいおばあちゃんの味。3～4日ボトルに入れっぱなしでもヌルヌルせず、ずっとサラサラ色が薄いのが玉にキズ。家は冬でも冷蔵庫に、ばくばく麦茶。大好きです。
78,B071GQL6BH,はくばく 水出しでおいしい麦茶 360g×4袋,はくばく,ごぅすと,2021年4月28日,5.0,美味い,はじめて買ってみました。いつも買っている麦茶と比べて、麦の香りがいい♪麦茶ってこんなにおいしかったっけ？と子供も気に入っています。単にのどを潤すだけの飲料だったものが、これからは癒しの飲み物になりそうです。
79,B071GQL6BH,はくばく 水出しでおいしい麦茶 360g×4袋,はくばく,hirohiro,2021年6月25日,5.0,冬でも美味しい麦茶,水出しなのに、しっかり香ばしくて美味しいです！毎日飲むものなのでまとめ買いができるのも便利でいいですね！！
80,B071GQL6BH,はくばく 水出しでおいしい麦茶 360g×4袋,はくばく,Kindleのお客様,2021年3月9日,5.0,味はしっかりでます,しっかり麦茶の香りがして美味しいです。定期便で購入しました。
81,B071GQL6BH,はくばく 水出しでおいしい麦茶 360g×4袋,はくばく,100%勇気,2021年3月8日,5.0,麦茶王！！！,開けた瞬間によい香りがして、幸せな気持ちになります。すぐに味が出始めて使い勝手も良いです。毎日、水やコーヒーの代わりに飲もうと思います。
82,B071GQL6BH,はくばく 水出しでおいしい麦茶 360g×4袋,はくばく,Amazon カスタマー,2020年8月30日,5.0,味が濃い,水出しでこの味はかなりいいと思います。毎年リピートしてます
83,B071GQL6BH,はくばく 水出しでおいしい麦茶 360g×4袋,はくばく,YOU TEA,2018年8月2日,5.0,良い香り,焙煎した香り？で普通の麦茶とは違った風味がして最初は戸惑いましたが1L飲み終える頃には慣れて今ではお気に入り♪毎日2L飲んでます。
84,B071GQL6BH,はくばく 水出しでおいしい麦茶 360g×4袋,はくばく,Tei,2019年1月16日,4.0,我が家の夏の定番,毎日中学生の息子が学校に1リットル持って行っている。毎晩この麦茶のパックで作り、毎朝持って行くが、沸かす事なく水で作れるので楽チン。息子も美味しいと言っている。
85,B071GQL6BH,はくばく 水出しでおいしい麦茶 360g×4袋,はくばく,ｼｬﾗ,2020年12月2日,5.0,ちょっぴりクセがあるのがクセになる。,味は濃いめで結構美味しい
86,B071GQL6BH,はくばく 水出しでおいしい麦茶 360g×4袋,はくばく,まじぇんだ,2018年10月31日,5.0,楽チン・美味しい,スーパーでよく売っている麦茶しか飲んだことがなかったですが、アマゾンで高い評価のこれを頼んでみたらかなり美味しくこれしか飲めなくなりました！リピートしてます、1リットルに2パック入れて濃いめが好きです。
87,B071GQL6BH,はくばく 水出しでおいしい麦茶 360g×4袋,はくばく,安部　正一,2020年7月18日,5.0,夏の麦茶としてはおいしいぶるいな,水出しで楽、色は薄いがコク香りとも他のメーカーの麦茶と比較して頭ひとつ出てる、夏の定番にします。
88,B071GQL6BH,はくばく 水出しでおいしい麦茶 360g×4袋,はくばく,SPUTNiC,2020年8月14日,5.0,おいしい,水出しでも香りがとても良くて、ペットボトルのゴミも出ないので環境にも優しく経済的にもお得です。
89,B071GQL6BH,はくばく 水出しでおいしい麦茶 360g×4袋,はくばく,Amazon カスタマー,2020年3月24日,5.0,美味しい麦茶,いろいろ試しましたが、これに戻ってきました。香り、味、深みがあります。
90,B071GQL6BH,はくばく 水出しでおいしい麦茶 360g×4袋,はくばく,みけ,2021年6月29日,5.0,夏の必需品,色は薄いですが、味は濃い！
91,B071GQL6BH,はくばく 水出しでおいしい麦茶 360g×4袋,はくばく,あんでぃ,2020年11月24日,5.0,飽きのこない麦茶,煮出したり、パックを入れっぱなしだと渋くなってしまうので自家製麦茶が苦手でしたが、こちらの麦茶は入れっぱなしでも渋くなることが無く、スッキリとした飲み口。ペットボトル代の節約に大貢献してくれました。
92,B071GQL6BH,はくばく 水出しでおいしい麦茶 360g×4袋,はくばく,Amazonカスタマー,2020年11月16日,4.0,美味しいです。,商品名に偽りなしです。少しお高めですが、他の水出し麦茶より段違いに美味しいです。
93,B071GQL6BH,はくばく 水出しでおいしい麦茶 360g×4袋,はくばく,Amazon Customer,2021年6月18日,5.0,渋くならない,麦茶本来の味がして美味しいです。家のボトルで作っているので、ペットボトルの削減もできました。
94,B071GQL6BH,はくばく 水出しでおいしい麦茶 360g×4袋,はくばく,ラスタメン大名,2021年5月22日,5.0,他の水出し麦茶が飲めなくなる,美味しい！香ばしい。
95,B071GQL6BH,はくばく 水出しでおいしい麦茶 360g×4袋,はくばく,m.wellness,2019年5月26日,5.0,美味しい,1.5lのポットに水出しで作ってます。いつも飲み切るまでずっと入れっぱなしにしてますが、濃くはなっても苦くはならずとても美味しいです。
96,B071GQL6BH,はくばく 水出しでおいしい麦茶 360g×4袋,はくばく,キラキラひまわり,2021年6月26日,5.0,夏はこれに限る！,味、色味、風味ともにこの価格帯では群を抜いて素晴らしい。個人的な意見ですがこれを飲むと他はもう飲めない。
97,B071GQL6BH,はくばく 水出しでおいしい麦茶 360g×4袋,はくばく,くろ,2020年6月26日,5.0,味がしっかりしている,水出しで毎日飲んでますが、その辺のよりも香りがあって美味しいと思います。
98,B071GQL6BH,はくばく 水出しでおいしい麦茶 360g×4袋,はくばく,kerorin,2020年3月13日,5.0,これを超える麦茶に出会ったことがない,水出しで2リットルの水筒に2パックをいれてます。もう10年近くずっとこれです。家で飲む用、水筒で外に持ち出す用です。水出しの味に満足しており、この商品がある限りは買い続けていくと思います。
99,B071GQL6BH,はくばく 水出しでおいしい麦茶 360g×4袋,はくばく,ぶっ,2020年7月9日,5.0,香りがgood,水出しで利用しています。長時間（一晩）つけておいても、香ばしさが口の中に広がって、全く苦味を感じない美味しさです。
100,B071GQL6BH,はくばく 水出しでおいしい麦茶 360g×4袋,はくばく,かつどん,2021年6月6日,5.0,満足しています,美味しいてす。香ばしくて、他の麦茶は買いません。必ずリピしています。おすすめします。もう少し安いとなおいいですね。
101,B071GQL6BH,はくばく 水出しでおいしい麦茶 360g×4袋,はくばく,tae,2020年5月24日,4.0,長時間水につけておいても苦くない,取り出すタイミングを逃しても、濃くなりすぎて呑みづらくなることない。雑味のない薄味だけど、美味しいといえる。
102,B071GQL6BH,はくばく 水出しでおいしい麦茶 360g×4袋,はくばく,Julie yoko 58,2021年2月19日,5.0,美味しい,スッキリしていて飲みやすい。パックを入れっぱなしにしていても細かい粉が出てこない。色は薄いけど味わいはしっかりしている。テトラ型なので扱いやすい。
103,B071GQL6BH,はくばく 水出しでおいしい麦茶 360g×4袋,はくばく,にこるん,2020年11月30日,4.0,失敗なし？,よくありがちなサッと作れる麦茶とは味が違います。
104,B071GQL6BH,はくばく 水出しでおいしい麦茶 360g×4袋,はくばく,じゅんた,2020年6月1日,5.0,おいしい！,麦茶のいい香りがして、とても美味しいです。
105,B071GQL6BH,はくばく 水出しでおいしい麦茶 360g×4袋,はくばく,すーたん,2020年10月12日,5.0,黄金色の麦茶,普通の麦茶より色が薄く物足りないような気がしてましたが、飲んでみたら味や香り共にとても良かったです。
106,B071GQL6BH,はくばく 水出しでおいしい麦茶 360g×4袋,はくばく,Amazon カスタマー,2020年7月5日,2.0,美味しいです,他の皆さんが仰っているように1Lに一個では一晩かけても薄いです。好みに合わせて調節した方がいいと思います。
107,B071GQL6BH,はくばく 水出しでおいしい麦茶 360g×4袋,はくばく,Amazon カスタマー,2020年3月11日,5.0,美味しいです,スーパーで安く売ってるのと全然違いますね。とても美味しいです。
108,B071GQL6BH,はくばく 水出しでおいしい麦茶 360g×4袋,はくばく,匿名,2020年6月14日,5.0,まずい,気に入って二度目の注文です。
109,B071GQL6BH,はくばく 水出しでおいしい麦茶 360g×4袋,はくばく,みどり,2021年3月18日,4.0,美味しい！,香ばしく美味しいです。水だしでの出は今一遅いです。
110,B071GQL6BH,はくばく 水出しでおいしい麦茶 360g×4袋,はくばく,coco,2020年1月3日,5.0,香ばしい味と香り,水出しで美味しいので冬でもこれです！
111,B071GQL6BH,はくばく 水出しでおいしい麦茶 360g×4袋,はくばく,みゃあみゃ,2019年12月3日,3.0,香ばしい,香ばしいような気がしますが薄さは否めない
112,B071GQL6BH,はくばく 水出しでおいしい麦茶 360g×4袋,はくばく,miho,2020年9月17日,4.0,一番好きな麦茶！,スッキリしたのみ心地です。一日中いれたままでも濃くならないです。
113,B071GQL6BH,はくばく 水出しでおいしい麦茶 360g×4袋,はくばく,Amazon カスタマー,2021年4月14日,5.0,麦茶にこだわるなら,香ばしくて美味しい。
114,B071GQL6BH,はくばく 水出しでおいしい麦茶 360g×4袋,はくばく,kuma,2020年10月13日,5.0,スッキリしてます,とっても美味しいです！名前通りに水出しでこんなに美味しいのか…！と前の麦茶に戻れなくなりました。来客にも好評でたくさん飲んでいかれます（笑）
115,B071GQL6BH,はくばく 水出しでおいしい麦茶 360g×4袋,はくばく,sean,2020年12月11日,5.0,最高！,水だしで出来るところが便利です！容器に入れっぱなしでも苦味が出にくいです。
116,B071GQL6BH,はくばく 水出しでおいしい麦茶 360g×4袋,はくばく,みのじ,2019年9月1日,4.0,商品名に偽りなし,香りがよかったです。
117,B071GQL6BH,はくばく 水出しでおいしい麦茶 360g×4袋,はくばく,Amazon カスタマー,2019年9月19日,5.0,きなこのような香ばしさ,少し値段高めだが、おいしいとおもえる麦茶
118,B071GQL6BH,はくばく 水出しでおいしい麦茶 360g×4袋,はくばく,ひろ,2020年5月25日,5.0,水出しでは,色は薄いですが、普通の麦茶のような苦味がなく飲みやすいです。麦茶があまり好きじゃない人におすすめです。お値段は高めだと思います。
119,B071GQL6BH,はくばく 水出しでおいしい麦茶 360g×4袋,はくばく,blueleaf77,2021年1月12日,5.0,味が良いのでリピートしてます,いちばん美味しい麦茶。スーパーで見かけないので助かります。
