,ASIN,product,brand,name,date,score,title,comment
0,B071GQL6BH,はくばく 水出しでおいしい麦茶 360g×4袋,はくばく,ヤドリーヌ,2018年7月23日,5.0,水出し麦茶の最高峰,いつも2リットルのお茶をわざわざ買っていたのですが、費用のことを考え、気分転換にこちらを買ってみました。1リットルの水にこちらを入れ、半分くらい飲んだら水を追加して、1パックで計2リットルのお茶を飲んだら捨てています。飲み終わってからパックを捨てますが、3日くらいそのままにしていても、味が濃すぎることもなく、おいしく飲めています。やかんを使う手間が省けて、味もおいしく、高価なものでもないので、定期おトク便でリピートする予定です。
1,B071GQL6BH,はくばく 水出しでおいしい麦茶 360g×4袋,はくばく,飛鳥井,2021年3月13日,2.0,家族が絶賛,例えて言うなら、田舎のお婆ちゃんが土瓶に入れて冷やしてくれた麦茶の味水出しでも、味的には、手間の掛かった煮出しに近い味がすると思う。薄味というコメントが多いが、それは多分に「色が薄い」事が心理的に影響した結果のような気がする。味・香りは水出しでも結構出ている。ただ、味と香りは、きちんと焦がし麦の風味が出ている分、好き嫌いが出ると思う。あと、局面。お客さんにきちんと、冷えた切り子のグラスかなんかで1杯出す分には向いていると思うし、例えば味と香りのシッカリした、ケーキや和菓子と合わせる分には向いているかも。でも、私の場合、食後・和菓子には緑茶、ケーキには紅茶、朝は珈琲派だから、「麦茶」の主目的としては「ごくごく・すっきり」帰宅後や風呂上がりに飲みたい局面。そういう、「ごくごく・すっきり」「水代わりだけど、水じゃ流石に味気ない」という派には、向かないと思う。つまりは「麦茶」というジャンルでしっかり味を楽しみたい派には◎でも、「麦茶」はあくまで「水代わり」、緑茶・紅茶・珈琲とはランクが違う派には✕かな
2,B071GQL6BH,はくばく 水出しでおいしい麦茶 360g×4袋,はくばく,saito,2019年6月27日,4.0,評価通りのおいしさ,今まではなんとなく伊藤園の香り薫るむぎ茶ティーバッグをスーパーで買ってたけど、この商品が気になったので買ってみた。最初淹れたものを見たときは麦茶の色が薄くて「大丈夫か？」と思ったけど、香りがすごく良い！味もそこそこして気に入りました。この価格でこれだけのものが飲めるならおすすめできます。高い麦茶は飲んだことなくて高いやつはもっとおいしいんだろうけど、この商品はコスパがすごい良いと思います。今まで飲んでた伊藤園のやつは色は濃いものの水っぽいくて香りもあまりしなかったのではくばくのやつ飲んでびっくりしました。おすすめです。これからも定期的に買おうかと思います。
3,B071GQL6BH,はくばく 水出しでおいしい麦茶 360g×4袋,はくばく,ぐーたら娘,2020年6月8日,5.0,合う合わないが明確に出る,煮だして冷ましてポットに詰め替えて冷蔵庫で冷やしてという工程が面倒で、もっぱら水出しで利用していました。他の水出し”も”できる商品を今まで使っていたところ、少し長めに置いておくとコーヒーのような色と苦みが出てしまい、それが普通なのだと思っていました。こちらはそういうことがなく、少々長めに置いても（たとえば一晩）色も薄めで苦みはなく麦茶の香りと味だけがしっかり出てくれます。今後はこれ一択ですね。欲をいえばもう少し小ロット（1，2パック）でも買えると嬉しいです。
4,B071GQL6BH,はくばく 水出しでおいしい麦茶 360g×4袋,はくばく,らて〜る,2018年7月8日,5.0,香りが良い,子供の頃に飲んだ懐かしい味がします。麦茶って、こういう味だったなぁ。水出しでも美味しいですが、沸かしたお湯に入れて蒸らして、水を入れると早く飲めます。濃いめでも苦くなりませんが、私の好みはこのくらいの色です。美味しい麦茶です。
5,B071GQL6BH,はくばく 水出しでおいしい麦茶 360g×4袋,はくばく,ぴ,2019年7月7日,5.0,入れっぱなしでも出すぎません,長いこと、毎月ペットボトルの十六茶や麦茶を定期便で購入してきたが、どんどんペットボトルが溜まるし、明らかに無駄なので、こちらを買ってみた。香りのかの字もないペットボトルの麦茶と違い、格段に香ばしくて美味しい。こういう本当の麦茶の味に馴染んでない孫にはまだ不評だが、大人には好評。入れっぱなしにしてても苦くならないのかどうかは、2L作っても翌日には飲んでしまうのでまだわからない。
6,B071GQL6BH,はくばく 水出しでおいしい麦茶 360g×4袋,はくばく,Amazon カスタマー,2020年10月17日,5.0,お湯で蒸らしてから。,普段は無印良品の麦茶を飲んでいました。こだわりがあった訳でも、美味しい！と思っているからと言う訳でも無く、いつも　あ、麦茶買わなきゃ　と思い出すのが何故か無印良品だったからと言う理由のみです。その割には高いので、そろそろ小さい頃からお馴染みのミネラル麦茶にしようかなと言うタイミングでこの商品のセールに出会いました。レビューを読んで、どれだけ美味しいかがすごく熱く語られていて　もう買うっきゃ無いでしょ！？と思いました。実際使ってみると、その他の麦茶よりもすごく綺麗な薄い色。皆さん仰る様にそれなのに匂いは良く出ていてとてもあっさりスッキリしていて美味しい！これからしばらくこちらを飲んでみたいと思います。難を挙げるとすると三角っぽいパックなので、捨てる時にデブになる事。めんどくさい日は子供に持たせる水筒にパックを入れてそのまま作るんですが、パックが太り過ぎて口から出ない笑。菜箸でフンッ！と捕まえて捨ててます。
7,B071GQL6BH,はくばく 水出しでおいしい麦茶 360g×4袋,はくばく,寝起き,2019年8月9日,5.0,香ばしくて美味しい,とても良い香りです。煮出しもOKです。水出し…香りがとても良い、色は普通の麦茶よりだいぶ薄いですが、香りは抜群。味はまろやかですが、しっかりしています。「味が薄い」というレビューもありますが、前の晩から水出しすれば色は薄くても味や香は薄くありません。薄いと感じる人は鼻が悪いと思います。煮出し…色は濃く出ますが香りがとんでしまうのか、色のわりに薄く感じます。個人的には水出しが好みです。
8,B071GQL6BH,はくばく 水出しでおいしい麦茶 360g×4袋,はくばく,amazonカスタマー,2019年8月2日,5.0,美味しい！,お手軽だからという理由でGREENDAKARAの缶の麦茶(濃縮タイプ)を一度買ったものの、香りがあまりしないことが不満で、レビューの良かったこれを試しに飲んで見ました。本当に香ばしいですね。私は2リットルに2個入れて一晩。翌日半分になったら1リットルのペットボトルに入れ替えてまた作ります。なので、何日も漬けておいたことはありませんが、苦味はないようです。リピしました。
9,B071GQL6BH,はくばく 水出しでおいしい麦茶 360g×4袋,はくばく,まーく,2020年7月17日,4.0,レビューが良すぎかな？,水出しすぐにでます。すぐに出るからパックを取り出し忘れないですむし、結果えぐみも出ない。ちょっと期待しすぎてましたが普通に美味しいです。大量に届いてどうしよう。。少し割高になってももう少し少ない量でも注文できたらいいのに。
10,B071GQL6BH,はくばく 水出しでおいしい麦茶 360g×4袋,はくばく,ベイビーガール,2020年7月26日,5.0,香ばしい麦茶,今まで緑茶を水出しして飲んでいました。夏になって来てすっきり飲みたいので、水出しの麦茶を探しててレビューが良かったので注文してみました。これは美味しいですね！１リットルで１個って記載して有りますが、濃くて苦いので２リットル位水を入れても、ちゃんと麦茶の味がします。水出しでも粉とか出ずに綺麗な澄んだ麦茶が出来上がります。リピ決定です！
11,B071GQL6BH,はくばく 水出しでおいしい麦茶 360g×4袋,はくばく,しい,2021年2月1日,2.0,普通に美味しい,水出しだから手軽にストックできると購入。価格はお得なので良いですが薄いです。味も色もかなり薄い。1袋でやかんや2Lのストック用のぼとりに良いのかと思って買ったので残念(いつもそうだから)。2袋を試しに入れましたが2Lのボトルの水には薄かったです。3袋入れたらお得感はなくなりますね。3袋入れても薄め。薄い麦茶が好きな人ならば良いでしょう。私達は普通の濃さが良いのでリピはないです。3袋入れて薄めの普通の麦茶です。
12,B071GQL6BH,はくばく 水出しでおいしい麦茶 360g×4袋,はくばく,rei,2019年12月4日,5.0,美味しい！,タイトル通り夏季に「ちょっとしたお礼品」として使いってます。友人や各所お世話になっている所などへの感謝の気持ちとしてこちらの商品を渡してますが、かなり好評です！！（特に屋外・屋内関係なく汗をかく環境下でお仕事されてる方です。）他レビュー様にあるような感想をいただいてますし、気に入って購入された方もいます。
13,B071GQL6BH,はくばく 水出しでおいしい麦茶 360g×4袋,はくばく,Melody,2020年7月3日,3.0,味も色も薄い,こちらのお湯で煮出すタイプをずっと使っていて、美味しさは分かっていたので、水出しを購入しました。こちらが届く前に、無印の水出し麦茶を使っていたのですが、それと比較すると、色の出が薄いです。無印のも1リットル用ですが、2リットル分は作ることができたのに対し、こちらは、1.4リットルでも薄かったので、規定量の1リットルに戻しましたが、それでも薄かったです。コスパは悪く感じました。評価も良かっただけに、残念でした。画像は、水を1リットルにして一晩水出ししたところです。入れっぱなしでも、出すぎることがないです。
14,B071GQL6BH,はくばく 水出しでおいしい麦茶 360g×4袋,はくばく,もっきーなっ,2020年7月6日,5.0,夏季に「ちょっとしたお礼品」として使ってます。,夏は麦茶を大量に消費するため水出しで美味しいティーバッグを探していました。スーパーで色々な麦茶パックを試しましたが、こちらのはくばくさんの麦茶が1番美味しいです。これまで水出しは味が薄くなって好きではなかったのですが、こちらの商品はしっかり麦の味がして水出しでも美味しいです。いや、むしろ煮出しよりもすっきりした味わいでとても好みのお味でした。是非オススメしたいです！
15,B071GQL6BH,はくばく 水出しでおいしい麦茶 360g×4袋,はくばく,なな7,2019年6月29日,5.0,薄めです。,出来立ての熱々の麦茶の美味しさって、冷めるの不思議となくなってしまうんですけどこれは水出しなのにあの熱々の美味しい味がします。茶葉を一晩冷蔵庫で入れっぱなしにしても美味しさが変わらないので、とても重宝してます。たしかに安い麦茶には比べたら高いけど、美味しさを考えたらコスパは良いと思います。もう安い麦茶には戻れない。
16,B071GQL6BH,はくばく 水出しでおいしい麦茶 360g×4袋,はくばく,honyo,2020年11月1日,5.0,味も香りもよいが匂い漏れがする,一度飲んでから、もうずっと麦茶はこれです。安い麦茶にくらべると、明らかに雑みがなく、スッキリしています。色が金色なところもいいです。最近、夏場は近所のスーパーやドラッグストアでも置いているのですが、寒くなってきたら、見かけなくなりました。1年中、麦茶を作るので、Amazonで買えるのは助かります。
17,B071GQL6BH,はくばく 水出しでおいしい麦茶 360g×4袋,はくばく,FOX ★,2017年11月20日,5.0,麦茶の香ばしさがある！！,ツイッターでおいしい麦茶とのコメントをみて購入しました。姉に勧めたら、すごく絶賛してくれて、また頼んで、と言われました。1パックだと薄いみたいなので、2パック入れてるようです。私も頂きましたが、飲んだ後の後口が香ばしくてとても良い風味です。
18,B071GQL6BH,はくばく 水出しでおいしい麦茶 360g×4袋,はくばく,MSK,2020年5月1日,5.0,麦茶はコレ！,美味しいし手軽。ありがたい事この上なし。スーパーで安く売っていた水出し麦茶と比べると、格段に味が良い。長く水に浸けてても苦味があまり出ない。短時間でちゃんとお茶が出るので、朝子どもの水筒のお茶を用意するのにかなり助かってます。
19,B071GQL6BH,はくばく 水出しでおいしい麦茶 360g×4袋,はくばく,恵,2019年12月11日,5.0,他の麦茶が買えなくなります,この麦茶に手を出してしまってから、もう他の麦茶は飲めません。香ばしくて、でもやさしい味で美味しいです。こどもが一年中水筒に麦茶を入れていくので定期便で頼んでいます。今まで麦茶なんてどれも同じ！と思っていた方に飲んでほしいです。
20,B071GQL6BH,はくばく 水出しでおいしい麦茶 360g×4袋,はくばく,Amazon カスタマー,2020年10月15日,4.0,便利で美味しい素晴らしい,以前水出しして飲んでいた麦茶(川原製粉所)よりも色味が薄かったので、ちゃんと出ているのかなと思いましたが、しっかり香りも味もありました。味は麦茶というよりそば茶っぽく感じました。浅煎り粗挽きだからこその色と風味なんでしょうね。苦味や渋味がなくて後味もすっきり、ごくごく飲める麦茶だと思います。私が思う麦茶の味ではなかったので星4にしてます。
21,B071GQL6BH,はくばく 水出しでおいしい麦茶 360g×4袋,はくばく,ichika,2020年10月10日,5.0,香ばしく美味しい！,最初パックの大きさに驚きました。今まで使ってた麦茶パックの2倍くらい大きくて。飲んでみると香ばしいけど濃くなくてすっきり！これはおいしい麦茶です。4袋も入ってるので、母におすそ分けしたらおいしい！って喜んでいました他の麦茶が飲めなくなりそうです。
22,B071GQL6BH,はくばく 水出しでおいしい麦茶 360g×4袋,はくばく,カレー大好き,2020年12月7日,4.0,浅煎り粗挽きだからこそ,麦の香りと味がしっかりしています。これを基準にするなら、スーパーで売っているような安い麦茶は、ただの水に色をつけたような感じでしょうか。でも、感動するほどうまくはない。昔、同じ製品を飲んだときは感動しましたけどね。品質が落ちたのでしょうか。この味でこの値段、この量というところではやや高めか。
23,B071GQL6BH,はくばく 水出しでおいしい麦茶 360g×4袋,はくばく,まめ,2020年10月22日,5.0,おいしい,以前は50個入りの安い麦茶を買っていたので、数が少ないのに高いなぁと思いました。最初は色の薄さにびっくりしましたが、香ばしくて美味しいです。ブリタで濾過した水を使っています。値段はやや高く感じますが、子供もこちらを気に入っているのでしばらくは買い続けたいと思います。ただ、子供が大きくなってガブガブ飲むようになると考えるかもしれません。
24,B071GQL6BH,はくばく 水出しでおいしい麦茶 360g×4袋,はくばく,めい,2021年6月25日,5.0,美味しい,袋はジップロック形式になっており、一回開けたら内部が湿ってしまうなどの問題が起きないので良いです。コスパもよく、苦味もないので飲みやすく重宝しています。水出し以外にもお湯で作ることもできると記載されていました。
25,B071GQL6BH,はくばく 水出しでおいしい麦茶 360g×4袋,はくばく,duck,2019年7月15日,5.0,飲みやすい,２リットルに３パックが我が家の定番。はくばくさんはウドンにハマって、麦茶も知りました。パックを浸けたままにしておいても（少なくとも2−3日は）エグ味も出ないので安心。夏季は結構なヘビロテです。
26,B071GQL6BH,はくばく 水出しでおいしい麦茶 360g×4袋,はくばく,はりねっず,2018年12月2日,5.0,苦味なく良い。,今までで買った麦茶でこんなに香りがいいのはなかったです。水出しだと水道水のカルキの臭いが気になるのが普通ですが、この麦茶だと香りがカルキの臭いに勝るようで、カルキの臭いを全然感じません。これまでミネラルウオーターしか飲まなかった家族が何も言わないのに毎日この麦茶を飲んでいます。夏だけでなく一年中のみ続けてます。最高。
27,B071GQL6BH,はくばく 水出しでおいしい麦茶 360g×4袋,はくばく,みーパパ,2021年2月5日,5.0,簡単で美味しい,麦茶大好きな子供に毎日煮出しは大変なので、有名なメーカーの水出しにしていました。子供に「麦茶がまずい」と言われ（涙）こちらの商品をたまたま見つけて購入したら「めっちゃ美味しい！」と合格(笑)それ以来ずっとこの麦茶が我が家の定番です。定期購入したらちょうど後1袋くらいにまた次のが届くので有難いです。お友達が来た時に「この麦茶美味しい！」と言われるのでおすすめ。
28,B071GQL6BH,はくばく 水出しでおいしい麦茶 360g×4袋,はくばく,ゆん,2021年3月31日,4.0,香りが最高,すっきり飲みやすく、美味いです。季節に関係なく1年中飲んでいます。スーパーの安いものと比べれば多少高めですが、十分その価値はあると思います。
29,B071GQL6BH,はくばく 水出しでおいしい麦茶 360g×4袋,はくばく,なつみかん,2019年8月29日,5.0,シンプルに美味しい,よく、麦茶やハト麦茶を飲みます。それで麦茶は簡単に出来る水だし麦茶がいいなーと思い、簡単に出来るが味も美味しい方がいいと思い、いろいろ探していて、このはくばく水だしでおいしい麦茶と言うのを見つけて、試しにと購入してみました。すると、本当に水だしで簡単に出来るのだが、味も美味しい。毎日ばくばく飲んでいます。さらに4袋でこの値段なので、すごくお得。お金を気にする事なく、毎日ばくばく飲んでます
30,B071GQL6BH,はくばく 水出しでおいしい麦茶 360g×4袋,はくばく,モラー,2021年5月6日,4.0,美味いです,時間を長く置きすぎると酸味がでてコーヒーっぽくなります色的に不安になりますが、ちょっと色が付いた位が一番おいしい！
31,B071GQL6BH,はくばく 水出しでおいしい麦茶 360g×4袋,はくばく,MM,2019年7月31日,5.0,美味しい,試しに飲んでみたらいつも買っていた麦茶より美味しかったです。雑味が少なくてスッキリ上品な味わいなのにうまみはしっかりとある。ちょっとお高いのですが、この味でこの値段ならお買い得！是非一度お試しあれ！！
32,B071GQL6BH,はくばく 水出しでおいしい麦茶 360g×4袋,はくばく,Amazon カスタマー,2020年10月9日,5.0,我が家お気に入りの麦茶です。,煮出しタイプからこちらにしてみました。水筒で持って行く場合、水道水が腐りにくくすると聞き、水道水で作っています。以前はつぶまるを購入していましたが、はくばくの麦茶を購入すると他には移れません。
33,B071GQL6BH,はくばく 水出しでおいしい麦茶 360g×4袋,はくばく,marukawaii,2020年1月26日,4.0,安物とは香りが全然違う！,近所の生協で夏場のみ取り扱いがあるのですが、年中麦茶を飲用しているので探してみたらAmazonさんにあったため買ってみました。水出しでとても美味しいです。入れっぱなしども濃くならず、ズボラな私にはとても助かっています。2回目だと大分薄くなってしまいます。今後も取り扱いして欲しいです。
34,B071GQL6BH,はくばく 水出しでおいしい麦茶 360g×4袋,はくばく,Amazon カスタマー,2020年8月26日,5.0,水出しでも美味しい麦茶,外出先で立ち寄ったスーパーでたまたまこちらの商品を購入したところ、とても美味しかったので、続けて購入したかったのですが、近所の小売店では販売しておらず…こちらでまとめて購入することにしました。この麦茶はとても香りが良く、麦茶の色も上品で綺麗な色（濃くならない！）です。パックを入れたままにしていても、苦味がありません。風味がよくとても飲みやすい麦茶だと思います。苦味がないので、我が家では子供たちの水筒用にも使っていて、とても重宝しています。オススメです！
35,B071GQL6BH,はくばく 水出しでおいしい麦茶 360g×4袋,はくばく,ミスシャーロック,2021年4月17日,5.0,美味しいです,幼稚園の水筒に毎日麦茶を作ります。一度作ると2、3日かけて消費しています。こちらは他のメーカーと違い、2日後の麦茶も渋みや雑味が無く、スッキリと麦の甘さが感じられて美味しいです。
36,B071GQL6BH,はくばく 水出しでおいしい麦茶 360g×4袋,はくばく,ぐみこ,2021年6月26日,5.0,苦味のでない、香り良く美味しい麦茶,プライムデーでお得だったので試しに購入。いつもお湯を沸かして作るのがめんどくさくてペットボトルのお茶を購入していたのですが、水出しと見て即ポチりました笑2Lの常温水に2パック入れてよく冷えるまで冷蔵庫に入れておいて色がいい感じについたら飲んでます。薄いかな〜と思ったけどちょうどよくてめちゃくちゃ美味しかったです。4袋まとめ買いだったのでなくなったきたらまた購入します。
37,B071GQL6BH,はくばく 水出しでおいしい麦茶 360g×4袋,はくばく,Amazon カスタマー,2019年11月17日,5.0,美味しい,はくばくの麦茶はこの水出しと煮出しの両方を愛用しています。味的には正直やはり香り、味、風味など煮出しには敵いません。ですが煮出す手間と冷ます手間などを考えたら気軽に飲める此方のほうが夏など大量に消費する場合はおすすめです。水出し麦茶の中では自分の試食した中ではこの麦茶が一番でした。
38,B071GQL6BH,はくばく 水出しでおいしい麦茶 360g×4袋,はくばく,森本咲,2018年9月6日,5.0,思ってた以上に美味しい！,ずっとほうじ茶パック購入してましたがさすがに飽きてきてコチラを購入。お茶ポットに麦茶を入れ、少しの熱湯をかけて蒸らした後に水を入れて冷蔵庫へ。十分美味しい麦茶です。沸かしたらもっと美味しくなるとは思いますが、面倒なので（笑）
39,B071GQL6BH,はくばく 水出しでおいしい麦茶 360g×4袋,はくばく,くまゆる,2019年9月5日,4.0,水出しの中では一番オススメです。,味は、どこのメーカーよりいいのでは？色々試しましたが、麦茶の中ではこれがダントツ。このお値段でこの品質。文句ないです。ただ、夏場はミネラルなど入っていると有難いので、真夏は某有名メーカーの物にせざる得ない。味はこちらの方がどう考えても良いので、ミネラル入り、出して欲しい。
