,ASIN,product,brand,name,date,score,title,comment
431,B074MWTKTR,ネスカフェ ゴールドブレンド エコ&システムパック 105g,ネスカフェ RSC,y/s,2020年4月29日,4.0,手軽さ,１本ずつなので香りがいいのが好きです。
432,B074MWTKTR,ネスカフェ ゴールドブレンド エコ&システムパック 105g,ネスカフェ RSC,マロン,2020年4月7日,4.0,新鮮で美味しい,お気に入りのコーヒーが、お手頃価格でコンスタントに手に入ることが、とても気に入っています。
433,B074MWTKTR,ネスカフェ ゴールドブレンド エコ&システムパック 105g,ネスカフェ RSC,尾崎洋子,2019年3月24日,4.0,美味しい,初めは微妙かな？と思ってましたが、慣れると普通に美味しいです。めっちゃ美味しいわけではありませんが、普通に美味しいです。
434,B074MWTKTR,ネスカフェ ゴールドブレンド エコ&システムパック 105g,ネスカフェ RSC,久保勇人,2020年12月8日,3.0,『お気に入りのコーヒー』アマゾンが私の思いを叶えてくれる。,セールで購入しました
435,B074MWTKTR,ネスカフェ ゴールドブレンド エコ&システムパック 105g,ネスカフェ RSC,BDXL3D,2019年4月13日,5.0,普通に美味しい,大量消費するため定期購入。ゴールドブランドの安定感
436,B074MWTKTR,ネスカフェ ゴールドブレンド エコ&システムパック 105g,ネスカフェ RSC,カマ,2018年2月22日,4.0,安くて,友人へのプレゼントとして、ゴールドブレンドバリスタとともに贈りました。おいしいコーヒーに喜んでました。
437,B074MWTKTR,ネスカフェ ゴールドブレンド エコ&システムパック 105g,ネスカフェ RSC,なぁな,2020年2月29日,5.0,安価,スーパーで買うより安いのでこちらで購入してます！コーヒーがない人生は考えられない。
438,B074MWTKTR,ネスカフェ ゴールドブレンド エコ&システムパック 105g,ネスカフェ RSC,もすもす,2021年7月9日,1.0,良かったです。,カフェラテで飲んだ時、コーヒーの風味かを感じられて、美味しかったです。
439,B074MWTKTR,ネスカフェ ゴールドブレンド エコ&システムパック 105g,ネスカフェ RSC,とことこ,2019年2月4日,1.0,お得,高い。普通うのインスタントと味はかわらない。
440,B074MWTKTR,ネスカフェ ゴールドブレンド エコ&システムパック 105g,ネスカフェ RSC,飛弾　佳代,2019年5月23日,5.0,美味☺,エコパックを開封した時のコーヒーの香りは何とも言えない楽しみです。半月に1回この楽しみがあります、飲んでも言うまでもないですが、至福のひと時が過ごせます。
441,B074MWTKTR,ネスカフェ ゴールドブレンド エコ&システムパック 105g,ネスカフェ RSC,ひろ,2020年4月16日,5.0,助かります。,インスタントとしては、大満足です。職場で缶コーヒーを買わずに済みます。缶コーヒーだと砂糖もすごいので、助かります。
442,B074MWTKTR,ネスカフェ ゴールドブレンド エコ&システムパック 105g,ネスカフェ RSC,あずちゃん,2021年2月8日,5.0,満足してます。,お気に入りです
443,B074MWTKTR,ネスカフェ ゴールドブレンド エコ&システムパック 105g,ネスカフェ RSC,Amazon カスタマー,2019年7月11日,4.0,安くて美味い！,携帯用で購入しました。ありがとうございました。
444,B074MWTKTR,ネスカフェ ゴールドブレンド エコ&システムパック 105g,ネスカフェ RSC,Amazon カスタマー,2020年7月4日,5.0,ワンプッシュ,ネスカフェ バリスタのコーヒーが切れて急遽購入。プライムで送料がかからず助かります。
445,B074MWTKTR,ネスカフェ ゴールドブレンド エコ&システムパック 105g,ネスカフェ RSC,タロさん,2021年1月12日,4.0,携帯用に便利,兎に角配達が早い
446,B074MWTKTR,ネスカフェ ゴールドブレンド エコ&システムパック 105g,ネスカフェ RSC,パンダパンダ,2020年6月8日,5.0,バリスタ用に購入,私の地域では最安値なのでリピートしています詰め替えも楽ですし、バリスタ愛用者としてはとても重宝します
447,B074MWTKTR,ネスカフェ ゴールドブレンド エコ&システムパック 105g,ネスカフェ RSC,池谷正,2021年1月18日,4.0,ネスレコーヒー,インスタントコーヒーはやっぱりゴールドブレンドと思っているので、お買い得でした
448,B074MWTKTR,ネスカフェ ゴールドブレンド エコ&システムパック 105g,ネスカフェ RSC,Amazon カスタマー,2020年4月4日,4.0,おすすめ,愛用してます
449,B074MWTKTR,ネスカフェ ゴールドブレンド エコ&システムパック 105g,ネスカフェ RSC,わこ,2019年5月16日,3.0,ビンのゴミが出ない事が良い。,個包装で使いやすいです。酸味が弱めで飲みやすいです
450,B074MWTKTR,ネスカフェ ゴールドブレンド エコ&システムパック 105g,ネスカフェ RSC,Amazon Customer,2020年12月10日,5.0,我が家の定番,丁度、バリスタ用のコーヒーが切れ困っていたところここに辿り着きました、手頃に買えて良かったです。
451,B074MWTKTR,ネスカフェ ゴールドブレンド エコ&システムパック 105g,ネスカフェ RSC,ぱん,2018年2月12日,4.0,個包装で使いやすい,おいしいし、お買い得でした！カフェオレで、毎日飲んでいます！
452,B074MWTKTR,ネスカフェ ゴールドブレンド エコ&システムパック 105g,ネスカフェ RSC,宮本,2020年10月19日,5.0,送料が掛からないのが魅力です。,カートリッジの代わりに、コスト削減、美味しい。
453,B074MWTKTR,ネスカフェ ゴールドブレンド エコ&システムパック 105g,ネスカフェ RSC,Amazon カスタマー,2020年4月8日,5.0,おいしい、詰め替え用で、お得,１本では薄くて、2本だと濃いです。
454,B074MWTKTR,ネスカフェ ゴールドブレンド エコ&システムパック 105g,ネスカフェ RSC,ヒキマ,2021年1月15日,5.0,カートリッジの代わりに,コーヒーはネスカフェゴールドに限る！
455,B074MWTKTR,ネスカフェ ゴールドブレンド エコ&システムパック 105g,ネスカフェ RSC,えみ,2018年11月19日,5.0,薄いです,スーパーで買うよりお買い得。他のコーヒーより香りが強くて、インスタントではこれしか飲めません。
456,B074MWTKTR,ネスカフェ ゴールドブレンド エコ&システムパック 105g,ネスカフェ RSC,匿名,2020年5月1日,5.0,ネスカフェゴールドブレンドはおいしい,欠かせないコーヒーが安価に買えて嬉しいです。
457,B074MWTKTR,ネスカフェ ゴールドブレンド エコ&システムパック 105g,ネスカフェ RSC,Amazon カスタマー,2020年1月12日,5.0,お気に入りの一つ,いつも美味しいコーヒーが飲めて満足しています。
458,B074MWTKTR,ネスカフェ ゴールドブレンド エコ&システムパック 105g,ネスカフェ RSC,Ku,2020年10月1日,4.0,欠かせない,酷が深くて美味しい
459,B074MWTKTR,ネスカフェ ゴールドブレンド エコ&システムパック 105g,ネスカフェ RSC,かなこ,2020年5月19日,5.0,軽量で出しやすくゴミ捨ても楽に出来る。,リピ買いです。
460,B074MWTKTR,ネスカフェ ゴールドブレンド エコ&システムパック 105g,ネスカフェ RSC,工藤直之,2020年8月4日,5.0,酷が良い,美味しくて気に入ってます重いので多少コスパ悪くてもAmazonで買うのは良いです
461,B074MWTKTR,ネスカフェ ゴールドブレンド エコ&システムパック 105g,ネスカフェ RSC,Amazon カスタマー,2020年2月29日,5.0,安定の味です。,インスタントコーヒーの中では少し高めの値段ですが、高齢の母が大好きなので重宝しています。
462,B074MWTKTR,ネスカフェ ゴールドブレンド エコ&システムパック 105g,ネスカフェ RSC,わたり,2018年8月14日,5.0,重いのでAmazonおすすめ,癖が無くて私の好みの味わいです。普段コーヒーを良くのみますが忙しい時に素早く飲めるので、かなり重宝しています
463,B074MWTKTR,ネスカフェ ゴールドブレンド エコ&システムパック 105g,ネスカフェ RSC,とんとん,2020年6月24日,5.0,美味しい,こくが深い！
464,B074MWTKTR,ネスカフェ ゴールドブレンド エコ&システムパック 105g,ネスカフェ RSC,MDY,2021年6月1日,3.0,幅広い年齢層に人気です。,インスタントですが、味に深みががあって美味しいです
465,B074MWTKTR,ネスカフェ ゴールドブレンド エコ&システムパック 105g,ネスカフェ RSC,ホクト,2018年12月31日,4.0,会社で使用,簡単にブラックコーヒーを愉しんでいます。ついつい飲む回数がおおくなりました。
466,B074MWTKTR,ネスカフェ ゴールドブレンド エコ&システムパック 105g,ネスカフェ RSC,a2,2019年7月9日,4.0,味に深みがあります,味香りともに良く、私ども夫婦二人で１ヶ月飲むに丁度適量です。これで定期購入が有ったら申し分無いのですが。
467,B074MWTKTR,ネスカフェ ゴールドブレンド エコ&システムパック 105g,ネスカフェ RSC,富士見,2020年12月25日,5.0,まあ、お値打ちですね,良いです！
468,B074MWTKTR,ネスカフェ ゴールドブレンド エコ&システムパック 105g,ネスカフェ RSC,Ｙ.Ｔ,2020年9月8日,4.0,１ヶ月夫婦二人で飲むに適量,芳醇な薫りがいっぺんに広がり、優雅な気分になります。普通のコーヒーには戻れない感じです。
469,B074MWTKTR,ネスカフェ ゴールドブレンド エコ&システムパック 105g,ネスカフェ RSC,山内絵美,2020年4月29日,5.0,買い得,ステイホームとなって消費量が半端ない。いつもの倍以上のスピードで注文したけど、すぐ届いた
470,B074MWTKTR,ネスカフェ ゴールドブレンド エコ&システムパック 105g,ネスカフェ RSC,ハリー,2020年3月2日,5.0,薫り豊か,よかった
471,B074MWTKTR,ネスカフェ ゴールドブレンド エコ&システムパック 105g,ネスカフェ RSC,新撰組,2020年3月22日,5.0,納期短縮御礼,ネスカフェは美味しい
472,B074MWTKTR,ネスカフェ ゴールドブレンド エコ&システムパック 105g,ネスカフェ RSC,なみ,2018年9月16日,5.0,さすがゴールドブレンド,量がちょうどよい
473,B074MWTKTR,ネスカフェ ゴールドブレンド エコ&システムパック 105g,ネスカフェ RSC,さったろう,2020年3月15日,5.0,こくがしっかり、落ち着ける,普段から飲んでいるのですが、定期便で買うとお得で楽なので助かってます！
474,B074MWTKTR,ネスカフェ ゴールドブレンド エコ&システムパック 105g,ネスカフェ RSC,333,2020年8月31日,4.0,定番です。,味美味い😋
475,B074MWTKTR,ネスカフェ ゴールドブレンド エコ&システムパック 105g,ネスカフェ RSC,ゆっきー,2020年12月4日,5.0,定期便でお得！,安く購入できてよかったです。
476,B074MWTKTR,ネスカフェ ゴールドブレンド エコ&システムパック 105g,ネスカフェ RSC,章ショウ,2019年5月10日,5.0,買ってよかった。,とにかく手軽。お湯を注ぐだけ、溶かし残りがないのが嬉しい。香りもよく、さすがゴールド！といった感じです。
477,B074MWTKTR,ネスカフェ ゴールドブレンド エコ&システムパック 105g,ネスカフェ RSC,尾道君代,2019年4月28日,5.0,定番商品なので,意外とブラックのスティックタイプって見つからなかったので、ありがたいです。たくさんあるので、おすそ分けもできます。
478,B074MWTKTR,ネスカフェ ゴールドブレンド エコ&システムパック 105g,ネスカフェ RSC,Miho,2018年12月24日,5.0,お手軽にコーヒーが飲める,手軽に飲めて美味しいです。ありがとうございました。
479,B074MWTKTR,ネスカフェ ゴールドブレンド エコ&システムパック 105g,ネスカフェ RSC,waka,2019年12月25日,5.0,美味しいです。,定期的に購入今回はセールで安くて助かりました
480,B074MWTKTR,ネスカフェ ゴールドブレンド エコ&システムパック 105g,ネスカフェ RSC,まりあママ,2019年11月6日,4.0,いつまでも新鮮,美味しく飲める適量が個包装になっているため簡単に美味しく飲める。
481,B074MWTKTR,ネスカフェ ゴールドブレンド エコ&システムパック 105g,ネスカフェ RSC,アサダ,2020年6月13日,5.0,毎朝飲んでます。,香りが良くて適度に苦みがあってラテで飲むには最高です。
482,B074MWTKTR,ネスカフェ ゴールドブレンド エコ&システムパック 105g,ネスカフェ RSC,マリリン,2019年1月9日,5.0,気軽に適量を美味しく飲める,美味しいし、簡単に１杯分が作れるので便利です。
483,B074MWTKTR,ネスカフェ ゴールドブレンド エコ&システムパック 105g,ネスカフェ RSC,わんわん,2020年5月11日,1.0,ラテで飲むには最高！,自分は飲んでないけど奥さんが好んで飲んでます。
484,B074MWTKTR,ネスカフェ ゴールドブレンド エコ&システムパック 105g,ネスカフェ RSC,Amazon カスタマー,2019年3月7日,5.0,便利！,手軽で裏切らない味！忙しい朝の強い味方。お気に入りです。
485,B074MWTKTR,ネスカフェ ゴールドブレンド エコ&システムパック 105g,ネスカフェ RSC,川越　俊彦,2020年10月27日,1.0,簡単,缶コーヒーよりまずい。これはどういうことか？
486,B074MWTKTR,ネスカフェ ゴールドブレンド エコ&システムパック 105g,ネスカフェ RSC,その他,2020年11月15日,5.0,インスタントの王様,これ以上のインスタントはない
487,B074MWTKTR,ネスカフェ ゴールドブレンド エコ&システムパック 105g,ネスカフェ RSC,Amazon カスタマー,2019年12月13日,5.0,缶コーヒーよりまずい,1箱に90本も入っているので、大容量でかなり楽しめます♪お湯を注ぐだけで簡単に作れて、とても美味しいです！
488,B074MWTKTR,ネスカフェ ゴールドブレンド エコ&システムパック 105g,ネスカフェ RSC,Amazonマニア,2019年8月22日,2.0,定期お得便で安く購入,自分が考えていた使い方と（飲み方）違った製品で困ってしまいました。いまだ箱に入ったまま・・・
489,B074MWTKTR,ネスカフェ ゴールドブレンド エコ&システムパック 105g,ネスカフェ RSC,jfk,2020年6月17日,3.0,インスタントの中では一番好き,詰め替えしにくい時がある
490,B074MWTKTR,ネスカフェ ゴールドブレンド エコ&システムパック 105g,ネスカフェ RSC,torakiti2013,2020年5月28日,5.0,使い方,酸味が無く、程よい苦味。私の定番です。
491,B074MWTKTR,ネスカフェ ゴールドブレンド エコ&システムパック 105g,ネスカフェ RSC,かお,2019年9月6日,4.0,詰め替え,レギュラー缶が安価で美味しい
492,B074MWTKTR,ネスカフェ ゴールドブレンド エコ&システムパック 105g,ネスカフェ RSC,くろ,2021年1月2日,4.0,私の定番です。,安心して、いつでも、飲める。
493,B074MWTKTR,ネスカフェ ゴールドブレンド エコ&システムパック 105g,ネスカフェ RSC,Amazon カスタマー,2020年5月4日,5.0,美味しい,🌟🌟🌟🌟🌟
494,B074MWTKTR,ネスカフェ ゴールドブレンド エコ&システムパック 105g,ネスカフェ RSC,Amazon カスタマー,2020年10月24日,5.0,安心,いつもこのコーヒーです。スティックは手軽で便利です。
495,B074MWTKTR,ネスカフェ ゴールドブレンド エコ&システムパック 105g,ネスカフェ RSC,趙　洪剣,2020年5月5日,5.0,🌟🌟🌟🌟🌟,いつも美味しく飲んでいます。何かと便利です。
496,B074MWTKTR,ネスカフェ ゴールドブレンド エコ&システムパック 105g,ネスカフェ RSC,阿部,2020年4月11日,2.0,手軽で美味しい,？
497,B074MWTKTR,ネスカフェ ゴールドブレンド エコ&システムパック 105g,ネスカフェ RSC,cocora,2019年12月24日,4.0,普通,毎日コーヒーを飲むので、とてもお買い得でした。機会があれば、また注文しようと思います。
498,B074MWTKTR,ネスカフェ ゴールドブレンド エコ&システムパック 105g,ネスカフェ RSC,ジュマ,2019年3月17日,4.0,？,必要な本数、スーパーと変わらない値段で購入できるので助かりました。常に購入できると助かります。ほかのタイプも購入出来るともっと嬉しいです。
499,B074MWTKTR,ネスカフェ ゴールドブレンド エコ&システムパック 105g,ネスカフェ RSC,ひろろ,2021年4月1日,3.0,毎日飲んでます。,特になし。
500,B074MWTKTR,ネスカフェ ゴールドブレンド エコ&システムパック 105g,ネスカフェ RSC,山内さかえ,2020年4月27日,5.0,日常的に飲んでいます。,インスタントとは思えないおいしさです。
501,B074MWTKTR,ネスカフェ ゴールドブレンド エコ&システムパック 105g,ネスカフェ RSC,sule,2020年3月4日,5.0,特になし,安定の味です。定期購入してます。少しお安く購入できるのもうれしいです。
502,B074MWTKTR,ネスカフェ ゴールドブレンド エコ&システムパック 105g,ネスカフェ RSC,ミッフィーちゃん,2019年9月26日,4.0,味,手軽で便利です。
503,B074MWTKTR,ネスカフェ ゴールドブレンド エコ&システムパック 105g,ネスカフェ RSC,ぴのすけ,2020年5月10日,4.0,定期購入で。,いつも変わらぬ美味しさに満足です
504,B074MWTKTR,ネスカフェ ゴールドブレンド エコ&システムパック 105g,ネスカフェ RSC,苛原和博,2018年8月27日,4.0,こくのある香り,いつも少し離れたスーパーで買うのですが、時間がなかったのでアマゾン購入しました。スーパーの特売が気持ち安いので☆4です。
505,B074MWTKTR,ネスカフェ ゴールドブレンド エコ&システムパック 105g,ネスカフェ RSC,Am͜a͉zon カスタマー,2021年5月3日,4.0,１回分のお値段,コヒーはおいしいです。
506,B074MWTKTR,ネスカフェ ゴールドブレンド エコ&システムパック 105g,ネスカフェ RSC,catlover,2019年5月16日,4.0,時間節約,携帯できて、何時でも飲みたい時にすぐ飲めるので、インスタントですが、いつも開けたての新鮮な香りが楽しめます。
507,B074MWTKTR,ネスカフェ ゴールドブレンド エコ&システムパック 105g,ネスカフェ RSC,森　広志,2020年3月9日,5.0,品物が早く到着しました。,いつ、飲んでも、おいしいです。
508,B074MWTKTR,ネスカフェ ゴールドブレンド エコ&システムパック 105g,ネスカフェ RSC,わさびくん,2021年4月4日,4.0,スティック,安価で購入出来ました。
509,B074MWTKTR,ネスカフェ ゴールドブレンド エコ&システムパック 105g,ネスカフェ RSC,はっちま,2020年2月21日,5.0,美味しさ。,毎日飲むものです。ふところを気にしないで楽しめる。これが最高。
510,B074MWTKTR,ネスカフェ ゴールドブレンド エコ&システムパック 105g,ネスカフェ RSC,好美,2018年2月13日,5.0,まとめ買い,ビニール剥がして、刺して、完了！とにかく手軽なのがいいです。味もまあまあ、、美味しい！
511,B074MWTKTR,ネスカフェ ゴールドブレンド エコ&システムパック 105g,ネスカフェ RSC,poppo,2020年3月5日,5.0,安くて美味しい,手軽にコーヒーが飲めるし味がいいから好きです。
512,B074MWTKTR,ネスカフェ ゴールドブレンド エコ&システムパック 105g,ネスカフェ RSC,智也,2019年11月17日,5.0,持ち運びが便利,美味しかった
513,B074MWTKTR,ネスカフェ ゴールドブレンド エコ&システムパック 105g,ネスカフェ RSC,Amazon カスタマー,2020年5月7日,5.0,お値打ちで買えたので次も期待します😊,Very good!
514,B074MWTKTR,ネスカフェ ゴールドブレンド エコ&システムパック 105g,ネスカフェ RSC,草野夏美,2020年11月18日,5.0,軽い,美味しいの一言
515,B074MWTKTR,ネスカフェ ゴールドブレンド エコ&システムパック 105g,ネスカフェ RSC,ALDOT,2020年8月31日,4.0,As expected,毎日のお好みタイムでの一服。
516,B074MWTKTR,ネスカフェ ゴールドブレンド エコ&システムパック 105g,ネスカフェ RSC,moco,2018年11月21日,5.0,いつもの味,インスタントコーヒーの中でこれが1番、105gのエコパックを月に2箱(210g)が1ヶ月無くなってしまいます(๑°ㅁ°๑)‼
517,B074MWTKTR,ネスカフェ ゴールドブレンド エコ&システムパック 105g,ネスカフェ RSC,矢ケ崎　輝彰,2019年4月12日,3.0,好みの味,まろやかな泡立ちがあり、ｺｰﾋｰ豆の香りが良いですね。又、価格の安く、毎日朝一の入れたてのコーヒーをの飲むのが楽しみです。
518,B074MWTKTR,ネスカフェ ゴールドブレンド エコ&システムパック 105g,ネスカフェ RSC,りおか,2020年1月15日,5.0,一番好き♥,贈り物です、毎回喜ばれております、これからもずっと続けるつもりです。
519,B074MWTKTR,ネスカフェ ゴールドブレンド エコ&システムパック 105g,ネスカフェ RSC,Amazon カスタマー,2021年2月2日,5.0,入れたて時の泡立ちと香りが良い,いつも美味しい。
520,B074MWTKTR,ネスカフェ ゴールドブレンド エコ&システムパック 105g,ネスカフェ RSC,Amazon カスタマー,2019年3月6日,1.0,普段から親しみ,定期の申し込みかたがわかりにくく、必要ないのに2つ申し込む羽目になった。
521,B074MWTKTR,ネスカフェ ゴールドブレンド エコ&システムパック 105g,ネスカフェ RSC,考えない人,2019年7月22日,4.0,謎,湿度の高い時期は瓶のコーヒーが固まってしまうので、この個包装が便利です。
522,B074MWTKTR,ネスカフェ ゴールドブレンド エコ&システムパック 105g,ネスカフェ RSC,武田　恭一,2019年6月25日,5.0,定期わかりにくい,習い事での一休みで飲むコーヒーはコップもスプーンも要らず飲んだ後の洗いものも無くて、とても手軽です。
523,B074MWTKTR,ネスカフェ ゴールドブレンド エコ&システムパック 105g,ネスカフェ RSC,Core,2020年12月26日,5.0,毎回新鮮,定番
524,B074MWTKTR,ネスカフェ ゴールドブレンド エコ&システムパック 105g,ネスカフェ RSC,S.ピッコロ,2020年1月5日,5.0,手軽,飲んだことない人は、ぜひお試しください
525,B074MWTKTR,ネスカフェ ゴールドブレンド エコ&システムパック 105g,ネスカフェ RSC,まるも,2019年12月26日,5.0,おいしい,安定した美味しさ！
526,B074MWTKTR,ネスカフェ ゴールドブレンド エコ&システムパック 105g,ネスカフェ RSC,Amazon Customer,2020年2月15日,5.0,美味しいです,お馴染みの味に満足しています。
527,B074MWTKTR,ネスカフェ ゴールドブレンド エコ&システムパック 105g,ネスカフェ RSC,Amazon カスタマー,2018年11月20日,5.0,美味い！,シリーズの中でも安くておいしいので気に入っています。バリスタはメンテが面倒だけど、それを超える美味しさと手軽さがあります。
528,B074MWTKTR,ネスカフェ ゴールドブレンド エコ&システムパック 105g,ネスカフェ RSC,Dangelyn,2019年1月16日,2.0,Good,他のインスタントに比べて高い！半額くらいならリピートするけどなぁ。
529,B074MWTKTR,ネスカフェ ゴールドブレンド エコ&システムパック 105g,ネスカフェ RSC,延原　順子,2019年12月12日,5.0,近くのスーパーより安い！,大変安く買いました
530,B074MWTKTR,ネスカフェ ゴールドブレンド エコ&システムパック 105g,ネスカフェ RSC,あらこ,2019年11月17日,5.0,高い！,👍👍👍
531,B074MWTKTR,ネスカフェ ゴールドブレンド エコ&システムパック 105g,ネスカフェ RSC,大島 実,2018年4月23日,5.0,値段が安い,安定の風味、美味しさ、手軽さにおいて常に国産コーヒー界のナンバーワンだと思います。
532,B074MWTKTR,ネスカフェ ゴールドブレンド エコ&システムパック 105g,ネスカフェ RSC,Tse,2020年1月19日,3.0,-,美味しい
533,B074MWTKTR,ネスカフェ ゴールドブレンド エコ&システムパック 105g,ネスカフェ RSC,Amazon カスタマー,2018年12月20日,1.0,松島玉三郎,なんじゃこりゃ、ぐっしゃり潰れて酷い！返品にかかる時間や労力も補償しなさいよ！
534,B074MWTKTR,ネスカフェ ゴールドブレンド エコ&システムパック 105g,ネスカフェ RSC,木下直人,2019年2月23日,4.0,予備に置いても良い,消耗品なので、定期お得便で購入。色々みたけどこれが1番安かった。
