,ASIN,product,brand,name,date,score,title,comment
168,B074MWTKTR,ネスカフェ ゴールドブレンド エコ&システムパック 105g,ネスカフェ RSC,びっき,2019年7月15日,3.0,手軽,コクはないですね。香りもしないですね。コーヒー豆をひいた場合とは比較してはいけないのでしょうけど、ストレスを緩和する重要な要素でもあります。なんとかならないのでしょうか？
169,B074MWTKTR,ネスカフェ ゴールドブレンド エコ&システムパック 105g,ネスカフェ RSC,n.t,2021年5月19日,5.0,ビンのものと大差なし,インスタントコーヒーの定番と合えばこれ。酸味が少なくて飲みやすい。
170,B074MWTKTR,ネスカフェ ゴールドブレンド エコ&システムパック 105g,ネスカフェ RSC,しゅんわ,2018年8月10日,4.0,"コクはないかなぁ。""(-""""-)""",インスタントコーヒーは、あまり頻繁に飲まないので、大きな瓶のだと酸化して黒っぽく変色している事があるのですが、これは小さいので、そうならないうちに飲みきれます。自分にはちょうど良いサイズです。
171,B074MWTKTR,ネスカフェ ゴールドブレンド エコ&システムパック 105g,ネスカフェ RSC,にゃん,2020年12月4日,2.0,コーヒーの王道,梱包が酷すぎます！中身が破れていたりはしていませんでしたが、箱は半分以上潰れて届きました。商品として販売している以上、ありえないと思います。味はいいのでリピートしていますが、次回も今回同様の梱包であれば画像をアップいたします。
172,B074MWTKTR,ネスカフェ ゴールドブレンド エコ&システムパック 105g,ネスカフェ RSC,はな,2019年7月1日,5.0,小さいのでいいです。,個包装になっているのでいつも新鮮、使いやすい。インスタントとは思えないおいしさです。
173,B074MWTKTR,ネスカフェ ゴールドブレンド エコ&システムパック 105g,ネスカフェ RSC,モリモリ,2019年1月27日,4.0,インスタントにしては味はいいのですが！,毎回決まった味を楽しめるので便利です。この商品自体は満点に近いです。きな粉、蜂蜜などを混ぜても美味しいです。ただ、本体に濃さを簡単に微調整できるダイヤル式のツマミがあれば良かったです。
174,B074MWTKTR,ネスカフェ ゴールドブレンド エコ&システムパック 105g,ネスカフェ RSC,T.A,2020年6月27日,5.0,持ち歩きに小さく便利、どこでもお湯さえあれば飲めます。,とても気に入ってます！定期便で買っているのでとてもお得ですし、無くなると困るので毎月届くよう設定してるので助かります。コーヒー飲むのにインスタトで美味しいコーヒー飲めるのがとても嬉しいです
175,B074MWTKTR,ネスカフェ ゴールドブレンド エコ&システムパック 105g,ネスカフェ RSC,小坂田雄一,2021年5月7日,5.0,本体も安くなってきたし買うなら今でしょ,毎日飽きずに飲み続けてます。
176,B074MWTKTR,ネスカフェ ゴールドブレンド エコ&システムパック 105g,ネスカフェ RSC,Amazon カスタマー,2020年4月4日,3.0,香りが凄く良い,標準的な味。テレワークが多くなりスーパーに行くのも外出自粛という事で今回からこちらで購入。
177,B074MWTKTR,ネスカフェ ゴールドブレンド エコ&システムパック 105g,ネスカフェ RSC,Amazon カスタマー,2020年3月6日,5.0,価格設定について,昔のものと比較すると劇的においしくなった商品ですが今回の様に、詰替よりお得な事も。
178,B074MWTKTR,ネスカフェ ゴールドブレンド エコ&システムパック 105g,ネスカフェ RSC,コバヤシ,2020年6月10日,3.0,標準的な味,手早く使える。毎日5杯ほど飲んでいる、バリスタ対応でそこそこの味色んな味を楽しむには、大き過ぎかな？
179,B074MWTKTR,ネスカフェ ゴールドブレンド エコ&システムパック 105g,ネスカフェ RSC,FRE,2020年11月7日,5.0,リニューアル後,今回は味を確かめるためにばら売りを購入。おいしかったです
180,B074MWTKTR,ネスカフェ ゴールドブレンド エコ&システムパック 105g,ネスカフェ RSC,上野清志,2019年1月25日,5.0,インスタントでは、まあまあ,便利です。毎日使ってます。来客が来た時など美味しいコーヒーを淹れることができるので。お値段以上。
181,B074MWTKTR,ネスカフェ ゴールドブレンド エコ&システムパック 105g,ネスカフェ RSC,購入感想,2020年12月7日,1.0,まとめ買いがお勧め,今までビニール包装して箱に入ってたのに今回から薄い段ボールにビニール包装なしで入っていた。3個も買ってるのに湿気で美味しく飲めなさそう。
182,B074MWTKTR,ネスカフェ ゴールドブレンド エコ&システムパック 105g,ネスカフェ RSC,ふるふるる,2019年5月21日,3.0,好きなものだからリピしてます,箱が開けやすく作ってあります。3ヶ月分はあります。普通に飲む分には十分ですが味としてはかも不可もないインスタントブラックという感じです。オフィス用とかに買うのにいいかもしれません。
183,B074MWTKTR,ネスカフェ ゴールドブレンド エコ&システムパック 105g,ネスカフェ RSC,しんちゃん,2021年3月7日,4.0,簡易包装,スーパーの最安値には負けるなー
184,B074MWTKTR,ネスカフェ ゴールドブレンド エコ&システムパック 105g,ネスカフェ RSC,moonbow,2020年11月24日,4.0,やっぱりゴールドブレンド,こればっかり飲んでます。　が…最近また高くなった？
185,B074MWTKTR,ネスカフェ ゴールドブレンド エコ&システムパック 105g,ネスカフェ RSC,jinteze,2020年1月6日,4.0,うーん・・・,１２０gなので安価で購入できました。通常スーパーでは８０gで６８０円ですからね。
186,B074MWTKTR,ネスカフェ ゴールドブレンド エコ&システムパック 105g,ネスカフェ RSC,ブーニャン,2020年4月12日,4.0,ずっとこれです,インスタントコーヒーは、色々試して見ましたが個人的には、ブラックで飲むには一番です。
187,B074MWTKTR,ネスカフェ ゴールドブレンド エコ&システムパック 105g,ネスカフェ RSC,カスタマーmk,2020年9月9日,3.0,いつもの味で美味しいです。,このコーヒーが美味しいと友人から聞いたので購入。実際に飲んでみると確かにコクがあって、かなり美味しいです。昼の休憩などにはピッタリの一品かと。ただ、値段の割に早く終わってしまう気がしました。この価格だったら、もうちょっと量があっても良いのかな～と。
188,B074MWTKTR,ネスカフェ ゴールドブレンド エコ&システムパック 105g,ネスカフェ RSC,Amazon カスタマー,2020年6月23日,5.0,ブラックコーヒーで毎日飲んでます。,詰め替えにとても便利です。私の使っているスーパーで買うより安いです。
189,B074MWTKTR,ネスカフェ ゴールドブレンド エコ&システムパック 105g,ネスカフェ RSC,町田智美,2020年12月5日,4.0,確かにうまいんだけど…,全部ではないがたまに酸味が強い時がある。これは豆なんだと思うが、味にかなりムラがあるのは残念。
190,B074MWTKTR,ネスカフェ ゴールドブレンド エコ&システムパック 105g,ネスカフェ RSC,SATOSHI,2021年5月15日,5.0,不満点はありません,お安く定期に届けていただき助かります。
191,B074MWTKTR,ネスカフェ ゴールドブレンド エコ&システムパック 105g,ネスカフェ RSC,たかし,2021年7月7日,3.0,新鮮なのはいい,味わいが変わった印象もう買わないかなあ？わからないけどね。
192,B074MWTKTR,ネスカフェ ゴールドブレンド エコ&システムパック 105g,ネスカフェ RSC,なべちゃん,2021年3月1日,4.0,味はグッド,インスタントでは、これ一択です!
193,B074MWTKTR,ネスカフェ ゴールドブレンド エコ&システムパック 105g,ネスカフェ RSC,inoki,2018年2月10日,5.0,kireinitodoita,パントリー限定ですが、とてつもなく安く買えたので10本まとめ買いしました。恐ろしいぐらい飲むので多分すぐなくなります。インスタントの中では1番好きな味わいです。空き瓶も10本出るけど、それも活用できそう。
194,B074MWTKTR,ネスカフェ ゴールドブレンド エコ&システムパック 105g,ネスカフェ RSC,福,2020年12月17日,5.0,美味しい,違いの分かる男になるためにかれこれ20年以上毎日飲んでます
195,B074MWTKTR,ネスカフェ ゴールドブレンド エコ&システムパック 105g,ネスカフェ RSC,ゆう,2020年6月4日,3.0,安かったのでまとめ買い,2gのスティックが使いやすい。ネスカフェだから、他社よりは、美味いと思います。
196,B074MWTKTR,ネスカフェ ゴールドブレンド エコ&システムパック 105g,ネスカフェ RSC,サクサク,2018年11月12日,4.0,ダバダーダバダーダー,インスタントコーヒーとしては美味しいコーヒーで我が家の定番です。お手頃価格で助かりました。
197,B074MWTKTR,ネスカフェ ゴールドブレンド エコ&システムパック 105g,ネスカフェ RSC,アマゾン ファン,2020年4月14日,5.0,使いやすい,こちらの瓶に詰替できました！おいしいです。定期便にしたのでお得に購入できました。
198,B074MWTKTR,ネスカフェ ゴールドブレンド エコ&システムパック 105g,ネスカフェ RSC,ラガーマン,2020年1月5日,5.0,我が家の定番,半額で購入しました。味はブレンディよりワンランク美味しいです。一杯分ずつ袋に入っているので使いやすいです。
199,B074MWTKTR,ネスカフェ ゴールドブレンド エコ&システムパック 105g,ネスカフェ RSC,黒ファイルくん,2020年8月25日,4.0,瓶に詰替できる。,乾燥した状態で飲めるので、大袋よりこちらが美味しく飲めます。
200,B074MWTKTR,ネスカフェ ゴールドブレンド エコ&システムパック 105g,ネスカフェ RSC,はるはる,2020年2月4日,5.0,安定のゴールドブレンド‼︎,早速お送りいただき有難うございました。手持ちのバリスタ用として、引き続き使用しております。
201,B074MWTKTR,ネスカフェ ゴールドブレンド エコ&システムパック 105g,ネスカフェ RSC,エスクー,2020年5月14日,5.0,美味しい,お店と同じくらいの値段だと思います。毎日飲んでます。開封するといい香りが漂います
202,B074MWTKTR,ネスカフェ ゴールドブレンド エコ&システムパック 105g,ネスカフェ RSC,長田健治,2020年4月13日,5.0,ネスカフェゴールドブレンド 105g,インスタントコーヒーの王道です。適度な酸味と風味。インスタントコーヒーではこれ以上は望めない。
203,B074MWTKTR,ネスカフェ ゴールドブレンド エコ&システムパック 105g,ネスカフェ RSC,よんよん,2020年1月9日,5.0,美味しいインスタントコーヒー,色々騙しましたが、この味が私の好みでした。コーヒーの味がしっかりしてレギュラーと比べても遜色ありません。
204,B074MWTKTR,ネスカフェ ゴールドブレンド エコ&システムパック 105g,ネスカフェ RSC,佐藤守,2019年9月8日,5.0,王道,バリスタにはコレって感じです。一番美味しい。といっても飲むのはカプチーノばかり（笑）定期便で安く購入出来るのでリピし続けます。
205,B074MWTKTR,ネスカフェ ゴールドブレンド エコ&システムパック 105g,ネスカフェ RSC,ちー,2018年2月26日,4.0,1番の好み,定期購入しているが、特に問題はないが、飲む頻度にもよるが、１か月間、二人で飲用すると足りなくなることが多い。
206,B074MWTKTR,ネスカフェ ゴールドブレンド エコ&システムパック 105g,ネスカフェ RSC,りるく。,2020年4月6日,5.0,好き,スティックになっており、毎回新鮮に香りの良い状態で飲める所がGOODです。瓶だとその時のさじ加減で濃さが変わり、早くなくなる時もあれば全然なくならない時があるなどバラバラですがこれなら一定した濃さになるので助かってます。少し割高感は否めないですがメリットを考えると買いです。
207,B074MWTKTR,ネスカフェ ゴールドブレンド エコ&システムパック 105g,ネスカフェ RSC,横浜の暇な老人,2019年6月8日,5.0,恒常的にに購入しているが、特に問題はない,大変美味しい、ステックコーヒーは、職場で好きな時間に時間お使わず、安心して飲んでいます、ネスカフェコーヒーは、大好きです、無くなったら、買います。
208,B074MWTKTR,ネスカフェ ゴールドブレンド エコ&システムパック 105g,ネスカフェ RSC,tcpip,2020年12月17日,5.0,手頃でお得,いつものお気に入りのコーヒーがお得に購入出来ました。
209,B074MWTKTR,ネスカフェ ゴールドブレンド エコ&システムパック 105g,ネスカフェ RSC,tumu,2020年4月29日,4.0,珈琲らしさがあります。,毎日入れているコーヒーなので味は、分かっているのですがついでに注文しました。
210,B074MWTKTR,ネスカフェ ゴールドブレンド エコ&システムパック 105g,ネスカフェ RSC,うずぴー,2019年12月29日,4.0,お気に入りです！,ゴールドブレンドが普通に美味しく感じられます。ブラックでも良いですが、ミルクと合わせても美味しく飲めます。
211,B074MWTKTR,ネスカフェ ゴールドブレンド エコ&システムパック 105g,ネスカフェ RSC,月灯り,2020年12月17日,5.0,毎日コーヒーを飲む方には、お勧めです。,私は以前よりネスカフェが好きで愛飲しているのですが、これまでは瓶入りを買っていました。しかし、最後のほうはいつも湿気てしまって困っていました。個包装だとその心配がなく助かっています。
212,B074MWTKTR,ネスカフェ ゴールドブレンド エコ&システムパック 105g,ネスカフェ RSC,H.N,2021年3月4日,5.0,ゴールドブレンドより良いコーヒーがないな,美味いです。
213,B074MWTKTR,ネスカフェ ゴールドブレンド エコ&システムパック 105g,ネスカフェ RSC,ミッフィーちゃん,2021年6月17日,4.0,1回分づつの個包装,なし
214,B074MWTKTR,ネスカフェ ゴールドブレンド エコ&システムパック 105g,ネスカフェ RSC,nakanaka,2020年4月16日,5.0,安定品,インスタントコーヒーはたまに飲みたくなる味です。特にゴールドは味も良く朝は便利なのでこれを使います。飽きが来なくて好きです。
215,B074MWTKTR,ネスカフェ ゴールドブレンド エコ&システムパック 105g,ネスカフェ RSC,Amazon カスタマー,2021年1月23日,4.0,なし,勤務先の親睦会で購入しました。
216,B074MWTKTR,ネスカフェ ゴールドブレンド エコ&システムパック 105g,ネスカフェ RSC,nana,2020年5月2日,4.0,価格も良かった,会社で使用するため、購入させて頂きました。2000円以上で送料無料になるため、3個、購入致しました。近くのスーパーよりお安かったです。お得に購入できました！
217,B074MWTKTR,ネスカフェ ゴールドブレンド エコ&システムパック 105g,ネスカフェ RSC,Wish,2019年8月23日,5.0,Good,マイマグに毎日二本持って行きます。タイムセール中だったので即買いしました。ちなみに私は瓶専門です。
218,B074MWTKTR,ネスカフェ ゴールドブレンド エコ&システムパック 105g,ネスカフェ RSC,天野 あゆ実,2020年4月29日,5.0,お買い得,何時も飲んでます。新商品が出て来たのでもう少し待てば良かったかな?このコーヒーは毎朝飲んでるので助かります。
219,B074MWTKTR,ネスカフェ ゴールドブレンド エコ&システムパック 105g,ネスカフェ RSC,西恵,2020年12月26日,3.0,旦那さん用,やっぱりお徳定番の味
220,B074MWTKTR,ネスカフェ ゴールドブレンド エコ&システムパック 105g,ネスカフェ RSC,ジロー。,2018年12月15日,4.0,何時もの購入品です。,会社で飲もうと購入しました。飲んでみて、普通に美味しいので満足です。安かったら即購入です。
221,B074MWTKTR,ネスカフェ ゴールドブレンド エコ&システムパック 105g,ネスカフェ RSC,上原健一,2021年1月10日,5.0,定番,非常においちい！
222,B074MWTKTR,ネスカフェ ゴールドブレンド エコ&システムパック 105g,ネスカフェ RSC,働きバチ,2019年11月14日,5.0,意外と美味しい,溶かすコーヒーなら結局ゴールドブレンドが1番美味しい！！他のメーカーのはまず飲めない。
223,B074MWTKTR,ネスカフェ ゴールドブレンド エコ&システムパック 105g,ネスカフェ RSC,トロンちゃん,2019年9月22日,4.0,おいちい,ついつい忘れてしまうので定期便コースの購入。溜まってしまったらお休みして、再開して…と言う感じでやっています
224,B074MWTKTR,ネスカフェ ゴールドブレンド エコ&システムパック 105g,ネスカフェ RSC,Amazonカスタマー,2018年4月15日,5.0,アマゾンは便利です。,バリスタを買ってから、コーヒーはネスカフェメインです。毎日使っています。
225,B074MWTKTR,ネスカフェ ゴールドブレンド エコ&システムパック 105g,ネスカフェ RSC,ロン,2019年3月4日,4.0,小分けにされていて常にフレッシュ,詰め替えとしては有能です。専用なのかわからないので…ある程度のボトルに対応してくれてると嬉しいんですけどね
226,B074MWTKTR,ネスカフェ ゴールドブレンド エコ&システムパック 105g,ネスカフェ RSC,ウナム,2020年4月21日,5.0,美味しいです,いろいろ試しましたが、昔からあるゴールドブレンドが一番好きです。
227,B074MWTKTR,ネスカフェ ゴールドブレンド エコ&システムパック 105g,ネスカフェ RSC,モッタコ,2019年7月23日,4.0,詰め替え,缶コーヒーは手軽に呑め割安感があったが、このところ急に値上がりした様に思う。ゴールドブレンドはインスタントコーヒーの中でも美味しく、以前はよく飲んでいた。スティック１本で一杯は缶コーヒーに比べお得感あり、で購入。ブックは好みがあり、自分的に普通に呑める一品。
228,B074MWTKTR,ネスカフェ ゴールドブレンド エコ&システムパック 105g,ネスカフェ RSC,ペリン,2021年6月22日,3.0,バリスタ用に,意外と美味しい。カフェインの感じは少ないけど、味はコーヒー☕️少し酸味のあるコーヒーかな！ゴミも少ないし朝とか便利！
229,B074MWTKTR,ネスカフェ ゴールドブレンド エコ&システムパック 105g,ネスカフェ RSC,Amazon カスタマー,2021年3月1日,4.0,缶コーヒーブラックから変更,私は飲みやすいです
230,B074MWTKTR,ネスカフェ ゴールドブレンド エコ&システムパック 105g,ネスカフェ RSC,八島元信,2019年1月24日,5.0,コーヒー美味い,バリスタで飲むようになってから、インスタントや缶コーヒーが飲めないくらい、お気に入りです！カフェラテが一番すきです。定期便利用で毎月3個は買ってます。
231,B074MWTKTR,ネスカフェ ゴールドブレンド エコ&システムパック 105g,ネスカフェ RSC,Amazon カスタマー,2019年2月24日,5.0,私自身には合います,ゴールドブレンドが中々安くならないので、少し安くなっているので、購入しました。もう少し
232,B074MWTKTR,ネスカフェ ゴールドブレンド エコ&システムパック 105g,ネスカフェ RSC,ひでお くん,2020年1月25日,5.0,まとめ買い,ゴールドブレンド愛用してかなり年数が経ちますが、相変わらずおいしいです。
233,B074MWTKTR,ネスカフェ ゴールドブレンド エコ&システムパック 105g,ネスカフェ RSC,宇宙神,2019年11月1日,5.0,香りがとても良い。,主人用のコーヒーで、すごく減るのが早いので、たくさん買いました。安く買えて良かったです。
234,B074MWTKTR,ネスカフェ ゴールドブレンド エコ&システムパック 105g,ネスカフェ RSC,N,2018年5月16日,5.0,タイムセールで購入したので文句のいいようがない,一人で使っていますが、市販のより大きいのでどうかな？湿気来ないかな？と思っていましたが、ちょうどひと月分になってまた今月定期便を待っています！味は普通に美味しいですね。
235,B074MWTKTR,ネスカフェ ゴールドブレンド エコ&システムパック 105g,ネスカフェ RSC,ビバちゃん,2021年1月15日,5.0,主人のお気に入りで、毎日飲んでます。,いい
236,B074MWTKTR,ネスカフェ ゴールドブレンド エコ&システムパック 105g,ネスカフェ RSC,TsukuTsuku,2018年11月4日,4.0,ちょうどひと月分でした！,友人へのプレゼントでしたが喜んでもらえました。価格が安いのもよかったです。
237,B074MWTKTR,ネスカフェ ゴールドブレンド エコ&システムパック 105g,ネスカフェ RSC,橋本,2020年1月26日,5.0,いい,安く購入できてよかった。お気に入りの物で、よく飲み、すぐ無くなるので120gはgood‼️
238,B074MWTKTR,ネスカフェ ゴールドブレンド エコ&システムパック 105g,ネスカフェ RSC,そら,2019年4月22日,4.0,喜んでもらえました。,バリスタに使用するのに購入してます。味はいつもの！です。安定感があります。値段は近所のお店より少し安価だったため、こちらで購入してます。
239,B074MWTKTR,ネスカフェ ゴールドブレンド エコ&システムパック 105g,ネスカフェ RSC,Amazon カスタマー,2019年9月22日,5.0,お買い得,今まで瓶の物を使用していましたが、こちらの方が美味しいです。手軽なので、忙しい朝に重宝しています。
240,B074MWTKTR,ネスカフェ ゴールドブレンド エコ&システムパック 105g,ネスカフェ RSC,cozy,2018年9月10日,5.0,美味しいです。,別のメーカーのコーヒーにしたら不味くて飲めたもんじゃありませんでした。これからもこれを飲み続けるでしょう。
241,B074MWTKTR,ネスカフェ ゴールドブレンド エコ&システムパック 105g,ネスカフェ RSC,Amazon カスタマー,2020年8月6日,5.0,薄かった,いつも瓶のを買っていましたが、こちらを一度購入したらスプーンいらずで便利だし、飲む前に封を開けるので新鮮な気がします。プラゴミが出てしまう点が残念です。
242,B074MWTKTR,ネスカフェ ゴールドブレンド エコ&システムパック 105g,ネスカフェ RSC,ボスカ,2021年4月11日,4.0,いつもの一杯,美味しくお買い得
243,B074MWTKTR,ネスカフェ ゴールドブレンド エコ&システムパック 105g,ネスカフェ RSC,Amazon カスタマー,2019年4月2日,4.0,便利,味が良く、朝食に毎日飲んでおります。ビン入りの粒状タイプより毎日新鮮に飲むことができ、良い製品とおもいます。唯一短所は、袋をopen箇所から開くのに力が要ります。もうちょっと楽に開けられるようにしてください。
244,B074MWTKTR,ネスカフェ ゴールドブレンド エコ&システムパック 105g,ネスカフェ RSC,ノアチャン,2021年5月28日,4.0,美味しい,商品の説明と共に賞味期限も書いて頂ければ、有難いです。お使い物として、人に差し上げたりする事もあるので、賞味期限が書かれていれば安心して購入できます。
245,B074MWTKTR,ネスカフェ ゴールドブレンド エコ&システムパック 105g,ネスカフェ RSC,幹ゆう,2020年8月4日,5.0,味が良い,インスタントコーヒーの中で、かなり香りとコクが良いので美味しいです。友人が愛用していたことが納得しています。
246,B074MWTKTR,ネスカフェ ゴールドブレンド エコ&システムパック 105g,ネスカフェ RSC,匿名希望,2020年10月6日,5.0,賞味期限,詰め替え用は、捨てるものが、紙だけなのでいい。これからもずっと、購入したい。
247,B074MWTKTR,ネスカフェ ゴールドブレンド エコ&システムパック 105g,ネスカフェ RSC,函館レディ,2020年5月17日,5.0,香りとコクが良い,美味しかったですよ。
