,ASIN,product,brand,name,date,score,title,comment
658,B074MWTKTR,ネスカフェ ゴールドブレンド エコ&システムパック 105g,ネスカフェ RSC,琥珀,2018年9月20日,4.0,安定のネスカフェ,レギュラーソリュブルという言葉は知りませんでした、飲み終わった後のカップにはほとんど残滓は残りませんでも、明らかに瓶のゴールドブレンドより飲んだ時の香りが良いですでも、香りで言っても朝のコーヒー、瓶の蓋を開けた時の香り が楽しめないのは 残念だな、とても好きなのに、、マグカップだと一度に二本入れないとわたしには薄いです
659,B074MWTKTR,ネスカフェ ゴールドブレンド エコ&システムパック 105g,ネスカフェ RSC,Amazonon,2020年11月4日,3.0,鮮度を保てる点が◎,特別美味しくはないですが、ちょっとコーヒーを飲みたい時に飲んでます。カフェ、コンビニ、ファストフードのコーヒーの方が美味しいです。缶コーヒーのブラックを買うなら、安いしこちらでいいかなというレベルです。
660,B074MWTKTR,ネスカフェ ゴールドブレンド エコ&システムパック 105g,ネスカフェ RSC,castro kondo,2019年2月23日,3.0,レギュラーソリュブルという言葉は知りませんでしたが、香りが改善してます,それにしてもリニューアルし過ぎじゃないですかね。でもまあ旧モデルよりもコーヒーの味わいがまして、美味しくはなってます。でも相変わらず豆カスをクレッセントとか言っちゃうあたりはどうでしょうかね。色んなタイプの味を出すよりも、豆カス無しのゴールドブレンドクラシックとか出しちゃて下さい。
661,B074MWTKTR,ネスカフェ ゴールドブレンド エコ&システムパック 105g,ネスカフェ RSC,ORIGA,2017年10月18日,5.0,コーヒーを安く飲みたい時に,コーヒーはブレンドしたほうが重なりが合って美味い一面があります。1日に何杯も飲んでしまい、消費は早い方だと思います。なので、お安いというのに魅力を感じます。味わいもネスカフェのゴールドブレンドなので、安心できます。淹れたての香りとコクが口の中に広がっていきます。本来はバリスタを使うのがいいと思います。
662,B074MWTKTR,ネスカフェ ゴールドブレンド エコ&システムパック 105g,ネスカフェ RSC,ランチム,2017年11月2日,5.0,2タイプ出すべき,普段、自宅でも会社でも専門店で買ったCOEの豆でコーヒーを飲んでいるため、インスタントコーヒーを長らく飲んでいませんでした。かなり久しぶりのインスタントコーヒーですが、ゴールドブレンドはなじみのある味と香りです。湯をいれたら香りがたつのは普通のコーヒーと同じでビックリしました。もちろん普段の豆との比較にはなりませんが、客人にさっと出すのも時間のないときや大勢のときにはいいかなと思えるレベルでした。
663,B074MWTKTR,ネスカフェ ゴールドブレンド エコ&システムパック 105g,ネスカフェ RSC,happybear0823,2017年10月7日,5.0,コーヒー好きです。,狐狸庵先生のダバダ～の頃から愛飲していますコマーシャルも幾年もの年月を重ねて幾分、存在感は薄れていますが製品の方は、どっこい進化、改良を重ね、未だにドリップコーヒーに負けず劣らずの味わいですとにかく雑味がなく、これがインスタントか！と思わせる風味は健在これほど値段に見合った製品も中々、ないだろうと思える逸品です。
664,B074MWTKTR,ネスカフェ ゴールドブレンド エコ&システムパック 105g,ネスカフェ RSC,旭,2021年1月13日,4.0,定番のコーヒーです。,レビューが良いし、安く売られていたので、もしかしたら、美味しいのではと、購入し、飲みましたが、今までのインスタント・コーヒーを同じように味で、がっかりしました。
665,B074MWTKTR,ネスカフェ ゴールドブレンド エコ&システムパック 105g,ネスカフェ RSC,Amn カスタマー,2021年6月5日,4.0,入れ替え方法がお洒落,味は安定の味だが、個人的には少し飽きているため、濃い版のも出して欲しい。いつでもどこでもおなじ量、おなじ味で飲めるのでそこは良い。たまにホテルでコーヒーの備え付けがないとこもあるので旅行時にはカバンに入れてます
666,B074MWTKTR,ネスカフェ ゴールドブレンド エコ&システムパック 105g,ネスカフェ RSC,眼ちゃん,2018年9月17日,5.0,レビューが良かったが、私には、合わない味！,コーヒー好きで色々と買いましたが、結局このコーヒーに戻るを繰り返し。まず洗練された香り、無糖でも加糖でもミルク抜きでも、ありでも美味しく飲める汎用性。顆粒で水にも溶けやすく、アイスにもしやすい。しかも本製品は、新製品の使いやすいスティックタイプ。余りにも偉大な製品。お勧めです。
667,B074MWTKTR,ネスカフェ ゴールドブレンド エコ&システムパック 105g,ネスカフェ RSC,ペンギン太郎,2018年12月18日,3.0,安定した味,バリスタとセットで購入しました。しかし、このバリスタ。音も振動もでかく、ジョバジョバ出すので、泡立ちが気になります。コーヒー自体の印象としては芯のある味。って感じはします。良い悪い、美味しい美味しくないではなく、個人的には好みではないです。
668,B074MWTKTR,ネスカフェ ゴールドブレンド エコ&システムパック 105g,ネスカフェ RSC,カスタマーM.T,2017年10月6日,4.0,原点にして頂点、これしかない。,普段はエクセラなので比較にはならないですが、アイスコーヒーやカフェオレで飲むにはエクセラで十分なのですがブラックで飲むとなにか物足りなさが。。香りも味もエクセラとは段違い。やっぱり美味しいです。常にゴールドブレンドを飲める身分になりたいものです。他にもいろいろ美味しいコーヒーはありますが安心の美味しさは変わらず健在です。
669,B074MWTKTR,ネスカフェ ゴールドブレンド エコ&システムパック 105g,ネスカフェ RSC,Amazonカスタム,2017年10月5日,4.0,バリスタ無しで飲みたい。,ゴールドブレンドのサイズ展開はこの間まで30、90、135gだったはず、こちらは120g。15g減量して、100gあたりの価格も下がったけれど、やはりセール時以外は送料込みの値段だなと思う。エコ&システムパック、いわゆる 詰替用 だと少しお得。おっと、詰換も110gから105gに変更されていた。味はコーヒー豆本来の、というか、はっきりとした酸味があるため好みが分かれるのは仕方がないと思う。私もこの味は嫌いではないが、香りがちょっと物足りない。ゴールドブレンド コク深め のほうが好き。苦味は増すが酸味はやわらぎ、味と香りが濃い。ミルクや豆乳で割って飲むのなら「コク深め」を勧めたい。ほか、実店舗では見かけない カフェイン抜き という選択肢もある。
670,B074MWTKTR,ネスカフェ ゴールドブレンド エコ&システムパック 105g,ネスカフェ RSC,さっぷ,2017年10月3日,4.0,安心の美味しさ,本商品で思い出すのは以前、隣の机にいた同僚が飲んでいたことですまるでドリップコーヒーのようないい香りだったので、ついつい何を飲んでいるのかきいてしまいました。それ以来、インスタントはほとんど本商品を愛飲しています。飲食物は香りが大事ということを認識させてくれた一品です。
671,B074MWTKTR,ネスカフェ ゴールドブレンド エコ&システムパック 105g,ネスカフェ RSC,echo,2017年10月23日,4.0,ゴールドブレンドは兄弟が多いね,コーヒー派で、自宅ではエスプレッソを飲みますが、会社では手軽なインスタントを飲んでいます。ずっと他社のものを飲んでいたのですが、久しぶりにゴールドブレンドを試してみました。微粉砕焙煎豆の粒がカップの底に残るのも、本格的で、味わいもよかったので暫くチェンジしてみようかな。エコシステムパック、画期的な詰め替えですが割高なのが非常に残念です。
672,B074MWTKTR,ネスカフェ ゴールドブレンド エコ&システムパック 105g,ネスカフェ RSC,じいく,2018年9月16日,5.0,ダマにならず、よく溶ける,「レギュラーソリュブルコーヒー」はボトルで買って普段から飲んでいます。レギュラーコーヒーとは違いますが、インスタントコーヒーともちょっと違う、別の飲み物として認識しています。それが、オフィスで１回づつ使えるスティックタイプで出たら、絶対使いたい。個包装なので味も特に良いように思いました。
673,B074MWTKTR,ネスカフェ ゴールドブレンド エコ&システムパック 105g,ネスカフェ RSC,人生の敗北者,2017年10月4日,4.0,香りが素晴らしい。,癖のないまろやかさと苦みでした。個人的にはもう少し癖があった方が良いなという印象。でも飲みやすいし、軽い感じで飲みたい気分の時には良いなと思いました。この手のインスタントコーヒーは、飲み終えた後、カップの下にお湯に溶けきれなかった粉が残っている事がありますが、こちらはそんな事はなかったので、その辺りも良かったです。
674,B074MWTKTR,ネスカフェ ゴールドブレンド エコ&システムパック 105g,ネスカフェ RSC,kawasemi,2018年10月6日,4.0,やっぱりおいしい「レギュラーソリュブルコーヒー」,お湯を注ぐだけで味も香りも良いコーヒーが飲めます。ネスカフェ独自の「挽き豆包み製法」で、コーヒー豆の酸化の原因となる空気に触れにくくしてあるそうです。良い香りが漂って、ポリフェノールの摂取でき、価格も控えめです。ネスレ日本の姫路工場で製造された安心の国産です。
675,B074MWTKTR,ネスカフェ ゴールドブレンド エコ&システムパック 105g,ネスカフェ RSC,CHRISTIE,2018年7月25日,5.0,飲みやすい,インスタントコーヒーは各社いろいろ販売されていますが、このゴールドブレンドが一番おいしいですね。自分の中では定番のコーヒーです。もともとレギュラーコーヒーを飲んでましたが、インスタントコーヒーでこのおいしさが出せるなら、手間とか総合的に考えた結果ゴールドブレンド派になりました。
676,B074MWTKTR,ネスカフェ ゴールドブレンド エコ&システムパック 105g,ネスカフェ RSC,旭,2021年2月26日,5.0,スティックコーヒーとは思えないほど良い香りです。,クーポン利用で半額でした！瓶入りのインスタントコーヒーと比べると、味、風味は雲泥の差。この値段で買えれば毎月欲しい。
677,B074MWTKTR,ネスカフェ ゴールドブレンド エコ&システムパック 105g,ネスカフェ RSC,りーり,2017年10月24日,4.0,定番のおいしさ！,インスタントコーヒーとしては香りも良くて、粉っぽさも少なくとてもおいしいですね。味については言うことないですね。こういうエコを考えたパックもとても好印象。コーヒーの詰め替え用は初めてでしたが容器も簡単に捨てれるしいいですねただ詰め替え用ならもうちょっとお得感もあったらいいのになとちょっとだけ思っちゃいました。
678,B074MWTKTR,ネスカフェ ゴールドブレンド エコ&システムパック 105g,ネスカフェ RSC,JUN☆≡,2017年11月18日,5.0,☆やはり個包装☆,最近のブレンドコーヒーはとても美味しいです。その場で焙煎して飲むのもいいですが、さっと作れるコーヒーも美味しい。特にマドラーステックなど使わずともお湯にさっと溶ける。ぬるま湯でも溶けるのはありがたい。ビンへの詰め替えも簡単な容器になっていて、入れ替え時に粉が巻き上がる心配もないところもGOOD
679,B074MWTKTR,ネスカフェ ゴールドブレンド エコ&システムパック 105g,ネスカフェ RSC,Tantan,2020年2月11日,1.0,インスタントとしては最上級！,この面白い詰替え容器のアイデアは最初感心した。でも冷静に考えると大して便利ではないし、内部の立体構造のせいで潰すのに力がいるし、捨てるときに紙とプラを分別するのが面倒。普通に袋で良いよ袋で。
680,B074MWTKTR,ネスカフェ ゴールドブレンド エコ&システムパック 105g,ネスカフェ RSC,とらやとら,2017年10月10日,3.0,美味しいコーヒー,作るのが簡単な上に濃さの調整がしやすいので自分はドリップよりインスタントのほうが好きです。本製品は良く言えばスッキリ風味、悪く言うとコクのない淡白な味です。苦味はやや強め。同容量の有名メーカー品が本品の3分の1程度の値段で買えますが、価格差ほどの違いは感じられませんでした。
681,B074MWTKTR,ネスカフェ ゴールドブレンド エコ&システムパック 105g,ネスカフェ RSC,カモノハシ,2021年2月19日,1.0,バリスタに,味がNESCAFE粉が底に残るMAXIM、Blendyの方が美味しいかも
682,B074MWTKTR,ネスカフェ ゴールドブレンド エコ&システムパック 105g,ネスカフェ RSC,センチネル,2020年5月6日,1.0,淡白な味わい,すごく臭いです。開封したばかりですが酸っぱくて焦げた嫌な匂いと、酸っぱい味で最悪です。苦味はマイルドなので酸味の強いコーヒーが好きな人はいいのかもしれませんがそれにしてもすっごく臭いです。★5レビューが多いのが不思議です。
683,B074MWTKTR,ネスカフェ ゴールドブレンド エコ&システムパック 105g,ネスカフェ RSC,スクラロース,2019年4月29日,5.0,NESCAFE,今まで瓶詰めのものを利用していましたが、酸化による酸味が気になっていたので、ちょっと高いですが、こちらにしてみました。小分けになっているので分量も気にすることなく飲め、味も良いです。
684,B074MWTKTR,ネスカフェ ゴールドブレンド エコ&システムパック 105g,ネスカフェ RSC,おみ,2021年6月10日,3.0,臭い,ほぼ一瓶飲んだところで強烈な片頭痛カフェインと砂糖の採りすぎは危険
685,B074MWTKTR,ネスカフェ ゴールドブレンド エコ&システムパック 105g,ネスカフェ RSC,Amazon カスタマー,2017年12月19日,5.0,よいです,今までコーヒー専門店で焙煎された豆を買って挽いて飲んでいましたが、だんだん面倒になってこちらに切り替えました。インスタントとしては、かなり美味しいと思います。粉砕されたコーヒー豆が入っているせいか、しっかりとコーヒーの風味とコクもあり、苦味や酸味はほどよく抑えられているので飲みやすいです。リピート間違いなしです。
686,B074MWTKTR,ネスカフェ ゴールドブレンド エコ&システムパック 105g,ネスカフェ RSC,Amazon カスタマー,2020年12月4日,4.0,飲みすぎ注意,アマゾンのセールで購入しましたので安かったです。商品に関しては安定の味と思います。
687,B074MWTKTR,ネスカフェ ゴールドブレンド エコ&システムパック 105g,ネスカフェ RSC,GoodAndGo,2018年9月6日,4.0,一番おいしいインスタント,しばらくインスタントコーヒーを飲まない間に、とんでもない進化を遂げていた。最初の1杯の衝撃がすごかった。山やキャンプ場でわざわざドリップするのはもうやめようとさえ思った。欠点は薄めにいれると酸味もコクも乗って来ないので濃い目で入れるしかない。
688,B074MWTKTR,ネスカフェ ゴールドブレンド エコ&システムパック 105g,ネスカフェ RSC,いいもの大好き,2020年6月11日,3.0,焙煎風味のインスタント・コーヒー,味はいいのですが、私の場合は外装に問題ありでした。ダンボールではなくグレーのビニール袋の包装で届き開封すると、中が見えるほど箱がベコベコに潰れていました。すぐ開封して中身は無事だったので返品はしませんが、店舗で売っていたら誰も買わないレベルです。私以外にも同じ状況の方がレビューしているので、当たりハズレがあるようです
689,B074MWTKTR,ネスカフェ ゴールドブレンド エコ&システムパック 105g,ネスカフェ RSC,りぃママ,2017年11月16日,5.0,オフィスに最適、気軽に手軽なコーヒータイム,インスタントコーヒー32杯分の瓶詰め替え用パックです。インスタントも風味と鮮度を重視する時代にあって、酸化を最小限に抑えるための小分けパックです。弾き豆をフレンドして、レギュラーコーヒーに一歩近づきました。定番のゴールドブレンドを美味しく飲めます。
690,B074MWTKTR,ネスカフェ ゴールドブレンド エコ&システムパック 105g,ネスカフェ RSC,みゅー,2017年10月8日,4.0,箱が潰れていた,インスタントの中ではやっぱり1番ですね。お値段もそれなりにしますが味にはかえられませんからね。ドリップが美味いのは分かっていますがゴールドブレンドはその辺のドリップコーヒーより美味いと思いますのでコーヒー好きにもオススメです。
691,B074MWTKTR,ネスカフェ ゴールドブレンド エコ&システムパック 105g,ネスカフェ RSC,いいもの大好き,2020年7月10日,4.0,定番のゴールドブレンドを美味しく飲める,軽さってなんの評価？セールで安かったから購入。小包装は使いやすい。味は普通。
692,B074MWTKTR,ネスカフェ ゴールドブレンド エコ&システムパック 105g,ネスカフェ RSC,Y's,2020年12月9日,5.0,インスタントの定番,こればかり飲んできて、他のを安いから…と、購入しましたが　美味しくなくて　放置。やはり、コレです！
693,B074MWTKTR,ネスカフェ ゴールドブレンド エコ&システムパック 105g,ネスカフェ RSC,ハテナ,2018年3月16日,3.0,セールなら買い！,インスタントコーヒーを飲むのは久々でしたが、この手軽さは捨てがたいところです。苦みはそこそこありますが全体的に味がちょっと薄いような感想です。ただ、お湯にかなりよく溶けてくれます。密封ケースなどに入れておくと使いやすいです。
694,B074MWTKTR,ネスカフェ ゴールドブレンド エコ&システムパック 105g,ネスカフェ RSC,美羽（みう）,2020年11月22日,4.0,美味しい。,個包装なので、一杯ずつ新鮮で香りがよい気がします。
695,B074MWTKTR,ネスカフェ ゴールドブレンド エコ&システムパック 105g,ネスカフェ RSC,Amazonカスタマー,2017年10月8日,5.0,ちょっと薄いかな,糖分のこともあり、コーヒーは普段はブラックを「健康維持」と割り切って飲んでいるのですが、こちらの商品はバニラ？のようなうっすらと甘い香りがしてコーヒー自体も他製品より苦くないのですんなり飲めます。ミルクをちょっと入れるのも合いますしいろいろな飲み方が出来る点も良いと思います。
696,B074MWTKTR,ネスカフェ ゴールドブレンド エコ&システムパック 105g,ネスカフェ RSC,Border Collie Lovers,2020年11月23日,5.0,インスタントのなかで一番おいしい,味についてはいつもリピートしているので、自分にとっては文句なし。今回、半額クーポン対象だったので、賞味期限が心配でしたが、2021年10月と一安心。良い買い物をしました♪
697,B074MWTKTR,ネスカフェ ゴールドブレンド エコ&システムパック 105g,ネスカフェ RSC,yanashi2,2018年3月3日,5.0,ネスカフェは香がいい！,物心付いたころから知っているコーヒー。子供のころは苦く感じたが今ではこれなしではやっていけない。毎日、１杯はこのコーヒーを飲むぐらい好き。バリスタと入れたコーヒーでは微妙に違う。飲みやすいコーヒーと思いますよ。
698,B074MWTKTR,ネスカフェ ゴールドブレンド エコ&システムパック 105g,ネスカフェ RSC,輝夜,2017年10月10日,5.0,良い買い物でした。,バリスタにも瓶の詰め替えにも対応できる紙容器に入った詰め替えのインスタントコーヒーです。上のフィルムを破ると、さらにフィルムがありますが、ズボッと挿すと「ネスカフェ ゴールドブレンド バリスタ」のコーヒーを入れるところにこぼさずに補充が出来たりコーヒーの瓶の詰め替えとしても、なかにあるジョウゴの形状をしたところが上手く作用し、ハサミを使うことなく、簡単に詰め替えができます♪２枚のフィルムを破いてしまえば、直径３．５センチくらいのジョウゴなのでおおよその瓶であれば入れることが出来ると思います。・・味には間違いないのですが、このシステムパックは紙で出来ているので賞味期限が短め（１年未満でした）なようでコンスタントに補充をしていくのがおススメです。瓶は２年くらい。他社のアルミパックは購入日から考えると１年半ほどかな？・・コンスタントな補充はエコ＆システムパック。特売のまとめ買いは瓶がおススメです。
699,B074MWTKTR,ネスカフェ ゴールドブレンド エコ&システムパック 105g,ネスカフェ RSC,秋風紅葉,2017年10月24日,5.0,親の影響で飲みだしたコーヒー,焙煎した香りがぷーんとして、リラックス効果があります。これがインスタントで実現できる、という点が画期的です。すっきりとしていて、かつコクがある感じで、粉からドリップでつくるものと比較の対象になるという点に、開発者による実験の繰り返しと工夫の数々が背後にkンジラれます。
700,B074MWTKTR,ネスカフェ ゴールドブレンド エコ&システムパック 105g,ネスカフェ RSC,るるるん,2017年10月26日,5.0,保存瓶やバリスタへ簡単に詰め替えが出来る。　コンスタントな補充がお勧め,やっぱり美味しいよ、ゴールドブレンドは。親が飲んでいたから自然とこれを飲むようになり早〇〇年。昔と比べると少し粉っぽく（飲んだ後）感じるが相変わらず美味しい。ブラックは本当においしい。詰め替えも簡単でそれが良いです。
701,B074MWTKTR,ネスカフェ ゴールドブレンド エコ&システムパック 105g,ネスカフェ RSC,afpeace,2018年3月18日,4.0,香りとリラックス効果がインスタントで,普段はネスカフェのエクセラを飲んでいるのですが、ゴールドブレンドは値段のせいか若干美味しく感じます。エクセラは容量が200ｇと大容量なので飲みきる前に香りが失われがちですがこっちは105ｇなのでフレッシュで飲みきれそうでいいですね。
702,B074MWTKTR,ネスカフェ ゴールドブレンド エコ&システムパック 105g,ネスカフェ RSC,秋風紅葉,2020年1月7日,5.0,常に飲むのはゴールドブレンド,何度もリピートするくらい気に入ってます。ビンのラベルも気持ち良いくらい剥がしやすいので捨てる時に楽。
703,B074MWTKTR,ネスカフェ ゴールドブレンド エコ&システムパック 105g,ネスカフェ RSC,ヘッド博士,2018年9月2日,4.0,定番の味,安定した味だと思います。あくまでインスタントはドリップとは違いますから比べられないと思います。混めに入れてミルクを投入していますが、逆にインスタント特有のコクを楽しんでいます。
