,ASIN,product,brand,name,date,score,title,comment
51,B075K318Y3,リプトン ヘルシースタイル ローズヒップ・オレンジティー ティーバッグ 10袋×6個,リプトン,人生の敗北者,2019年4月7日,5.0,お湯を注ぐ前からペパーミントの香り,ペパーミントティーにレモンの風味が少しプラスされた感じ。香りを特に楽しみたい場合は、ポットのお湯ではなく沸騰したてのお湯を使うことが推奨されています。ノンカフェインなので不眠で悩む高齢者にもオススメ。気を落ち着かせてリラックスしたいときにオススメです。結構ペパーミントの茶葉は高価なのでコスパはいいとおもいます。
52,B075K318Y3,リプトン ヘルシースタイル ローズヒップ・オレンジティー ティーバッグ 10袋×6個,リプトン,CHRISTIE,2019年3月7日,5.0,ペパーミントとレモンが絶妙な頃合いで融合している,カモミールが好きな方にはオレンジが結構主張しているので不満となるかもしれません。しかし、あまり道を究めない者にとっては、オレンジのおかげで、より飲みやすくなっていると思います。私的にはより落ち着きます。
53,B075K318Y3,リプトン ヘルシースタイル ローズヒップ・オレンジティー ティーバッグ 10袋×6個,リプトン,Kindleのお客様,2019年7月22日,5.0,リラックスできます,美味しかったです500mlの水筒に熱湯を入れ少しずつ飲みましたローズヒップティ特有の酸味があり癖になる味わいでしたオレンジの香りもさわやかでとても好きな味です
54,B075K318Y3,リプトン ヘルシースタイル ローズヒップ・オレンジティー ティーバッグ 10袋×6個,リプトン,人生の敗北者,2019年3月22日,3.0,カモミールよりも落ち着く感じが,ミントティーにちょっとレモン風味があるていどでした。ミントとしても、レモンとしても、刺激に欠けた、どても温和な飲み物でした。ポンパドールのモロカンとか、スパニッシュオレンジとかを愛飲していると、うーん、なんだかなぁ、色のわりに味わいがないなぁ、と不思議に思いました。
55,B075K318Y3,リプトン ヘルシースタイル ローズヒップ・オレンジティー ティーバッグ 10袋×6個,リプトン,三四郎子,2019年3月9日,3.0,酸味があるが飲みやすい味,購入されるときに気をつけてほしいのは、ミントティーだということ。そこにレモンの香り付がされています。なので、ミントティーが苦手という方にはオススメしない。
56,B075K318Y3,リプトン ヘルシースタイル ローズヒップ・オレンジティー ティーバッグ 10袋×6個,リプトン,あまチャン,2019年7月14日,4.0,夜のリラックスタイムに,お茶好きですが、チョコレートも好きだし、カフェイン摂りすぎかなと気になっていました。カフェインレスのお茶をメジャーブランドが扱ってくれるのはとってもありがたいです。オーガニック版の登場を望みます。
57,B075K318Y3,リプトン ヘルシースタイル ローズヒップ・オレンジティー ティーバッグ 10袋×6個,リプトン,+fine +,2019年3月7日,5.0,ハーブの香りがすっきりとしています。,味はカモミールでオレンジの香りがします。落ち着いたスタンダードなハーブティーという感じで、寝る前にちょっと温かいものが欲しいなってときにいいです。
58,B075K318Y3,リプトン ヘルシースタイル ローズヒップ・オレンジティー ティーバッグ 10袋×6個,リプトン,sunta13,2019年3月9日,5.0,カフェインレスがうれしい,カモミールだけでなくオレンジピールも入ってるのが良いです。ローズヒップ、ハイビスカスなども使われているせいか花ハーブオレンジティーな感じです。原材料に苦手な香りが入っていない人なら楽しめそうです。
59,B075K318Y3,リプトン ヘルシースタイル ローズヒップ・オレンジティー ティーバッグ 10袋×6個,リプトン,magre,2019年3月7日,5.0,カモミール単独が苦手な人に,ローズヒップにオレンジの香りがほんの少し良い感じでします。5パックが長期保存が可能なように包装されています。が、個装が紙ですので、早めに飲む必要があります。まあ5パックは1週間以内に飲みきれるでしょう。
60,B075K318Y3,リプトン ヘルシースタイル ローズヒップ・オレンジティー ティーバッグ 10袋×6個,リプトン,キュ子,2019年3月6日,5.0,オレンジ,非常に美味しい紅茶です。ペパーミントの香りと味わいが疲れた身体を癒してくれます。夜寝る前に一杯飲んでリラックスするのは至福のときだなと実感しました。さっぱりした味わいでとても美味しいです。
61,B075K318Y3,リプトン ヘルシースタイル ローズヒップ・オレンジティー ティーバッグ 10袋×6個,リプトン,人生の敗北者,2019年9月9日,4.0,爽やかなローズヒップ,お湯を注ぐと綺麗な色に広がります。味は好みがあるとはおもいますが、スッキリ爽やか系のティーが好きな方には好まれるかもしれません。お湯を注ぐだけで手軽に飲めます。
62,B075K318Y3,リプトン ヘルシースタイル ローズヒップ・オレンジティー ティーバッグ 10袋×6個,リプトン,アマゾンマン,2019年3月7日,4.0,リラックス出来ますよ！,マグカップ一杯分のお湯を注ぐとちょうど良い濃さに出来上がります。ローズヒップのすっぱさもオレンジ風味がうまく溶け合っています。
63,B075K318Y3,リプトン ヘルシースタイル ローズヒップ・オレンジティー ティーバッグ 10袋×6個,リプトン,こだわり消費さん,2019年3月13日,4.0,色がきれい,ローズヒップのくせがオレンジピールで和らいでおいしいハーブティーです。きれいなピンク色でほんのり酸っぱい（ローズヒップ由来）なのも気分がリフレッシュします。
64,B075K318Y3,リプトン ヘルシースタイル ローズヒップ・オレンジティー ティーバッグ 10袋×6個,リプトン,yoshi1972,2020年12月15日,5.0,寝る前のひと息に,寝付きが悪いためカモミールティーを寝る前に飲むようにしていますが、なんとなく、ほかのフレーバーが恋しくなりこちらを購入してみました。オレンジの香りが心地よく、味は少し酸味がありますが、そこまで気になる程ではありません。なんかおしゃれな味！と娘は言っています。おいしいです。
65,B075K318Y3,リプトン ヘルシースタイル ローズヒップ・オレンジティー ティーバッグ 10袋×6個,リプトン,らん,2021年5月7日,4.0,オレンジの香りが好きで、カップを紅茶サイズで飲む人に,オレンジの香りで飲みやすいですが、香料が入っているという事でもあるので気になる方にはオススメ出来ません。他のカモミールティー自体は最初は香りが独特でリラックス効果も感じられませんでしたが、暫く飲んでいると馴れて好きな香りになり落ち着く感じも得られました。
