,ASIN,product,brand,name,date,score,title,comment
0,B07N92TDFX,トワイニング アールグレイ セレクションファイブ 50P ティーバッグ,トワイニング,ふらい,2020年1月30日,1.0,アールグレイ尽くし,とってもいい香りです。ただ味がとっても薄いです。長めに抽出しても、パックを２つ入れてみてもあまり味がしません。。私の味覚がおかしいのかと思い、他の方にも飲んでもらいましたが、味がないと言われました。どのフレーバーも全てです。
1,B07N92TDFX,トワイニング アールグレイ セレクションファイブ 50P ティーバッグ,トワイニング,三色うさぎ,2019年11月3日,3.0,基本アールグレイ好きなら買って良し,昔から　トワイニングは　アールグレイが好きで　今は　レディグレイばかり飲んでいました！ジャスミンも好きだしオレンジアールグレイも好き～こんなにアールグレイの種類が沢山あるなんて　まさに私の為のセット？と思うくらいで購入しました！しかし流石に毎日飲んでいると飽きて来ました～(笑)　どれも気に入ったのですが　一種類だけ　カフェインレスのアールグレイは香水をぶちまけた？と思うぐらい香りがキツイです～いっそのこと　カフェインレスは無くして、その分オレンジアールグレイを増やして欲しいです!
2,B07N92TDFX,トワイニング アールグレイ セレクションファイブ 50P ティーバッグ,トワイニング,おんな,2021年1月16日,4.0,香り高いお湯,アールグレイが好きで普段からこちらのレディグレイを好んで飲んでいたので他の種類も選べて大容量な所にひかれて購入しました。ピーチアールグレイだけはピーチの香りが強くてアールグレイらしくないです。ピーチの香りが好きでアールグレイに拘らない人になら良いかも。個人的な好みですがその分だけ星マイナスしてます。他の種類は気に入ってます。
3,B07N92TDFX,トワイニング アールグレイ セレクションファイブ 50P ティーバッグ,トワイニング,匿名,2019年8月27日,4.0,カフェインレス以外は大好き！毎日　飲んでると飽きるけど～,色々なフレイバーのアールグレイが楽しめる。とくにジャスミンは初めて。香りに癒された。カフェインレスも入っていて、夜も楽しめる。（アールグレイ・レディグレイ・ジャスミンアールグレイ・オレンジアールグレイ・カフェインレスアールグレイ）
4,B07N92TDFX,トワイニング アールグレイ セレクションファイブ 50P ティーバッグ,トワイニング,a.,2020年4月4日,5.0,ピーチ以外は好き,2020年4月購入で、賞味期限は2023年1月でした。自分は温かい飲み物は、夏場は、ほとんど飲まないので、緑茶は賞味期限が短いので、この時期買うと、賞味期限内に、飲みきれない場合が、ありますが、紅茶は、その心配はまずありません。また、紅茶は茶葉を完全発酵させているので、体を温める効果もあります。冷え性でお悩みの方には、特におすすめです。
5,B07N92TDFX,トワイニング アールグレイ セレクションファイブ 50P ティーバッグ,トワイニング,Amazon カスタマー,2021年7月3日,5.0,アールグレイを堪能できる,値段の割に50パックもあるのでかなりお買い得だと思います。｢味がしない｣とレビューされていた方もいらっしゃいましたが、自分が購入したものはふつーに濃いの出てましたよ。こんなの2パックも入れたら喉痛くなると思います。基本的に買って満足した商品ではありますが、強いて言うならジャスミンのダージリンは人によってはあまり好みでないかもしれません。正直初めてコレを淹れたときは匂いの時点でビックリしました。ジャスミンティーがあまり身近でない人は少し慣れが必要かもです。自分は4パック目飲んだところで慣れました。以上です。
6,B07N92TDFX,トワイニング アールグレイ セレクションファイブ 50P ティーバッグ,トワイニング,パンダバ,2021年6月3日,5.0,賞味期限が長く、体を温める,紅茶好きのボクなので、ティーバッグは常備しています。この５０個パックは、５種類の味も楽しめて、とってもお得だと思います。そして、香り高いアールグレイなので、味は申し分ありません。皆さんにもおすすめします！！
7,B07N92TDFX,トワイニング アールグレイ セレクションファイブ 50P ティーバッグ,トワイニング,darasta,2021年7月2日,5.0,買って満足。安いのに安っぽくない味です。,兎に角いろんな種類があり飽きない。たくさん入っているから簡単に減らない。あたしは某マルコポーロが大好きですが、リプトンも大好きです。パッケージも華やかです。色もしっかり出ます。何個か入れてピッチャーで冷たいアイスティも良さそうです。ステイホームの辛さをお茶で緩和してます。
8,B07N92TDFX,トワイニング アールグレイ セレクションファイブ 50P ティーバッグ,トワイニング,pinknoviora,2021年5月18日,3.0,5種類のアールグレイが楽しめる。,レディグレイが好きで他の味も試したくて買ってみたが、結果的にフレーバーはなくていいかなという印象。王道のアールグレイとレディグレイは美味しいですが他はリピートしないです、、
9,B07N92TDFX,トワイニング アールグレイ セレクションファイブ 50P ティーバッグ,トワイニング,わにわにわ~るど,2019年10月21日,5.0,紅茶はトワイニング,アールグレイが好きなので購入しましたほんとは英国で販売されてるアロマセレクションが欲しいのですが全く売ってませんねこちらに期待しましたが同じような味は無かったですしかし気分に合わせて様々な味が楽しめてます。どれも美味しいですよ
10,B07N92TDFX,トワイニング アールグレイ セレクションファイブ 50P ティーバッグ,トワイニング,Miiiisa,2021年1月10日,4.0,王道の味のみでいい,レディグレイが目的で購入しましたが、他のお茶も初めて飲んだものもいくつかありましたが、風味が良く美味しかったので買って良かったと思います。ただ、少し味が薄めたな感じがしたので星4つにしました。5種類それぞれ単品での箱入り製品も扱ってもらえたら嬉しいです。
11,B07N92TDFX,トワイニング アールグレイ セレクションファイブ 50P ティーバッグ,トワイニング,jet,2019年7月28日,4.0,アールグレイ好きに,アールグレイは全般的に好きですが、ジャスミンはどうしても好きになれませんでした。ほかの4種はおいしくいただきましたが、結局ジャスミンだけは捨ててしまいました。今後は他の4種を単独で注文します。
12,B07N92TDFX,トワイニング アールグレイ セレクションファイブ 50P ティーバッグ,トワイニング,田中満寿江,2021年3月20日,5.0,買って良かったです。,安い割になかなか美味しいと思います。本当は銀座に買いに行きたいんですがコロナなので東京に行きたくないので仕方ない。中国は早く滅べ。
13,B07N92TDFX,トワイニング アールグレイ セレクションファイブ 50P ティーバッグ,トワイニング,通り雨,2020年4月17日,5.0,好き嫌いがあるのでやはり単品での注文にしました,アールグレイ好きにはたまらないアソートです。個人的にはジャスミンアールグレイが一番好みでした。色々な味が楽しめお得感もあります。近くの店舗にはない詰め合わせですのでまた購入したいと思います。
14,B07N92TDFX,トワイニング アールグレイ セレクションファイブ 50P ティーバッグ,トワイニング,ほえほえ,2020年5月10日,4.0,まあまあ。,アールグレイとレディグレイだけ個数が多い。ジャスミンとオレンジが美味しいので同じ個数にして欲しい。アールグレイばかり飲んでいて少し飽きてきました（笑）
15,B07N92TDFX,トワイニング アールグレイ セレクションファイブ 50P ティーバッグ,トワイニング,おかめ,2020年5月3日,5.0,珍しいアソート,味も値段も文句なし！アールグレイ好きな人へのギフトとしても喜ばれると思います。4つの味プラスノンカフェインのものも少しだけ入ってるので、どうしても夜飲みたくなったときなどには最適でした！
16,B07N92TDFX,トワイニング アールグレイ セレクションファイブ 50P ティーバッグ,トワイニング,Marc Comfort.,2021年1月29日,3.0,Fresh tasty quality teas.,フレーバー紅茶が好きな人にはオススメ！私はフレーバーものが得意ではないのに、何故か頼んでました（笑）でも、ピーチ以外は美味しく飲めます。
17,B07N92TDFX,トワイニング アールグレイ セレクションファイブ 50P ティーバッグ,トワイニング,Amazon カスタマー,2021年5月6日,5.0,色々な味が楽しめます！,有名ブランドの、有名シリーズ。もはや説明不要の”定番”です。
18,B07N92TDFX,トワイニング アールグレイ セレクションファイブ 50P ティーバッグ,トワイニング,ryotty,2020年2月27日,3.0,飽きずに飲みるのでオススメ,いつもきちんと紅茶の箱が壊れない様に気遣って頂いていたのに、今回開けてビックリしました。段ボールに直接入っていて、箱が変形してました。食品ですよ❗梱包にがっかり😞💨
19,B07N92TDFX,トワイニング アールグレイ セレクションファイブ 50P ティーバッグ,トワイニング,エヴァン コルテス,2021年5月18日,4.0,定番,色々フレーバーを楽しめて良いです。お味は普通かな。
20,B07N92TDFX,トワイニング アールグレイ セレクションファイブ 50P ティーバッグ,トワイニング,マリ,2020年8月17日,5.0,梱包にがっかりです,期待していた想像通りの味、風味でした
21,B07N92TDFX,トワイニング アールグレイ セレクションファイブ 50P ティーバッグ,トワイニング,プアケニケニ,2020年9月3日,5.0,楽しめます,コロナで外出できないので、ネットで購入。早く届き、品質も問題なかったです。
22,B07N92TDFX,トワイニング アールグレイ セレクションファイブ 50P ティーバッグ,トワイニング,Amazon カスタマー,2020年7月12日,5.0,最高！,スーパーとかではあまり売ってない香りが入っていて。良かったです。美味しい。ギフトにするにはちょっと手軽すぎるかも。紅茶好きは喜びますよ。
23,B07N92TDFX,トワイニング アールグレイ セレクションファイブ 50P ティーバッグ,トワイニング,gibs,2020年6月26日,4.0,問題なし,中々、美味しいとは思いますが、種類には苦手なのも半分あり、贈答品には慎重にならざるを負えません。
24,B07N92TDFX,トワイニング アールグレイ セレクションファイブ 50P ティーバッグ,トワイニング,茶々太郎,2020年10月23日,5.0,見た目大事。,こんな紅茶のバラエティパックを探してました！職場用に用意しましたが、皆さん満足されています。
25,B07N92TDFX,トワイニング アールグレイ セレクションファイブ 50P ティーバッグ,トワイニング,swarovski,2019年4月2日,4.0,ティーラテにしてみて！！最高です,Excellent for lovers of Earl Grey. Delicious blends.
26,B07N92TDFX,トワイニング アールグレイ セレクションファイブ 50P ティーバッグ,トワイニング,にゃー,2021年2月22日,5.0,柑橘系は元気になれます！,安定の美味しさです。バライティーに富んでいて最後まで飽きないです。
27,B07N92TDFX,トワイニング アールグレイ セレクションファイブ 50P ティーバッグ,トワイニング,Patrice Takayama,2020年5月18日,5.0,Great Grey,いっぱい入っていますし、お値段も手頃で満足です。値段を気にせず飲めます。味も特に不満はないです。
28,B07N92TDFX,トワイニング アールグレイ セレクションファイブ 50P ティーバッグ,トワイニング,Amazon カスタマー,2019年4月24日,5.0,リピしたい,can have a different tea with different mood!
29,B07N92TDFX,トワイニング アールグレイ セレクションファイブ 50P ティーバッグ,トワイニング,シーフードヌードル,2019年8月16日,5.0,コスパは良い,アールグレイ好きにはオススメしたい品。
30,B07N92TDFX,トワイニング アールグレイ セレクションファイブ 50P ティーバッグ,トワイニング,csc0130,2020年6月5日,5.0,good collection!,その日の気分でお茶の香りを選べるのでよかったです！ジャスミンアールグレイが気に入りました。良い香り。
31,B07N92TDFX,トワイニング アールグレイ セレクションファイブ 50P ティーバッグ,トワイニング,Amazon カスタマー,2019年9月11日,5.0,どれも美味しい!!,ふだん飲まないフレーバーもありましたがおいしくいただきました。リピートしたいですね。
32,B07N92TDFX,トワイニング アールグレイ セレクションファイブ 50P ティーバッグ,トワイニング,村岡修一,2019年7月30日,5.0,お買い得です。,近くのスーパーなどではアールグレイだけで、大容量のこのタイプはないので非常に気に入ってます。夏場はアイスティーにしたり、その日の気分でフレーバーを変えれるのが嬉しいです。
33,B07N92TDFX,トワイニング アールグレイ セレクションファイブ 50P ティーバッグ,トワイニング,堀七代目磯左衛門,2019年5月16日,5.0,アールグレイの美味しさ、再発見!,アールグレイが大好きです！ミントン社製のバラエティパックを愛飲してましたが、アールグレイだけのが欲しかったので、嬉しいです、ノンカフェインはもっと欲しいです。
34,B07N92TDFX,トワイニング アールグレイ セレクションファイブ 50P ティーバッグ,トワイニング,ボーま,2020年3月3日,4.0,アールグレイ好きにはおすすめ,前から気にしていた！
35,B07N92TDFX,トワイニング アールグレイ セレクションファイブ 50P ティーバッグ,トワイニング,Amazon カスタマー,2019年8月30日,5.0,とても良いです！,これから寒くなる季節、一足早めに紅茶を飲みたいと思って購入しました。一番好きなのはアールグレイ。香りも風味も自分好みでした。昔別の紅茶で合わなかったのがジャスミンなんですが、こちらのは合いました。リラックスしたい夜に飲んでいます。
36,B07N92TDFX,トワイニング アールグレイ セレクションファイブ 50P ティーバッグ,トワイニング,はたあき,2020年10月23日,1.0,色々入って楽しめた,自家消費ですが、満足しています。なくなり次第再注文する予定です。
37,B07N92TDFX,トワイニング アールグレイ セレクションファイブ 50P ティーバッグ,トワイニング,きくちれいな,2019年8月19日,1.0,リラックスしたい夜に。,本来の紅茶にそれぞれのテイストを加味してありますが、自分には人工的に加工注入した味に思えて、なじめませんでした。
38,B07N92TDFX,トワイニング アールグレイ セレクションファイブ 50P ティーバッグ,トワイニング,英ちゃん,2019年10月13日,5.0,安いことでしょうか。,アールグレイを楽しめるセットです。
39,B07N92TDFX,トワイニング アールグレイ セレクションファイブ 50P ティーバッグ,トワイニング,ダンディ,2021年1月20日,4.0,味が私に合わない,いれたときに立ち上がる香りが新鮮さの証でしょうか。この香りで目覚め、今日も１日頑張ろうと元気をもらっています。
40,B07N92TDFX,トワイニング アールグレイ セレクションファイブ 50P ティーバッグ,トワイニング,N,2020年9月12日,5.0,色んなアールグレイが楽しめていい,色んなタイプのアールグレイが試せて、楽しくて美味しいです。水出しのアイスティーにしてもとても美味しかったです。
41,B07N92TDFX,トワイニング アールグレイ セレクションファイブ 50P ティーバッグ,トワイニング,Amazon カスタマー,2020年8月18日,4.0,香りのついたお湯,選ぶ楽しみがあって好きです。ジャスミンとアールグレイの組み合わせは新鮮で、意外にも相性が良く、おいしいと思います。
42,B07N92TDFX,トワイニング アールグレイ セレクションファイブ 50P ティーバッグ,トワイニング,kirakirara,2020年5月27日,4.0,美味しいです。,色々な紅茶を楽しめるアップ味　ピーチ味なども入っていたらもっと良い
43,B07N92TDFX,トワイニング アールグレイ セレクションファイブ 50P ティーバッグ,トワイニング,あらびき,2019年12月27日,4.0,どの味もすき,アールグレイばかりの詰め合わせが中々売ってなくて重宝してます。私の希望ですがもう少し濃く出ればいいなぁと思います
44,B07N92TDFX,トワイニング アールグレイ セレクションファイブ 50P ティーバッグ,トワイニング,Amazon カスタマー,2020年8月16日,5.0,色々な紅茶が楽しめる,商品自体はとってもよい！香りもよく美味しい！しかし、箱が少し潰れていた。プレゼント向けではないかな？と思った。
45,B07N92TDFX,トワイニング アールグレイ セレクションファイブ 50P ティーバッグ,トワイニング,猫のママ,2021年3月6日,3.0,アールグレイ大好き,美味しいものと好みの味じゃ無いものがあった
46,B07N92TDFX,トワイニング アールグレイ セレクションファイブ 50P ティーバッグ,トワイニング,本間,2021年3月22日,5.0,商品自体はよい！,香りは個人にわかれると思いますが、ほのかに違います。
47,B07N92TDFX,トワイニング アールグレイ セレクションファイブ 50P ティーバッグ,トワイニング,Amazon カスタマー,2020年1月16日,2.0,まあまあ？,50パック入りの半分くらい使用時点で2つめの茶葉漏れ。ティーパックでこれはちょっと…。近所では売っていないフレーバーも有り、味も普通でしたがリピートは無いですね。
48,B07N92TDFX,トワイニング アールグレイ セレクションファイブ 50P ティーバッグ,トワイニング,ioa,2020年5月24日,4.0,さわやか,アールグレイ好きにはたまらないアソートパックです！
49,B07N92TDFX,トワイニング アールグレイ セレクションファイブ 50P ティーバッグ,トワイニング,Amazon カスタマー,2020年10月1日,4.0,香りがとても良かった！,色んな味が楽しめる。
50,B07N92TDFX,トワイニング アールグレイ セレクションファイブ 50P ティーバッグ,トワイニング,紺碧,2019年7月18日,5.0,いいとこどり,大好きなアールグレイのいろいろな味を楽しめて良かったです
51,B07N92TDFX,トワイニング アールグレイ セレクションファイブ 50P ティーバッグ,トワイニング,東照代,2020年4月18日,5.0,美味しい。,早く届きました！安定の美味しさです。
52,B07N92TDFX,トワイニング アールグレイ セレクションファイブ 50P ティーバッグ,トワイニング,HATO,2019年7月5日,5.0,アールグレイがいろいろ楽しめます,Good
53,B07N92TDFX,トワイニング アールグレイ セレクションファイブ 50P ティーバッグ,トワイニング,Amazon カスタマー,2019年6月8日,5.0,いい香り,アールグレイ（ベース）の紅茶が10パック×5種類！これはアールグレイ好きにはたまりません。すべて個包装されていますので保管もしやすいです。以下、それぞれの味のレビューを簡単にかきます。アールグレイ…このセットの基本の味。ベルガモットの香りがちょうどいいです。カフェインレスアールグレイ…ノーマルのアールグレイとほとんど味は変わりません。カフェインを摂りたくない寝る前などはこちらのほうがいいと思います。レディ・グレイ…人によってはアールグレイよりも飲みやすい風味だと思います。ジャスミンアールグレイ…アールグレイにジャスミンの香りがプラスされたような感じです。心が落ち着きます。オレンジアールグレイ…こちらはオレンジフレーバーティーにアールグレイの香りがプラスされたような感じです。オレンジの香りのほうが強いです。
54,B07N92TDFX,トワイニング アールグレイ セレクションファイブ 50P ティーバッグ,トワイニング,Amazon カスタマー,2019年6月6日,4.0,Good,アールグレイが5種楽しめます（普通のアールグレイ、ディカフェのアールグレイ、レディグレイ、オレンジアールグレイ、ジャスミンアールグレイ）普通のアールグレイ、レディグレイは愛飲していましたが、他の3つは初めて。結論からすると、今後はこれまで常備していたアールグレイ、レディグレイ、そして今回初めて飲んだディカフェアールグレイは単品でリピートしたいと思います。残念ながらオレンジアールグレイ、ジャスミンアールグレイが好みに合わなかったのですが、こういったアソートタイプは、いろいろ試せるのがいいところ。自分の気に入ったものを探すにもいいパックだなと思いました。＝＝＝＝＝＝＝＝＝＝＝＝＝＝＝＝＝＝＝ジャスミンアールグレイはせっかくのベルガモットの香りもジャスミンの香りも相殺されるのか、私には中途半端な味に感じ合いませんでした。オレンジアールグレイは、レディグレイがオレンジとレモンの果皮を加えてあるのに比し、オレンジの香りがつけてあるものでちょっと人工的な風味。レディグレイのほうが自然なかんきつの香りでおいしいなあと思いました。ディカフェアールグレイは、多少紅茶の風味は普通版より落ちますが、夜でもカフェインを気にせず飲めるのがうれしいです。
55,B07N92TDFX,トワイニング アールグレイ セレクションファイブ 50P ティーバッグ,トワイニング,BS,2019年6月13日,4.0,アールグレイ好きにはたまらない,アールグレイ×15、カフェインレスアールグレイ×5、レディグレイ×10、ジャスミンアールグレイ×10、オレンジアールグレイ×10で合計50個のティーバッグが入っています。アールグレイ好きには嬉しいアソートセットですね。紅茶の国・英国の王室御用達であるトワイニングだけに、味・香りともに安定の美味しさです。それぞれのティーバッグに適した蒸らし時間の目安が書かれていたり、各種のお茶の特徴とストレート・ミルク・アイス、どの飲み方が合うかのアドバイスも添えられているのが初心者にも親切。このパッケージ中で未知のものはジャスミンアールグレイとオレンジアールグレイのふたつでしたが、どちらも美味しくいただけました。ジャスミンはホッと安らげるハーブティーとして、オレンジは柑橘の爽やかさにオレンジの甘いアロマが加わったリフレッシュティーとして、それぞれ魅力的。こういうアソートで試して、気に入れば単品をまた購入する感じにすれば便利ですよね。様々に趣向を凝らしたアールグレイをその時の気分次第で選ぶのも楽しかった。おすすめです♪
