,ASIN,product,brand,name,date,score,title,comment
56,B07N92TDFX,トワイニング アールグレイ セレクションファイブ 50P ティーバッグ,トワイニング,amazonカスタマー,2019年6月23日,4.0,5つアールグレイの香りとフレーバーが楽しめるお得なセット,紅茶の中ではアールグレイが一番好きなので、そのアールグレイを5種類楽しめるこちらの商品は企画としてはとても嬉しいものです。中でも、以前飲んだことのある「レディグレイ」は実際にオレンジピールやレモンピールが入っていて、香りも良くリッチな味わいでとても気に入っています。その他の4種は香料のみです。でも「オレンジグレイ」はほんのりとしたオレンジの香りが楽しめてgoodでした。「ジャスミングレイ」はさほどジャスミン感を感じずちょっと薄いかなと思いました。パッケージの彩りも華やかで、アールグレイファンの女性は多いと思うので、ちょっとしたお礼用の贈り物などには使えそうだな、と思います。
57,B07N92TDFX,トワイニング アールグレイ セレクションファイブ 50P ティーバッグ,トワイニング,DUNE,2019年6月3日,5.0,カフェインレスが健闘,当商品は、トワイニング紅茶の５種類のアールグレイセットです。定評のあるトワイニングの香りのよいアールグレイがお手軽に楽しめます。カフェインレスを含めた５種のアールグレイから、好みのものを選ぶのに最適かと思われます。当方は、レディ・グレイと，オレンジが気に入りました。ティーバック一包ずつ密閉包装されていて、香りの風味が損なわれ難くなっているのは中々良いと思います。また抽出時間が一包ずつ書かれていて，分かり易くて良いです。賞味期限は、2022年1月(2019年6月上旬モニタ)となっており，二年半ほどありました。
58,B07N92TDFX,トワイニング アールグレイ セレクションファイブ 50P ティーバッグ,トワイニング,lily-rose,2019年8月15日,4.0,5種類のアールグレイが楽しめるのが嬉しい,ベルガモットの力強いながらも品のある香りが大好きで、紅茶があるならアールグレイを選ぶ私です。レディグレイもアールグレイしか知らない人には是非飲んでみてもらいたいですね。ただ、個人的にジャスミンアールグレイはダメでした。飲めないことはないのですが…子供のころの入浴剤がジャスミンだったこともありジャスミンが入った飲み物が全部お風呂のお湯に思えるのです……。オレンジとノンカフェインも楽しめましたが、やっぱり基本のアールグレイかレディグレイのみのパックにしようと思います。
59,B07N92TDFX,トワイニング アールグレイ セレクションファイブ 50P ティーバッグ,トワイニング,大久保彦左衛門,2019年6月4日,5.0,アールグレイお試しセット。密閉包装で風味そのまま,ティーパックですが全体的に香り豊かで流石トワニングのアールグレイといった印象。アールグレイは個人的に大好きですが、セレクトされた５種だけでもかなり違いがあるので自分好みの一品を見つけるのにも良いと思います。デカフェのアールグレイも入っています。紅茶のデカフェは香り的にどうしてもやや弱くなる印象でしたがこのアールグレイのカフェインレスパックはアールグレイ特有の柑橘系の爽やかな香りがしっかりあるのでデカフェのデメリットが感じにくくとても良いと思います。
60,B07N92TDFX,トワイニング アールグレイ セレクションファイブ 50P ティーバッグ,トワイニング,Amazonカスタマー,2019年6月7日,3.0,アールグレイ好きにおすすめ,紅茶のティーバッグです。オレンジやレモンなど紅茶に後から香りをつけています。それらの香りは十分するのですが、問題は紅茶本来の香りや味が薄いです。紅茶のティーバッグとしては AHMAD TEA ( アーマッドティー ) アールグレイ ティーバッグ 100袋入り [ 英国ブランド 個包装 ] のほうが紅茶らしいです。
61,B07N92TDFX,トワイニング アールグレイ セレクションファイブ 50P ティーバッグ,トワイニング,御茶ノ水303,2019年6月10日,5.0,アールグレイだけで５種のショーケース的セレクション,アールグレイの玉手箱。最近リタイアして、10時のおやつの時間に毎日紅茶を飲むようになりました。フレーバー系の紅茶には苦手苦手意識がありました。しかしこのセットに出会って、ストレート、アイスティー、ミルクティーなど適切な飲み方と、抽出時間を知ることでその美味しさに気づくことが出来ました。5袋入っているカフェインレスは、夜でも楽しむことができます。
62,B07N92TDFX,トワイニング アールグレイ セレクションファイブ 50P ティーバッグ,トワイニング,Do217,2019年6月12日,4.0,オレンジやレモンの香りは良い,アールグレイが大好きなので、とても嬉しいセットです。全部で５種類のあールグレイが楽しめます。レディ・グレイとオレンジアールグレイはどう違うのか、飲み比べしたり、カフェインレスの紅茶は初めてなので、興味深くいただいています。ただ、この商品に限らず、最近のトワイニングはどうも淹れると香りが飛んでしまうような気がします。そこだけが残念です。
63,B07N92TDFX,トワイニング アールグレイ セレクションファイブ 50P ティーバッグ,トワイニング,sin1,2019年12月16日,5.0,フレーバーティーが好きになる,オフィスでみんなが無料で飲めるために置くとなるとコストの問題であまり高いものは置けないと思いますが、これがちょうどいい感じだと思います最安値につられてリ◯トンの黄色いやつにする場合が多いと思いますが、あれとは味が雲泥の差なので、ちょっとコストがかかってもこちらにするのが良いと思います5種類入っているのも選択肢が増えて楽しいです
64,B07N92TDFX,トワイニング アールグレイ セレクションファイブ 50P ティーバッグ,トワイニング,プレミ,2019年6月14日,5.0,安定したおいしさ,カラフルなパッケージで、なかなかおしゃれな包装です。それぞれ香りも味もよく出ており、パックとしては十分楽しめます。ノンカフェインが一種類あるのもシーンを選ばず有難いです。好みで特定のばかり減ってしまう事もありますが、どれも質は高く、飽きずに飲める種類と個数でした。
65,B07N92TDFX,トワイニング アールグレイ セレクションファイブ 50P ティーバッグ,トワイニング,天存,2019年7月11日,5.0,気分を変えてリフレッシュしたい時に,個人的にはカフェインは全く気にならないのでデカフェタイプは物足りないのですが、それを差し引いてもアールグレイの様々なタイプが楽しめる本セットは飽きがきにくくていいとおもいます。味わいの差異を感じながら気分によって選んで飲めるのは好きです。値段もお手頃で有難いです。
66,B07N92TDFX,トワイニング アールグレイ セレクションファイブ 50P ティーバッグ,トワイニング,hiro,2019年6月8日,5.0,紙だけどパッケージが綺麗,トワイニングの紅茶、大好きです。中でもアールグレイが一番好きで、よく好んで飲みます。相変わらず香りも良く、美味しいですね。特にオレンジアールグレイの風味が良く、お気に入りです。定番のアールグレイは勿論、鉄板の美味しさですね。ベルガモットの風味が美味です。
67,B07N92TDFX,トワイニング アールグレイ セレクションファイブ 50P ティーバッグ,トワイニング,Kidd,2019年6月6日,5.0,飲み比べが楽しいセット,いつでも飲めるのが良いです。形式張らずに飲みたい時にすぐ香り高いアールグレイが楽しめます。会社で疲れたときに飲むとほっとします。正直、もっと薫り高く美味しいアールグレも沢山ありますが、これだけお値段も含めて手軽に飲めるものは少ないのではないのでしょうか？素晴らしいです。
68,B07N92TDFX,トワイニング アールグレイ セレクションファイブ 50P ティーバッグ,トワイニング,Concerto,2019年7月7日,4.0,アールグレイの飲み比べ♪,5種類のアールグレイが楽しめていいですね。オレンジアールグレイだけは少し好みじゃなかったです。オレンジは味が強めなので、アールグレイの風味に上乗せしてくる感じがしました。デカフェは夜も飲めるので助かります。
69,B07N92TDFX,トワイニング アールグレイ セレクションファイブ 50P ティーバッグ,トワイニング,犀川,2019年6月9日,3.0,お手頃,アールグレイ好きです。ジャスミンアールグレイとオレンジアールグレイは初めて飲む新鮮な味でとても気に入りました。が、50個入りとなるとさすがにちょっと多かったかも。カフェインレスアールグレイは不要かな…
70,B07N92TDFX,トワイニング アールグレイ セレクションファイブ 50P ティーバッグ,トワイニング,ts,2019年6月15日,5.0,アールグレイが堪能できる,様々な香りが付けられたアールグレイ5種類を楽しめます。ベルガモットの香りが付いた基本的なアールグレイから、柑橘系の香りを付けたものまであるので同じアールグレイとはいえ飽きません。紅茶としての美味しさも申し分ありません。
71,B07N92TDFX,トワイニング アールグレイ セレクションファイブ 50P ティーバッグ,トワイニング,若旦那パート２,2019年6月5日,5.0,アールグレイばかりで50個入り、というのは新鮮,その日の気分で5種の中から手軽に美味しい紅茶を飲めるのが良いですね。香りも味も好みです、ストレス解消に飲みながらリラックスしています。
72,B07N92TDFX,トワイニング アールグレイ セレクションファイブ 50P ティーバッグ,トワイニング,ネコ,2020年10月18日,5.0,香り付きのお湯,流石のトワイニングのアールグレイです。初めて、アールグレイあんなに色んな種類があると知りました。香り立ちが最高。
73,B07N92TDFX,トワイニング アールグレイ セレクションファイブ 50P ティーバッグ,トワイニング,関谷ひとみ,2019年8月29日,5.0,バラエティに富んでいてとても美味しい,風味・香りが命の紅茶、しっかりとしたアルミ個包装、新鮮な紅茶を飲めるのがいいですね。保存しやすいし、タンブラーにお湯をいれて一緒に持ち運びできる、作り立ての香りをお気に入りの場所で楽しめるのが便利です。こちらの商品は人工的なへんな癖が無くて、”香りの質が良い”のが飲むと分かります。香りだけではなく茶葉のうまみ旨みもしっかりしていてとてもバランスの良い味の仕上がり。濃すぎず薄すぎず、万人受けしてもらえる味わいなのでお客さんにも安心して出せる品質でアールグレイはロイヤルミルクティーにするとコクとやさしい香りで又印象の違う味わいも出てきます。Ｔバッグの手軽さで疲れた心をとっても癒してくれる香りとおいしさです(*'ω｀*)「どれを飲んでもはずれなし」カフェインは日ごろから意識してる部分があり お味も普通にアールグレイで美味しかったので、カフェインレスのアールグレイはとても良い収穫になりました(^^♪ リピ決定。
74,B07N92TDFX,トワイニング アールグレイ セレクションファイブ 50P ティーバッグ,トワイニング,美々モモ,2019年6月20日,5.0,香り立ち最高,トワイニングのアールグレイに特化したバリエーションのティーパックです。アールグレイのバリエーション違いが5種類入っています。アールグレイはもちろん、オレンジアールグレイやジャスミンアールグレイなどアールグレイの香りに加え、オレンジやジャスミンなどの香りが楽しめるのが気に入っています。また個別梱包になっていますし、それぞれそのパックにお茶の抽出時間が書かれているのが便利だと思いました。
