,ASIN,product,brand,name,date,score,title,comment
0,B07PMG8HGN,【Amazon.co.jp限定】 トワイニング ザ・ベストファイブ 50P ティーバッグ,トワイニング,みーこ,2019年10月24日,3.0,味も香りもなし。最悪,入っている種類が写真や説明と異なりました。アッサムではなく、その代わりにオレンジペコが入っていました。アッサム好きだったので残念です。以前はこの逆の事があったので（予告なしにオレンジペコが消えてアッサムに変わっていた）、その時々によって内容に変更があるのかもしれませんが、商品ページの写真と説明はこまめにアップデートしてほしいです。
1,B07PMG8HGN,【Amazon.co.jp限定】 トワイニング ザ・ベストファイブ 50P ティーバッグ,トワイニング,sako,2020年10月31日,1.0,色々な香りを楽しむことができます。,お湯を飲んでるみたいです。薄い。スーパーで買ったものと飲み比べましたが明らかに薄いです。パッケージも書いてあることも全く同じなのに、どういうことでしょう？
2,B07PMG8HGN,【Amazon.co.jp限定】 トワイニング ザ・ベストファイブ 50P ティーバッグ,トワイニング,ぷみ,2020年12月17日,3.0,アッサムが消えた,５種類あるのでいろいろな香りと味を楽しめると思い購入してみましたが、レビューにもありましたが、味が薄いような気がします。これは上品ということなんでしょうかね。タイムセールでお安かったので良しとします。
3,B07PMG8HGN,【Amazon.co.jp限定】 トワイニング ザ・ベストファイブ 50P ティーバッグ,トワイニング,クッキーが1番！,2020年3月6日,5.0,薄い。,味のチョイスがよい感じで、どれも気に入ってます。たまにカルディなどで他のを買いますが、お値段と味のバランスで満足度が高いのはこちらですね。
4,B07PMG8HGN,【Amazon.co.jp限定】 トワイニング ザ・ベストファイブ 50P ティーバッグ,トワイニング,Amazon カスタマー,2020年5月13日,2.0,やはり味は薄めのような気がします。,量に対してのコスパが良かったので購入しました。香り・味についてですが、ドンキで買ったポンパドールのハーブティーと比較するとかなり薄めです。もちろんその２つでは想定している湯量が違うとは思うので一概には言えませんが、私はリピートはしません。ただ、アールグレイ・セイロン・ダージリンの香りの違いを手軽に比べられたので、好みの茶葉を見つけるという意味では購入しても良いかと思います。
5,B07PMG8HGN,【Amazon.co.jp限定】 トワイニング ザ・ベストファイブ 50P ティーバッグ,トワイニング,転売大反対！,2019年10月14日,4.0,普通に美味しいです,紅茶好きの子供と私のために購入アソートなので色々楽しめて良かった子供は茶葉の違いが良く分かって居なかったので確認も出来て良かった9月に購入したので熱い飲み物を飲むのには抵抗が有ったのでアイスティーで使用したので減りが多かった。
6,B07PMG8HGN,【Amazon.co.jp限定】 トワイニング ザ・ベストファイブ 50P ティーバッグ,トワイニング,Take,2021年1月8日,5.0,他の方のレビュー通り、味は薄めです,トワイニングのオレンジペコが好きでいつも缶の茶葉を買っていますが、たまに違う味が飲みたい時に色々種類が入ってティーパックタイプは便利なので購入しました。密閉された個包装で5種類各10パック入りです。缶に入った茶葉より味や香りは僅かに落ちますが、トワイニングなので美味しいです。
7,B07PMG8HGN,【Amazon.co.jp限定】 トワイニング ザ・ベストファイブ 50P ティーバッグ,トワイニング,ままちゃん,2020年11月18日,1.0,アソートなので楽しめる,紅茶とココアを頼みました。いつもはダンボ－ルの中にビニ－ルで梱包されていますが、レタ－ボックスのような厚紙の中にビニ－ル梱包もなく見出しで入っていました。ですが、ボックスは四隅と入口が破れていて商品は丸見え、投入口は開封された状態で、紅茶とココアの箱は埃と細かな砂で汚れていました。最悪です、総合評価は０点です。
8,B07PMG8HGN,【Amazon.co.jp限定】 トワイニング ザ・ベストファイブ 50P ティーバッグ,トワイニング,Kindleのお客様,2020年12月27日,4.0,25ずつ買うより,いつも同じアッサムばかり飲んでいますが、これはいろんな味の紅茶を飲むことができていいです！量もちょうどよくて、リーフティーをまとめて買うと同じ味ばかりになりますが、いろんな味が適当量入っています。
9,B07PMG8HGN,【Amazon.co.jp限定】 トワイニング ザ・ベストファイブ 50P ティーバッグ,トワイニング,すずまる,2021年5月28日,5.0,まずはコレで自分探し、私はダージリンがお気に入り！,ダージリンとセイロンオレンジペコの10包入を頂き物で飲んで美味しかったので、他の味も試したくて購入。どの種類も当たり外れがなく美味しく頂きました。
10,B07PMG8HGN,【Amazon.co.jp限定】 トワイニング ザ・ベストファイブ 50P ティーバッグ,トワイニング,バーババカバー,2020年12月4日,5.0,いろんな紅茶が味わえる,手軽に香の違いが楽しめるので、自分で茶葉のブレンドをするような人も仕事の合間の息抜きに。普段あまり紅茶を飲まない人には、種類によってこんなに違いがあるのかと感動する機会を。
11,B07PMG8HGN,【Amazon.co.jp限定】 トワイニング ザ・ベストファイブ 50P ティーバッグ,トワイニング,yama,2020年8月18日,5.0,色々な味が楽しめるので良い。,美味しいです。テレワークが増えて、家で紅茶を楽しみたくなりました。
12,B07PMG8HGN,【Amazon.co.jp限定】 トワイニング ザ・ベストファイブ 50P ティーバッグ,トワイニング,くろちび,2021年1月6日,4.0,紅茶好きもそうでない人にも,ブラックフライデーで安くなっていたので購入しました。香りが前はもっと強かった記憶があるのですが思ったほど香りがなかった気がしました。とはいえ、様々な種類が沢山入っていたので良かったです。
13,B07PMG8HGN,【Amazon.co.jp限定】 トワイニング ザ・ベストファイブ 50P ティーバッグ,トワイニング,fumi,2021年1月23日,5.0,美味しい,トワイニング紅茶を毎日、選り取り見取りで飲めるので便利です。飲み比べて、それぞれの味や香りの違いにも敏感に分かるようになりましたし、全部美味しいです。
14,B07PMG8HGN,【Amazon.co.jp限定】 トワイニング ザ・ベストファイブ 50P ティーバッグ,トワイニング,アマゾニアハイウェイ,2020年10月29日,5.0,いろいろ飲めていい,普段コーヒーを常飲しているのですが、たまには・・・と注文してみました。アーマッドティーと同時購入し比較してみたのですが、アールグレイはアーマッドティーの方が香りが強く、私にはこちらのほうが飲みやすかったです。
15,B07PMG8HGN,【Amazon.co.jp限定】 トワイニング ザ・ベストファイブ 50P ティーバッグ,トワイニング,春一番,2020年4月16日,4.0,美味しく飲んでいます,ダージリン以外は香りが強すぎて好みではありません。むかしは他のメーカーのアールグレイが大好きでしたがこんなにも強い香りだとクッキーやケーキの邪魔をするなと思いながらもお湯をたっぷり注いで飲んでいます。
16,B07PMG8HGN,【Amazon.co.jp限定】 トワイニング ザ・ベストファイブ 50P ティーバッグ,トワイニング,gibs,2020年12月3日,4.0,問題なし,自分の好みの味を見つけることができます。ギフト向けかはよく分かりませんが、来客時に好みの味を選んでもらって楽しんでもらえる点は良いです。
17,B07PMG8HGN,【Amazon.co.jp限定】 トワイニング ザ・ベストファイブ 50P ティーバッグ,トワイニング,Amazon カスタマー,2021年5月10日,5.0,美味しいです,英国王室御用達のトワイトニングが5種類入っていて、飲み比べもできてとっても気に入っています。お気に入りの茶葉と、普段あまり飲まない茶葉を交互に飲んで、香りの違いを楽しんでいます。
18,B07PMG8HGN,【Amazon.co.jp限定】 トワイニング ザ・ベストファイブ 50P ティーバッグ,トワイニング,ネギトロ,2020年12月2日,5.0,好みの味を見つけられる,家族が毎日飲んでいるのでセールでとてもお得に購入できてよかったです。スーパーなどで購入する20Pのものと味も香りも変わらないそうです。
19,B07PMG8HGN,【Amazon.co.jp限定】 トワイニング ザ・ベストファイブ 50P ティーバッグ,トワイニング,プロシオン,2021年2月18日,4.0,茶葉の飲み比べ,コスパも良いし味も良い。しゃぶしゃぶする時間が少し長いのが難点だけどミントンと併用して美味しくいただいてます。
20,B07PMG8HGN,【Amazon.co.jp限定】 トワイニング ザ・ベストファイブ 50P ティーバッグ,トワイニング,にゅう,2021年1月3日,3.0,セールで630円,評価が高いので購入したのですが、少し香りが薄いです。量は多いのでたくさん飲みたい方はぜひ
21,B07PMG8HGN,【Amazon.co.jp限定】 トワイニング ザ・ベストファイブ 50P ティーバッグ,トワイニング,たま下駄,2020年5月27日,4.0,良い紅茶です,時々紅茶が飲みたくなるのですが、コストを考えるとどうしても同じ種類をたくさん買わなくてはいけないのですが、こちらは５種類入って色々楽しめるのにリーズナブルです。
22,B07PMG8HGN,【Amazon.co.jp限定】 トワイニング ザ・ベストファイブ 50P ティーバッグ,トワイニング,うほ,2020年8月4日,5.0,香りが少ない,スーパーなどに売ってるタイプと変わりありません、ただし、数が数として種類も多く定期的に紅茶をたしなむ生活において、在庫を切らしてしまう事もたまにあると思いますが、これは、５０パック入ってますので、毎日飲んでも、1月半持ちますし、2パック飲んでも、約1カ月（正確には25日間）近く持ちますのでサイクル的には丁度いい感じです、また買いたいと思います
23,B07PMG8HGN,【Amazon.co.jp限定】 トワイニング ザ・ベストファイブ 50P ティーバッグ,トワイニング,マルちゃん,2020年11月5日,5.0,色々味わえてリーズナブルです。,冬は紅茶を楽しんでいます。５種類の味が飲めるのはとても嬉しいし、価格もリーズナブルで満足しています。
24,B07PMG8HGN,【Amazon.co.jp限定】 トワイニング ザ・ベストファイブ 50P ティーバッグ,トワイニング,jiji53,2020年12月7日,5.0,モーニングティーを楽しむのに最適。,ブラックフライデーで定価より何％か安く手に入れることができました。やっぱりこの紅茶はいい香りがします。家族でちょっと紅茶を楽しむために購入しました。
25,B07PMG8HGN,【Amazon.co.jp限定】 トワイニング ザ・ベストファイブ 50P ティーバッグ,トワイニング,たく,2020年6月29日,5.0,お試しにぜひ(^^),トワイニング紅茶はいつも変わらず美味しいです。たくさん入っているのでお得に感じました。
26,B07PMG8HGN,【Amazon.co.jp限定】 トワイニング ザ・ベストファイブ 50P ティーバッグ,トワイニング,oss,2019年12月8日,4.0,香りがよく、海外では有名,紅茶は美味しいけれど近くのスーパーで買ったほうが安かったのでリピはないかな。
27,B07PMG8HGN,【Amazon.co.jp限定】 トワイニング ザ・ベストファイブ 50P ティーバッグ,トワイニング,hanna,2020年3月8日,5.0,安定の美味しさです,いろんな味があり、日によって選べるので、楽しんでいます。セット内容と数量も丁度良く思います。
28,B07PMG8HGN,【Amazon.co.jp限定】 トワイニング ザ・ベストファイブ 50P ティーバッグ,トワイニング,あきまるりん,2020年4月11日,5.0,紅茶は美味しいけれど,トワイニングの色んな味を楽しめるこの量は 日常使いに役立ちます。ちょっとしたギフトにも 喜ばれるでしょうﾈ。
29,B07PMG8HGN,【Amazon.co.jp限定】 トワイニング ザ・ベストファイブ 50P ティーバッグ,トワイニング,ゆりね,2020年11月12日,5.0,美味しいです,自分に合った紅茶です。味、量、質、パッケージ、値段、サイズ、良いと思います。
30,B07PMG8HGN,【Amazon.co.jp限定】 トワイニング ザ・ベストファイブ 50P ティーバッグ,トワイニング,suiten,2021年3月3日,4.0,ちょうどいい！,気分によって味変出来るので紅茶はいつもこれでリピートしています。ただ発送の際にダンボールではなく封筒で送られて来たせいで箱潰れが酷く、中身のパックもシワシワでした。
31,B07PMG8HGN,【Amazon.co.jp限定】 トワイニング ザ・ベストファイブ 50P ティーバッグ,トワイニング,大川内優,2021年6月19日,4.0,高級的紅茶,otoku
32,B07PMG8HGN,【Amazon.co.jp限定】 トワイニング ザ・ベストファイブ 50P ティーバッグ,トワイニング,DENKIIIIIII,2020年6月10日,5.0,今までと同じ品質！,自分が好みで飲んでいる種類が含まれているので、その日の気分で味を選べるのでとてもいいと思いました。単品を複数購入するのもいいけどたまには違ったものを飲むのもいいかなと思う方にはいいかと。
33,B07PMG8HGN,【Amazon.co.jp限定】 トワイニング ザ・ベストファイブ 50P ティーバッグ,トワイニング,戸田幸利,2020年9月19日,5.0,お得です、,香りが良く、リラックスできます。
34,B07PMG8HGN,【Amazon.co.jp限定】 トワイニング ザ・ベストファイブ 50P ティーバッグ,トワイニング,んなばかな,2020年3月14日,3.0,テイストのチョイスがいい,普通ですね。オレンジ・ペコーが意外においしかったです。
35,B07PMG8HGN,【Amazon.co.jp限定】 トワイニング ザ・ベストファイブ 50P ティーバッグ,トワイニング,mztm,2020年2月22日,1.0,普段用に,来客時になど、重宝しました。味が選べるところがいいです。
36,B07PMG8HGN,【Amazon.co.jp限定】 トワイニング ザ・ベストファイブ 50P ティーバッグ,トワイニング,Key,2020年6月25日,5.0,普通,沢山入っていて、味も選べて、文句なし！！
37,B07PMG8HGN,【Amazon.co.jp限定】 トワイニング ザ・ベストファイブ 50P ティーバッグ,トワイニング,杉,2021年2月8日,3.0,色んな味が選べる,ですが、各パック１回のみの使用らしいです。二回位使えそうな気がしますが。
38,B07PMG8HGN,【Amazon.co.jp限定】 トワイニング ザ・ベストファイブ 50P ティーバッグ,トワイニング,KogaShippo,2020年5月1日,4.0,コスパがよい,は1つで充分です。すいません…
39,B07PMG8HGN,【Amazon.co.jp限定】 トワイニング ザ・ベストファイブ 50P ティーバッグ,トワイニング,えっ？！,2019年10月5日,4.0,美味しい！,色んな種類が入っていて美味しいので数年前から飲んでいます。前より値上げされてるのが残念です。
40,B07PMG8HGN,【Amazon.co.jp限定】 トワイニング ザ・ベストファイブ 50P ティーバッグ,トワイニング,TOY,2020年8月26日,4.0,好みがあるかも,ふつうにおいしいです。5種類もあるので飽きないね。
41,B07PMG8HGN,【Amazon.co.jp限定】 トワイニング ザ・ベストファイブ 50P ティーバッグ,トワイニング,エリンギ,2020年3月31日,2.0,飽きません,他の方も書いてますが、味はやはりあまり良くないですね。全然トワイニングとは思えません
42,B07PMG8HGN,【Amazon.co.jp限定】 トワイニング ザ・ベストファイブ 50P ティーバッグ,トワイニング,晏夜,2020年6月10日,5.0,おいしい,紅茶が好きな母に送りました。特にアールグレイの香りが良かったと言ってました。人それぞれ好みも異なりますが、これは人気の高い5種類が試せるのでこちらにして良かったです。
43,B07PMG8HGN,【Amazon.co.jp限定】 トワイニング ザ・ベストファイブ 50P ティーバッグ,トワイニング,miho,2019年11月3日,5.0,残念な味,大変満足しています。
44,B07PMG8HGN,【Amazon.co.jp限定】 トワイニング ザ・ベストファイブ 50P ティーバッグ,トワイニング,かおり,2020年6月22日,5.0,人気の5種類が試せるので良い,何時も朝のひと時にホッとして頂いてます
45,B07PMG8HGN,【Amazon.co.jp限定】 トワイニング ザ・ベストファイブ 50P ティーバッグ,トワイニング,LMHH,2021年3月29日,5.0,【Amazon.co.jp限定/オレンジペコ入り】美味しい！,色々なフレーバーが入っているので、その日の気分によって選んでいます。どれもとても美味しくて、リピートしています。
46,B07PMG8HGN,【Amazon.co.jp限定】 トワイニング ザ・ベストファイブ 50P ティーバッグ,トワイニング,pumo,2019年10月9日,4.0,気楽に飲める,特に普段から売ってるものと中身はなんらかわりませんが１種類だけじゃないところがいいなぁとおもいます。その日の気分に合わせて飲める
47,B07PMG8HGN,【Amazon.co.jp限定】 トワイニング ザ・ベストファイブ 50P ティーバッグ,トワイニング,モモ,2019年8月30日,4.0,リピート商品,いまいち、
48,B07PMG8HGN,【Amazon.co.jp限定】 トワイニング ザ・ベストファイブ 50P ティーバッグ,トワイニング,生山葵,2021年5月8日,5.0,普段飲みにおすすめです,色々な味を気分を変えて楽しんでいます。
49,B07PMG8HGN,【Amazon.co.jp限定】 トワイニング ザ・ベストファイブ 50P ティーバッグ,トワイニング,前口靖代,2021年3月21日,5.0,その日の気分で選べるのが良い。,セールだったので半額で買えました！いろいろな味が楽しめてめちゃくちゃお得で良かったです！！
50,B07PMG8HGN,【Amazon.co.jp限定】 トワイニング ザ・ベストファイブ 50P ティーバッグ,トワイニング,おとたん,2020年1月3日,5.0,風味を楽しんでいます。,紅茶がとにかく欠かせません。色々なフレーバーが楽しめるのがすごくいい！飽きずに、毎日どれにしようかな？って悩むのがまた楽しいです(*^^*)
51,B07PMG8HGN,【Amazon.co.jp限定】 トワイニング ザ・ベストファイブ 50P ティーバッグ,トワイニング,Amazon カスタマー,2020年6月1日,5.0,お得！,アルミパックなので長期新鮮だと思います。
52,B07PMG8HGN,【Amazon.co.jp限定】 トワイニング ザ・ベストファイブ 50P ティーバッグ,トワイニング,風子,2020年11月27日,5.0,好みを探せれる！,安く買えました！発送も早かったです。
53,B07PMG8HGN,【Amazon.co.jp限定】 トワイニング ザ・ベストファイブ 50P ティーバッグ,トワイニング,Amazon カスタマー,2021年5月4日,5.0,5種類の味が楽しめます。,安定のおいしさ。お得です。
54,B07PMG8HGN,【Amazon.co.jp限定】 トワイニング ザ・ベストファイブ 50P ティーバッグ,トワイニング,はな,2021年2月9日,2.0,いろんな味が楽しめる,トワイニングとは思えないほど味も香りも薄いです
55,B07PMG8HGN,【Amazon.co.jp限定】 トワイニング ザ・ベストファイブ 50P ティーバッグ,トワイニング,hina,2021年2月13日,5.0,職場で飲んでます。,全部美味しくて癒されました。
56,B07PMG8HGN,【Amazon.co.jp限定】 トワイニング ザ・ベストファイブ 50P ティーバッグ,トワイニング,Matsuoka Ellen,2021年5月14日,1.0,The best 5 Twinings,熱湯で抽出しても味が薄い。
57,B07PMG8HGN,【Amazon.co.jp限定】 トワイニング ザ・ベストファイブ 50P ティーバッグ,トワイニング,Eureka,2020年6月24日,4.0,美味しい,色々味が楽しめます❗
58,B07PMG8HGN,【Amazon.co.jp限定】 トワイニング ザ・ベストファイブ 50P ティーバッグ,トワイニング,渡辺　礼子,2021年2月18日,5.0,味が薄い,好きなお茶がいっぱいある
59,B07PMG8HGN,【Amazon.co.jp限定】 トワイニング ザ・ベストファイブ 50P ティーバッグ,トワイニング,あきら,2020年11月23日,3.0,良かった‼️,味のチョイスがとても良かったです。
60,B07PMG8HGN,【Amazon.co.jp限定】 トワイニング ザ・ベストファイブ 50P ティーバッグ,トワイニング,Amazon カスタマー,2020年5月20日,5.0,大容量,また買います
61,B07PMG8HGN,【Amazon.co.jp限定】 トワイニング ザ・ベストファイブ 50P ティーバッグ,トワイニング,SWAG,2020年9月18日,3.0,フレーバーの種類がいい！,味がうすい？
62,B07PMG8HGN,【Amazon.co.jp限定】 トワイニング ザ・ベストファイブ 50P ティーバッグ,トワイニング,sgu,2020年5月30日,5.0,非常に良い,スッキリしてつかいやすい。
63,B07PMG8HGN,【Amazon.co.jp限定】 トワイニング ザ・ベストファイブ 50P ティーバッグ,トワイニング,Amazon カスタマー,2019年7月18日,4.0,うーん,AHMAD、TWININGS、Williamson の3種ブランドを同時に、少し意識して、違いを感じながら飲んでみました。以下、それぞれの感想です。◆AHMADこの中で最も 『茶葉』 の存在を感じる、しっかりした濃い味。ただし、苦みは少ない。入れ方によっては、かなり重めにもなる。香りはほどよく、主張しすぎない。初めて飲む人に 『おいしい紅茶だね』 と言わせる事が多い。ミルクティーにも、そこそこ合う。◆TWININGS（本品）抜きん出て香りが爽やかで、他のふたつとは明確な違いがある。味は軽めで、キレが良い。入れ方によっては苦みも出る。箱の説明書きではミルクティーも薦めてあるが、正直、強い香りとぶつかって、個人的にはミルクは合わないと思った。◆WilliamsonどちらかというとAHMAD に近い風味だが、それよりは少し軽く、香りと茶葉の味のどちらも強く主張しない。しかし、コクはある。色が大変綺麗で、この中ではWilliamson のみが透き通った鮮やかな紅。見栄えがする。ミルクティーは飲み易く、おそらく日本人が 『これがミルクティー』 と思っているイメージに最も近いと思われる。アールグレイだけでなく、爽やかな香りを求めるなら本品TWININGS で決まりかなという感じでした。また、すっきりした味が好きな方に合うでしょう。本品はアールグレイの他にも4種類入っていますが、どれも一定水準以上の美味しい紅茶だと思います。
64,B07PMG8HGN,【Amazon.co.jp限定】 トワイニング ザ・ベストファイブ 50P ティーバッグ,トワイニング,amazonカスタマー,2019年6月5日,5.0,バラエティに富んだ美味しい詰め合わせセット,当商品は、トワイニング紅茶のうち人気のある５銘柄のセットです。その日の気分で選ぶもよし，好みの銘柄を探してみるのもよし，いろいろと楽しめます。当方は、レディ・グレイと，オレンジ・ペコが気に入りました。ティーバック一包ずつ密閉包装されていて、香りの風味が損なわれ難くなっているのは中々良いと思います。また抽出時間が一包ずつ書かれていて，分かり易くて良いです。賞味期限は、2021年12月(2019年6月上旬モニタ)となっており，二年半ほどありました。自分用・家庭用以外にも、ちょっとしたお返しやプレゼントの選択肢としても使える商品だと思います
