,ASIN,product,brand,name,date,score,title,comment
65,B07PMG8HGN,【Amazon.co.jp限定】 トワイニング ザ・ベストファイブ 50P ティーバッグ,トワイニング,Do217,2019年6月10日,5.0,渋みが嫌いですっきりしたものを好む人向き,TWININGSのレディグレイのリーフ缶を常用していますが、ティーバッグ式の本品も十分に香りが立っています。私の中ではレディグレイが最高傑作。アールグレイとはまた違う甘い柑橘の香りが絶妙な彩りを与えていて、優しさそのもの。アールグレイは渋みがとても柔らかで、やや香りが穏やかかな。プリンスオブウェールズのしっかりした芯のある上品な味は、マグカップよりも、本格的ティーカップでじっくり味わいたいものです。TWININGSのベスト5なら、贈り物にも間違いはありません。
66,B07PMG8HGN,【Amazon.co.jp限定】 トワイニング ザ・ベストファイブ 50P ティーバッグ,トワイニング,大久保彦左衛門,2019年6月6日,5.0,トワイニング人気５銘柄セット。密閉包装で風味そのまま,アールグレイ、レディグレイ、ダージリン、セイロンオレンジペコ、プリンス オブ ウェールズの五種パックです。アールグレイ系が多めでトワイニングといえばアールグレイという方むけのパッケージかと思います。各ティーパックが厚紙の箱に入っています。一つ一つのパックは密封個別包装です。ティーパックは紙製ですがホチキスなどは不使用です。トワイニングのパッケージとしては高コスパなセレクションかと思います。
67,B07PMG8HGN,【Amazon.co.jp限定】 トワイニング ザ・ベストファイブ 50P ティーバッグ,トワイニング,ぱてぼん,2019年6月30日,4.0,レディグレイはティーバッグ式の本品も十分な香り。,5種類の紅茶のアソートですがダージリン以外はフレーバー系自分はアールグレイが好きなので良いですが濃くて渋いの好きな人にはイマイチかも個人的にはアールグレイ セレクションファイブのほうが良かったですトワイニングはどちらかというとアールグレイ推しのようですし
68,B07PMG8HGN,【Amazon.co.jp限定】 トワイニング ザ・ベストファイブ 50P ティーバッグ,トワイニング,御茶ノ水303,2019年6月14日,5.0,アールグレイ系が好きな方向け,贈り物にも最適な、ザ・ベスト5の第２弾です。第一弾は、セイロンオレンジペコ、ブレンダ―チョイス、ダージリン、アールグレイ、レディグレイでした。第2弾はアールグレイ、レディグレイ、ダージリン、プリンスオブウェールズ、セイロンオレンジペコ。普段は200g缶入りのダージリンばかり飲んでいました。今回このセットをいただいて、他のブレンドも美味しいと実感しました。日替わりでティータイムにあれこれ楽しく悩んでいます。
69,B07PMG8HGN,【Amazon.co.jp限定】 トワイニング ザ・ベストファイブ 50P ティーバッグ,トワイニング,DUNE,2019年6月13日,4.0,ダージリンさま…,トワイニングの代表的なフレーバー５種類が１箱に入っていて、飽きずに楽しめると思います。価格も１袋当たり25円ほどとお値打ちになっています。ただ、最近のトワイニングは淹れると風味が飛んでしまって、あまり香りも残らなくなってしまったように思います。一昔前は、同じようなセットが木箱に入っていて高級感があったんですけどね。普通にデイリー紅茶になりましたね。
70,B07PMG8HGN,【Amazon.co.jp限定】 トワイニング ザ・ベストファイブ 50P ティーバッグ,トワイニング,sin1,2019年6月15日,5.0,トワイニングの宝箱第２弾,アールグレイからダージリン、セイロンブレンドといった色々な味が楽しました。色々な味わいが試せてとても良かったです。後は入れ方を変えてみたりすると更に楽しめそうです。他のレビューアさんが書かれているようにミルクを入れてみるのも良いですね。スーパーで購入する日東やリプトンも好きですがトワイニングも美味しかったです。
71,B07PMG8HGN,【Amazon.co.jp限定】 トワイニング ザ・ベストファイブ 50P ティーバッグ,トワイニング,くるみ,2019年6月16日,5.0,手軽に楽しめる紅茶のセット。,お値段やすく お手軽な ティーバッグセット。5つのフレーバーが入っています。そりゃ最高級の茶葉をポットで入れるのとでは訳が違いますが家庭で手軽に飲むなら、わたしはこれで大満足です。個別の包装、箱、共にデザインが非常に美しく上品なパッケージです。
72,B07PMG8HGN,【Amazon.co.jp限定】 トワイニング ザ・ベストファイブ 50P ティーバッグ,トワイニング,Amazonカスタマー,2019年6月27日,5.0,好みを探したり、気分を変えたり,安定のトワイニングさんの味が沢山楽しめるのが良かったです。お茶休憩などが挟まれるような長めの打ち合わせや研修、ワークショップの際に重宝しそうだなと思いました。紅茶に詳しい人ならともかく、「ちょっと贅沢」な印象を与えるのに良いと思います。
73,B07PMG8HGN,【Amazon.co.jp限定】 トワイニング ザ・ベストファイブ 50P ティーバッグ,トワイニング,ちゃらもん,2019年7月3日,5.0,定番の美味しさ。,これぞ紅茶という感じの、わかりやすい味のアソートです。安いのに個包装されているのがいいですね。すっきりとした味のものばかりなので、ゆったりとしたティータイムだけでなく、日常でゴクゴク飲めるものが多いのが嬉しいです。
74,B07PMG8HGN,【Amazon.co.jp限定】 トワイニング ザ・ベストファイブ 50P ティーバッグ,トワイニング,33,2019年6月10日,4.0,ちょっと贅沢な印象を,トワイニングの紅茶、大好きです。特にアールグレイが好きで、以前からよく好んで飲んでいます。ティーバッグの割には風味が良く、香りも良好。美味しいです。特にレディグレイがお気に入りです。
75,B07PMG8HGN,【Amazon.co.jp限定】 トワイニング ザ・ベストファイブ 50P ティーバッグ,トワイニング,sorano,2019年8月4日,4.0,飲みやすい味が揃っている,メジャーなものですし味わいも確立されており、美味しいです。Amazon限定のバージョンでは通常品と比べ1種入れ替わっているようですが値段がかなり安く設定されており嬉しいところです。
76,B07PMG8HGN,【Amazon.co.jp限定】 トワイニング ザ・ベストファイブ 50P ティーバッグ,トワイニング,Concerto,2019年6月8日,4.0,どれも美味しい,ベスト5だけあってどれも個性豊かで美味しいです。もともとオフィスでトワイニングシリーズは飲み始めたのですが、自宅でも簡単に1人でも楽しめます。ティーバッグの手軽さがよく良い面にでたパックだと思います。
77,B07PMG8HGN,【Amazon.co.jp限定】 トワイニング ザ・ベストファイブ 50P ティーバッグ,トワイニング,Kidd,2019年6月15日,5.0,人気の味わい5種が楽しめる,1袋25円程度ですから、気軽に飲めます。正直言って「ものすごくおいしい」というより、飲みやすさが売りだと思います。1日に何杯か飲むので、毎回違う種類を楽しめることで満足しています。
78,B07PMG8HGN,【Amazon.co.jp限定】 トワイニング ザ・ベストファイブ 50P ティーバッグ,トワイニング,プレミ,2020年11月22日,5.0,ハズレないです,安いわりにちゃんと出ます。かなり細かく粉砕してるらしいです。安いなら安心して買いますよ。
79,B07PMG8HGN,【Amazon.co.jp限定】 トワイニング ザ・ベストファイブ 50P ティーバッグ,トワイニング,若旦那パート２,2021年6月17日,5.0,お得にいろいろな味を楽しめて満足です,トワイニングの紅茶はよく成城石井等で購入しているのですが、Amazonでコスパよく買え、お得でした( ¨̮ )︎︎❤︎︎フレーバーも美味しく満足しました。
80,B07PMG8HGN,【Amazon.co.jp限定】 トワイニング ザ・ベストファイブ 50P ティーバッグ,トワイニング,なっちゃん,2020年11月15日,4.0,5種類どれも美味しい,自宅で飲むのに買いました。セール期間だったのでラッキーでした。
81,B07PMG8HGN,【Amazon.co.jp限定】 トワイニング ザ・ベストファイブ 50P ティーバッグ,トワイニング,40年前の地図,2020年7月18日,5.0,定番が５０P,紅茶といえば、真っ先に英国が思い浮かびます。日本では紅茶は嗜好品という扱いですが、英国では日用品という扱いらしいです。紅茶の首都とも言える英国の文化を気軽に楽しめます。さて、このパッケージは5種類の風味の紅茶を楽しめるバラエティパックということで、その日によって飲む紅茶を変えられるのが楽しみです。気分によって飲む紅茶を変えるというのは贅沢な楽しみ方だと感じます。
82,B07PMG8HGN,【Amazon.co.jp限定】 トワイニング ザ・ベストファイブ 50P ティーバッグ,トワイニング,Amazon カスタマー,2020年12月14日,5.0,自宅では良かった,ダージリンが若干、味うすめかな？　と思うものの、冬は消費大なので満足しています。レディグレイが得に美味しいです。バーゲンで半額になった時は嬉しすぎました。ありがとうございます。またぜひ企画してください。
83,B07PMG8HGN,【Amazon.co.jp限定】 トワイニング ザ・ベストファイブ 50P ティーバッグ,トワイニング,エヌ氏,2021年2月1日,5.0,本格的な英国紅茶をいろいろ試せる,トワイニングの紅茶は大好きなのですが、茶葉から紅茶を入れるのに手間がかかるので、手っ取り早く紅茶を飲みたい時には最適。その時の気分で種類を選べるので飽きが来ない。ただ、種類の選択がもう少し沢山あればいいと思いました。自分でセレクトできるセットとかあればいいのに！
84,B07PMG8HGN,【Amazon.co.jp限定】 トワイニング ザ・ベストファイブ 50P ティーバッグ,トワイニング,イタチの手袋,2020年1月8日,5.0,半額企画が嬉しすぎ,アソートなのでいろんなフレーバーを楽しめる。よほどの紅茶好きでもなければ、そんなにたくさんのフレーバーを葉っぱで買うことはないのではないかと思うけれど、こういうのだとその日の気分で「今日はアールグレイにしよっかな～」と選べて、そんな小さなところだけれどちょっとした幸せがある。
85,B07PMG8HGN,【Amazon.co.jp限定】 トワイニング ザ・ベストファイブ 50P ティーバッグ,トワイニング,うららウサギ,2020年3月2日,5.0,ティーバックは時間のない時に最適,こちらはアソートなので、1缶を購入するより、お試しにもぴったりなので購入しました。私は最近コーヒーより紅茶派なので色んな香りを楽しみながら、毎日飲み比べています。お気にりも見つかったので、今度は缶入りを購入したいと思います。
86,B07PMG8HGN,【Amazon.co.jp限定】 トワイニング ザ・ベストファイブ 50P ティーバッグ,トワイニング,えび,2020年12月5日,5.0,こういう小さなところで,紅茶って言うとダージリンが有名です有名すぎて、紅茶＝ダージリン味の固定観念が…。そんなときにトワイニングの複数テーバックは手軽に各種味が楽しめます
87,B07PMG8HGN,【Amazon.co.jp限定】 トワイニング ザ・ベストファイブ 50P ティーバッグ,トワイニング,わかにゃ,2019年8月20日,5.0,お試しにもぴったり,紅茶にとんと無頓着な私にはもってこいの商品です。気が向いたときに、適当に選んでは味と香りの違いを楽しんでいます。
88,B07PMG8HGN,【Amazon.co.jp限定】 トワイニング ザ・ベストファイブ 50P ティーバッグ,トワイニング,pee,2021年4月17日,5.0,充分美味しい,香りが良い
89,B07PMG8HGN,【Amazon.co.jp限定】 トワイニング ザ・ベストファイブ 50P ティーバッグ,トワイニング,企画や,2019年6月6日,5.0,いつも通り美味しいです。,1つずつ個包装パウチされているので香が逃げない、持ち運びできる、てきとうな引き出しの中に”ほいっ”と閉まって置けて便利。これからの季節は”湿気”があるのでこの個包装は必須だとおもいます。ダージリンの爽やかな渋みは小倉あんと◎どちらも引き立って美味しいです。3時のおやつを欠かさない私なのでダージリンが一番早くなくなりそう(*'▽｀*)オレンジペコとプリンスオブウェールズは穏やかなあじわいと優しい風味、二杯目にえらぶと丁度いい感じです。アールグレイ/レディ・グレイは香りがしっかりなので気分がリフレッシュできる味わいです。この二つは映画や本をよみながらホットでブランデーをあわせて「うまい」してます。ブランデーを多めにいれても香りが消えず、二つの香りの相性も大好き。至福のひと時になってます(^^♪銀河英雄伝説というアニメ作品があるのですが、ヤン・ウェンリーというキャラクターが紅茶のブランデー割りをよくのんでいて、そこから私も作品に浸るように飲み始めたのがきっかけになります、・・確か高校1年せｹﾞﾌﾝｹﾞﾌﾝ。旧作をお奨めしたのですが、Amazonプライムには新作しかありませんでした('；ω；`)是非一度ブランデー紅茶を旧作に触れつつ味わってみてください。
90,B07PMG8HGN,【Amazon.co.jp限定】 トワイニング ザ・ベストファイブ 50P ティーバッグ,トワイニング,キオラ,2019年6月20日,5.0,大好き,トワイニングでも人気の5種類のフレーバーをセットにしたバリエーションのティーパックです。アールグレイ、ダージリンなどの定番から、個人的にはレディグレイやプリンス・オブ・ウェールズなど普段はあまりチョイスしない紅茶など、バリエーション違いが5種類入っています。その時々の気分で好きな香りが楽しめるのが気に入っています。また個別梱包になっていますし、それぞれそのパックにお茶の抽出時間が書かれているのが便利だと思いました。仕事のちょっとした息抜きにこの紅茶の豊かな香りでリラックスできるのでオススメです。
